"Date","Time","screen_name","text","hashtags"
"2014-05-21 ","16:23:59","RepSarbanes","Can't make it to DC for the #SoundTheAlarm4Climate rally? Tune in here to watch live at 4pm https://t.co/TAu6sqnqiq","SoundTheAlarm4Climate"
"2014-05-21 ","15:19:04","RepSarbanes","MDers can't afford to ignore sea-level rise &amp; other devastating efx of climate change, so today I'm rallying to #SoundTheAlarm4Climate","SoundTheAlarm4Climate"
"2013-06-05 ","17:59:02","RepSarbanes","President Obama talked about the tremendous contributions @Ravens players make to #Baltimore on and off the field http://t.co/wIm4N0gJ0o","Baltimore"
"2013-06-05 ","17:52:23","RepSarbanes","Had a great afternoon w/ some of my Team MD colleagues at the White House to celebrate the @Ravens Super Bowl victory http://t.co/GRFKIT845h",
"2013-04-19 ","17:20:45","RepSarbanes","Had a great morning at #MDSBW2013 awards. Small businesses are economic engines that keep our economy on the move http://t.co/Zhu8TqGnay","MDSBW2013"
"2013-03-11 ","20:51:34","RepSarbanes","ATTN #MD high school seniors - @northropgrumman is awarding scholarships to students pursuing careers in engineering http://t.co/9JC47wCJY4","MD"
"2013-03-11 ","16:04:07","RepSarbanes","Was happy to walk in the annual #SaintPatrick's @BaltimoreParade yesterday. It was a perfect #Baltimore day! http://t.co/AQJbodr52L","SaintPatrick Baltimore"
"2012-12-12 ","19:55:32","RepSarbanes","MD has @HHSGov approval to operate Maryland Health Connection in 2014 http://t.co/cd5nvIKy This is great news for #MD families &amp; small biz.","MD"
"2012-12-12 ","17:52:11","RepSarbanes","It's time for Congress to #DoTheRightThing in #FiscalCliff negotiations: protect middle class families &amp; small biz from tax increases.","DoTheRightThing FiscalCliff"
"2012-09-25 ","20:29:23","RepSarbanes","Enjoyed visit to Arlington Elem to announce $7.4M for STEM ed w @SenatorBarb @SenatorCardin @MayorSRB &amp; Cong. Cummings http://t.co/sqqwPic1",
"2016-09-21 ","20:12:31","Call_Me_Dutch","Just had the AWESOME honor of mtg #MD02 #Dundalk's own TSgt Sharry Barnshaw, 1 of 12 @usairforce Outstanding Airmen of the Year for 2015! https://t.co/1lVufa5g1a","MD02 Dundalk"
"2016-09-21 ","15:17:08","Call_Me_Dutch","Couldn't agree w/ Tom Ridge more on needing info-sharing to stop cyber attacks: https://t.co/6IbUNtS8NT via @YahooFinance",
"2016-07-15 ","01:48:22","Call_Me_Dutch","Struggling for right words after #nicefrance attack. America stands with France. Thoughts and prayers with all affected.","nicefrance"
"2016-02-23 ","15:23:58","Call_Me_Dutch","Joined MD's Chief Life-Saver, @UMMC #shocktrauma's Tom Scalea last night w/ the @CoalitionNTR on the Hill! https://t.co/nvlEq02btE","shocktrauma"
"2016-02-18 ","19:41:40","Call_Me_Dutch","As a Member of Congress, I can't think of a more important… https://t.co/lTHnJSRa6s",
"2015-09-29 ","21:21:01","Call_Me_Dutch","Good points, DNI Clapper. This cyber deal helps to secure private IP. Good first step to make the US #CyberStrong http://t.co/Oqg5CqUDL7","CyberStrong"
"2015-09-29 ","20:55:47","Call_Me_Dutch","@realDonaldTrump This is why we need to pass comprehensive, #cybersecurity legislation http://t.co/f2HVZBoF7t","cybersecurity"
"2015-09-29 ","16:09:43","Call_Me_Dutch","3,000+ jobs and reliable/speedy service for consumers... @amazon opened its Baltimore facility! #BaltimoreJobs http://t.co/eNtfcqdRCS","BaltimoreJobs"
"2015-09-29 ","15:44:33","Call_Me_Dutch","I thanked Dr Susan Myers for her family's sacrifice. @stjohnprop dedicated a memorial to her late husband MGen Greene http://t.co/AIZ1Qwkf8j",
"2015-09-29 ","01:56:33","Call_Me_Dutch","Joining with my colleague to help support small businesses-I'm now on the #SmallBrewers Caucus #NationalDrinkBeerDay https://t.co/fzTloU7IZO","SmallBrewers NationalDrinkBeerDay"
"2015-07-14 ","18:57:40","Call_Me_Dutch","Congrats to team @JHUAPL in #Laurel Maryland for making @NASANewHorizons #PlutoFlyby a reality!","Laurel PlutoFlyby"
"2015-07-14 ","15:57:44","Call_Me_Dutch","Enjoyed a visit w/ the employees of @BaltTruckCenter @NADAUpdate yesterday in #MD02 #Linthicum! http://t.co/HJEThZB3JE","MD02 Linthicum"
"2015-06-09 ","15:31:50","Call_Me_Dutch","#TeamDutch's Justin just discussed reducing homelessness among veterans w/ @VAREPNational. Thx for your advocacy! http://t.co/LbgmbZMRBY","TeamDutch"
"2015-06-09 ","15:20:11","Call_Me_Dutch","#TeamDutch's Danielle honored #MD02 constituent Peter DeGuzman as he became an #EagleScout @boyscouts last weekend! http://t.co/AJDGgj1JM0","TeamDutch MD02 EagleScout"
"2014-10-22 ","16:27:11","Call_Me_Dutch","Enjoying #seniorexpo w/ @BaltCoGov @kevinkamenetz http://t.co/OMyxy5GZiq","seniorexpo"
"2014-10-22 ","15:14:10","Call_Me_Dutch","@Kachilihu we enjoyed having you,  Kara!",
"2014-04-01 ","18:29:17","Call_Me_Dutch","Great dialogue today with a group of religious leaders from #MD02! Lots of great ideas and common ground http://t.co/A6XGh9AuIJ","MD02"
"2013-07-24 ","20:35:45","Call_Me_Dutch","Enjoyed lunch w/ our interns from the Washington + Timonium offices today. What a great group of talented students http://t.co/wLzvo3Lyom",
"2013-07-24 ","18:36:12","Call_Me_Dutch","Just received a brass key for ""unlocking the potential"" of children of @KennedyKrieger. What an honor!  http://t.co/J0zYR1wexj",
"2013-07-24 ","14:11:38","Call_Me_Dutch","Politics aside, health care reform goes underway Oct 1 for individuals. Just posted a ""Reform 101"" to help explain: http://t.co/7F1jZ8hfgR",
"2013-06-05 ","21:24:51","Call_Me_Dutch","@FisherHouseFdtn likewise! The programs would not be as successful as they are without your stewardship.",
"2013-06-05 ","16:13:23","Call_Me_Dutch","Hey @whitehouse - I have on MY purple!! @Ravens",
"2013-06-05 ","14:36:06","Call_Me_Dutch","Just received the ""Patriot Award"" from @FisherHouseFdtn for my programs helping wounded warriors! Read more: http: http://t.co/oNkuXws0cq",
"2013-06-05 ","00:41:03","Call_Me_Dutch","House just passed bill that includes $ for #MD02 military facilties. More: http://t.co/ixswWorN5L","MD02"
"2013-04-19 ","15:09:03","Call_Me_Dutch","Updating the Baltimore media on the Boston situation.  Thoughts are with those in Watertown.",
"2012-12-12 ","17:12:49","Call_Me_Dutch","Support our wounded warriors! Click here to vote for Hero Miles in the @United 10 Million Charity Miles Giveaway: http://t.co/pOJGPrO9",
"2012-12-12 ","16:49:08","Call_Me_Dutch","Honored this wknd to meet sailors from MD aboard the @stennis74 in the Persian Gulf - thanked them for MD and USA! http://t.co/CB8Q0euy",
"2012-09-25 ","18:24:17","Call_Me_Dutch","The deadline to register to vote in Maryland is Oct 16! Exercise your right to have a say. http://t.co/IW2Bbtkx #VoteReady","VoteReady"
"2012-08-03 ","18:56:09","Call_Me_Dutch","@USPAKFoundation I enjoyed communicating with you!",
"2012-08-03 ","18:52:32","Call_Me_Dutch","@MichaelPhelps Congrats on 21!  The QUANTITY of your medals is astounding but the QUALITY of your sportsmanship makes Bmore most proud!",
"2012-08-03 ","16:00:07","Call_Me_Dutch","Congress this week passed a bill setting reasonable restrictions on protests @ military funerals. I support this 100% http://t.co/52D0yPBi",
"2012-08-03 ","14:52:01","Call_Me_Dutch","Voted against official adjournment for the August recess last night. We should be getting to work creating jobs + fixing the tax system.",
"2012-07-18 ","16:30:52","Call_Me_Dutch","Heading 2 Rosedale 2 help open a new manufacturing plant! SunDial is creating new jobs for MD + protecting the troops.",
"2012-07-18 ","13:50:58","Call_Me_Dutch","Team MD helped secure $12M to improve @BWI_Airport runways @SenatorCardin @SenatorBarb @RepJohnSarbanes  http://t.co/5OAaRi8w",
"2012-05-18 ","17:34:13","Call_Me_Dutch","Dutch on #NDAA: Like the Triple Crown, our national security isn’t just about muscle and speed – it’s about strategy. http://t.co/Y8QNIYat","NDAA"
"2012-05-18 ","15:03:41","Call_Me_Dutch","Tomorrow, @SpaceX could become 1st company 2 launch a rocket set to dock @ the space station. G'luck! We need strong private-sector partners",
"2012-03-31 ","19:01:56","Call_Me_Dutch","I'll be on @CNN  tomorrow at 9 AM talking foreign policy with Candy Crowley. Tune in!",
"2016-07-15 ","20:24:07","RepRichardNeal","Looking forward to visiting Great Barrington on Monday morning to announce federal grant for the Fire Department.",
"2016-07-15 ","18:44:18","RepRichardNeal","Please join me on July 19th at Berkshire Community College for a showing of ""Heroin: Cape Cod, USA."" https://t.co/7gXq5WYkgz",
"2014-05-21 ","20:36:44","RepRichardNeal","I'll be live on @WHYN560 with Brad and Bo tomorrow at 8:05am.",
"2013-04-19 ","00:34:05","RepRichardNeal","I was honored to join President Obama and my colleagues in the Massachusetts Congressional Delegation on Air... http://t.co/qSv3iYgEmb",
"2013-03-11 ","13:51:26","RepRichardNeal","Strengthening our nation’s infrastructure is not a Democratic or Republican issue, it just makes common sense. My... http://t.co/iqJFJWyv3D",
"2014-02-18 ","14:44:20","BarneyFrank","Looking forward to @SquawkStreet this morning to discuss the US decision to allow banks to do business with licensed Pot Shops @CNBC",
"2014-05-21 ","21:22:49","RepTierney","Why the #ByThePeople Act could change campaign finance to maximize the power of the many, not the money: http://t.co/QfQ5rQmdoa","ByThePeople"
"2014-04-01 ","13:46:07","RepTierney","Today President Obama celebrated the @RedSox 2013 World Series Championship at a ceremony at the @WhiteHouse. Let’s do it again this year!",
"2014-02-18 ","20:51:47","RepTierney","Non-partisan CBO reports that raising min wage to $10.10 can increase pay for low-income workers by $31Billion. #RaiseTheWage #Timefor1010","RaiseTheWage Timefor1010"
"2013-07-24 ","23:11:41","RepTierney","To all who have inquired, I just voted in favor of the Amash-Conyers amendment. Thanks for weighing in. #NSA","NSA"
"2013-07-24 ","19:49:19","RepTierney","A good job, a good education, a secure home, a safe retirement, and quality health care—that’s #ABetterBargain for middle-class security","ABetterBargain"
"2013-06-05 ","17:11:39","RepTierney","26 days until student loan rates double to 6.8%. Time for GOP to join Dems in keeping college w/in reach for every student #DontDoubleMyRate","DontDoubleMyRate"
"2013-04-19 ","19:59:15","RepTierney","For the latest information about the ""shelter in place"" order and other safety instructions, monitor @MassEMA and http://t.co/EGexpTkWsA",
"2013-04-19 ","16:07:18","RepTierney","Deeply saddened by the death of Officer Sean Collier. My heart goes out to his family &amp; the #Wilmington community. http://t.co/hS7iMWIUFm","Wilmington"
"2013-03-11 ","19:24:52","RepTierney","Congrats Riley McCarthy, this year’s Congressional art competition grand prize winner. http://t.co/cNwOWlilDj",
"2012-12-12 ","17:50:39","RepTierney","While #FiscalCliff solution is negotiated, Congress should #DoTheRightThing: protect middle class families &amp; small biz from tax increase.","FiscalCliff DoTheRightThing"
"2016-07-15 ","00:48:26","RepMikeCapuano","We stand with Nice.",
"2016-07-05 ","19:00:12","RepMikeCapuano","Welcome to my official Twitter account, which might just come in handy the next time the Speaker shuts the cameras off on the House floor.",
"2016-09-21 ","21:43:21","RepStephenLynch","In case you missed it, I asked #Mylan about profits they are making off the American people who rely on #EpiPens. It is a disgrace. https://t.co/xF7SIHCjHh","Mylan EpiPens"
"2016-09-21 ","20:29:44","RepStephenLynch","It's disgraceful what's going on here. You are showing what's wrong with the system. This is disgusting. #EpiPens #Mylan","EpiPens Mylan"
"2016-09-21 ","20:28:58","RepStephenLynch","You are showing blatant disregard for people who need the #EpiPen. People in my district can't afford $600 and aren't getting discounts.","EpiPen"
"2016-09-21 ","20:28:01","RepStephenLynch","The numbers don't add up. Hard to believe you are only making $50 in profit when you just increased the price by more than $100 per pen.",
"2016-09-21 ","20:26:55","RepStephenLynch","Let's find out the profits you are making on each #EpiPen you sell.","EpiPen"
"2016-09-21 ","20:26:19","RepStephenLynch","Take another crack at the profits you are making off the American people who need #Epipens. The documents you gave us are totally deficient.","Epipens"
"2016-09-21 ","20:24:42","RepStephenLynch","Recently called on @GOPoversight to hold hearing on #Mylan pricing practices after #EpiPen's dramatic cost increase https://t.co/zP9nu4fvHg","Mylan EpiPen"
"2016-09-21 ","20:24:30","RepStephenLynch","Speaking now at the @OversightDems hearing: Reviewing the Rising Price of #EpiPens. Watch live on @cspan or online: https://t.co/QuVM68j469","EpiPens"
"2016-09-21 ","16:27:48","RepStephenLynch","Joining @jimbraude @MargeryEagan live on @wgbhnews @BosPublicRadio. Listen online: https://t.co/Sugd3KtSF8",
"2016-09-21 ","14:33:23","RepStephenLynch","Speaking with @DoreyScheimer for @fox25news @SharmanTV about #nationalsecurity and the recent bombings in #NJ and #NYC https://t.co/HTtLxAdw0c","nationalsecurity NJ NYC"
"2016-07-15 ","18:07:23","RepStephenLynch","Earlier today, I released a statement on the expected declassification of the #28Pages https://t.co/0W1OqfxjiQ","28Pages"
"2016-07-15 ","18:05:03","RepStephenLynch","I am extremely pleased the #28pages are available for families of 911 victims and the American people to read. https://t.co/pGBzi2aNKV","28pages"
"2016-07-15 ","14:58:44","RepStephenLynch","Speaking with @GeorgeColli of @fox25news about today's @OversightDems hearing, the #Nice attack, and the #28pages. https://t.co/qy0WPg0cn0","Nice 28pages"
"2016-07-15 ","13:25:58","RepStephenLynch","I look forward to discussing with our witnesses what steps we can take to further strengthen Urban Area Security Initiative Grant Program.",
"2016-07-15 ","13:25:42","RepStephenLynch","Primary reason Orlando lost funding is that Congress imposed additional guidance &amp; restrictions for #DHS to distribute #UASI funding.","DHS UASI"
"2016-07-15 ","13:24:33","RepStephenLynch","For an area that experienced terrorist attack by shooter who pledged allegiance to Islamic State, lack of assistance merits re-examination.",
"2016-07-15 ","13:23:15","RepStephenLynch","While Orlando-Kissimmee-Sanford area received nearly $45M in funding from '04-'12, the area did not qualify for assistance in '13, '15, '16.",
"2016-07-15 ","13:22:02","RepStephenLynch","Oversight will ensure that no city is arbitrarily or unjustifiably denied this assistance.",
"2016-07-15 ","13:21:42","RepStephenLynch","Given importance of these grants to anti-terrorism preparedness &amp;response, it's imperative we conduct meaningful oversight of the program",
"2016-07-15 ","13:20:37","RepStephenLynch","The nearly $18M Boston received in #UASI funding in 2013 proved critical in the midst &amp; aftermath of devastating Boston Marathon bombings","UASI"
"2016-07-15 ","13:19:50","RepStephenLynch","#Boston, #Orlando, &amp; other cities have had issues receiving this funding in the past. We need to ensure cities receive funding they need.","Boston Orlando"
"2016-07-15 ","13:18:30","RepStephenLynch","The purpose of the Urban Area Security Initiative is to assist cities in their anti-terrorism preparedness and response efforts.",
"2016-07-15 ","13:17:55","RepStephenLynch","Thanks to our witnesses for dedicated public service in the wake of the devastating terrorist attack and mass shooting at Pulse Nightclub",
"2016-07-15 ","13:17:31","RepStephenLynch","Before we begin, our thoughts and prayers go out to all of the victims and their families in last night's horrific terrorist attack in #Nice","Nice"
"2016-07-15 ","13:15:36","RepStephenLynch","Speaking now @OversightDems #NationalSecurity hearing ""Oversight of Urban Area Security Initiative Grant Program"" https://t.co/UnyexAgHel","NationalSecurity"
"2016-06-10 ","15:21:58","RepStephenLynch","Important to ensure #TSA has resources to secure our airports, train and retain officers, and reduce wait times. https://t.co/S7rn3XaZzm","TSA"
"2016-02-23 ","12:25:04","RepStephenLynch","Tune in 680 AM @WRKO680 @BostonDotCom Morning Show with @kkcarrigan. I'll be in studio for an interview at 7:35 AM. https://t.co/DJFZONw2Vd",
"2015-11-25 ","13:00:22","RepStephenLynch","In case you missed it, I sat down with @sue_oconnell1 on @NECN #Broadside to discuss the refugee vetting process. https://t.co/piCDmQfuRd","Broadside"
"2015-09-29 ","19:42:24","RepStephenLynch","Demonstrates our commitment to the dedicated #woundedwarriors continuing their service to our country by entering the federal workforce.","woundedwarriors"
"2015-09-29 ","19:42:08","RepStephenLynch","The legislation affords our #woundedwarriors flexibility to receive medical care as they transition to serving our nation in a new capacity.","woundedwarriors"
"2015-09-29 ","19:41:51","RepStephenLynch","Proud to announce the bipartisan passage of the #WoundedWarriors Federal Leave Act. http://t.co/nxbdRq5VXO","WoundedWarriors"
"2015-07-14 ","23:22:57","RepStephenLynch","Tune in to @wbznewsradio at 8:00 PM. I'll be discussing the #IranDeal with Dan Rea @WBZNightside","IranDeal"
"2015-07-14 ","22:02:39","RepStephenLynch","These services help maximize the independence and well being of senior citizens. #Congress can play an important role by reauthorizing #OAA.","Congress OAA"
"2015-07-14 ","22:02:12","RepStephenLynch","From meals on wheels to family caregiver support, Older Americans Act incorporates a wide array of services that Americans depend on. #OAA50","OAA50"
"2015-07-14 ","18:43:40","RepStephenLynch","The #IranDeal is comprehensive. Look forward to drilling down on each provision in order to evaluate responsibly. http://t.co/cBKIY7FIsQ","IranDeal"
"2015-06-15 ","22:54:53","RepStephenLynch","Congrats #Norwood High grad Bella Aspinwall! Honored to nominate Bella to @NavalAcademy. She will make #MA08 proud! http://t.co/CEbmqRciBZ","Norwood MA08"
"2014-10-22 ","19:06:16","RepStephenLynch","Sending heartfelt thoughts and prayers to our friends in Canada today.",
"2014-05-21 ","19:18:45","RepStephenLynch","Rep. Lynch spoke on the floor yesterday in support of the Water Resources Reform &amp; Development Act. Watch: https://t.co/KWGSqlpfbN #mapoli","mapoli"
"2014-02-18 ","17:55:49","RepStephenLynch","Last week, President Obama signed the Farenthold-Lynch Bill to enhance security clearance oversight. Read here: http://t.co/FpxWD46JBf",
"2014-02-18 ","15:43:18","RepStephenLynch","Rep. Lynch’s security clearance reform legislation was highlighted in this Sunday’s @WashingtonPost. Full article: http://t.co/1egThqRLYD",
"2013-07-24 ","20:12:22","RepStephenLynch","Congressman Lynch now speaking on H.R. 1541, the Common Sense in Compensation Act for an Amendment in the Nature of a Substitute.",
"2013-07-24 ","19:53:24","RepStephenLynch","Congressman Lynch's PATH Act statement: http://t.co/2nwdLjhBye #PATHtoNowhere @FSCDems","PATHtoNowhere"
"2013-07-24 ","16:43:26","RepStephenLynch","The current #postalreform bill would significantly expedite review for consolidation/closure of post offices &amp; limit community input.","postalreform"
"2013-07-24 ","16:16:38","RepStephenLynch","The elimination of door-to-door delivery in the 8th District is unfeasible.  #postalreform","postalreform"
"2013-07-24 ","15:02:11","RepStephenLynch","SFL speaking right now on the Postal Reform Act Mark Up: http://t.co/Ze3xEr2Q5M @OversightDems",
"2013-07-24 ","14:57:50","RepStephenLynch","#HR2767 turns the housing market over to the biggest Wall Street banks that fueled the housing bubble and accelerated the financial crisis.","HR2767"
"2013-07-24 ","14:56:22","RepStephenLynch","I am disappointed that my GOP colleagues have insisted on going forward with an extreme bill that would damage our housing finance system.",
"2013-06-05 ","20:16:56","RepStephenLynch","Generations of trades workers, by the sweat of their brows and the toil of their hands, built our great Nation. They deserve our respect.",
"2013-06-05 ","20:15:12","RepStephenLynch","Without Davis-Bacon protection, unscrupulous contractors will be free to exploit tradesmen/women who face high levels of unemployment.",
"2013-06-05 ","20:13:19","RepStephenLynch","Davis-Bacon protects workers by preventing wage exploitation while still ensuring that the value &amp; work quality are not compromised.",
"2013-06-05 ","20:09:09","RepStephenLynch","I have worked on Davis-Bacon jobs as an ironworker &amp; I am very proud to work with the men and women of the building trades.",
"2013-06-05 ","17:35:37","RepStephenLynch","Watch Congressman Lynch speak on the floor in defense of the Davis-Bacon Act. VIDEO: http://t.co/0b2RTMeHPx",
"2013-04-19 ","19:44:00","RepStephenLynch","Please stay safe and follow any instructions from law enforcement.  Visit the MEMA website for updated information. http://t.co/mMhNZoTbLC",
"2014-10-22 ","16:42:39","USRepKeating","@RepJoeKennedy and I had some great conversations at the Coffee with Your Congressmen in #FallRiver today #ma09 http://t.co/Sp9vSyvFTk","FallRiver ma09"
"2013-04-19 ","19:20:43","USRepKeating","My thoughts &amp; prayers continue to be with residents and law enforcement in Boston &amp; surrounding areas and hope all stay safe. #bostonstrong","bostonstrong"
"2013-04-19 ","19:16:28","USRepKeating","@UmassD will be closed Saturday, April 20. Students please follow @UmassD for further updates.",
"2013-03-11 ","22:23:41","USRepKeating","Federal #Fishing Advisory Board's Chief Initiative – End to End Review – Moves Forward
http://t.co/pLkvCDDOTl #mapoli #ma09","Fishing mapoli ma09"
"2012-07-18 ","17:11:16","USRepKeating","... Tomorrow there will be a press conference to discuss the legislation: http://t.co/Z1rvIyVS #mapoli","mapoli"
"2012-07-18 ","17:07:47","USRepKeating","Keating &amp; @Rep_BonoMack introduce 1st fed leg to promote tamper-resistant technologies in addictive painkillers. #mapoli...","mapoli"
"2012-07-18 ","14:24:46","USRepKeating","Proud to co-sign @RepTierney letter calling for Reform in #Fisheries Management Law. http://t.co/kesZoMJN #mapoli","Fisheries mapoli"
"2011-10-10 ","19:42:42","USRepKeating","Join me in #Weymouth tomorrow for a Forum on why Social Sec & Medicare need to be preserved. #ma10 #mapoli http://t.co/lfa8UTZn","Weymouth ma10 mapoli"
"2011-01-13 ","14:49:05","USRepKeating","Isolating islanders ""from available info about Soc Sec benefits is unacceptable"" http://ow.ly/3Db49 #mapoli #Nantucket #Martha's Vineyard","mapoli Nantucket Martha"
"2011-01-13 ","02:27:47","USRepKeating","Please follow my Congressional Facebook Page http://tinyurl.com/4c8kall #ma10 #mapoli","ma10 mapoli"
"2011-01-13 ","02:13:52","USRepKeating","My interview on #Provincetown Community Television http://t.co/BoholOv #mapoli #ma10","Provincetown mapoli ma10"
"2011-01-10 ","21:47:15","USRepKeating","http://twitvid.com/TLZ6C - Observing a National Moment of Silence for the victims of the Arizona tragedy, and their families. #mapoli #ma10","mapoli ma10"
"2011-01-09 ","22:19:58","USRepKeating","My thoughts and prayers are with Representative Gabrielle Giffords, all the victims of the tragedy, and their families.",
"2011-01-07 ","02:44:18","USRepKeating","Please visit Bill's Congressional website. http://ow.ly/3zJch #mapoli #magov #congress","mapoli magov congress"
"2016-09-21 ","18:08:06","RepJoeKennedy","Too often #StudentDebt can limit choices and opportunity for young people. What would be on your #DebtFreeWishList?","StudentDebt DebtFreeWishList"
"2016-09-21 ","16:31:39","RepJoeKennedy","Care packages from @the_USO show troops bravely serving overseas that they will always be in our hearts + minds. #USOconnects https://t.co/bjLtKdiaJt","USOconnects"
"2016-09-21 ","15:30:44","RepJoeKennedy","Read more about my bill w/ @RepLanceNJ7 to restore consumers’ right to voice honest concerns with businesses. #CRFA https://t.co/ChbGzKMkWF","CRFA"
"2016-07-15 ","15:15:51","RepJoeKennedy","Congrats to my friend + education champion Jack Sbrega on a well-deserved recognition of his work at @BristolCC! https://t.co/2vAxtky1zE",
"2016-07-15 ","01:21:50","RepJoeKennedy","You can't look families impacted by #gunviolence in the eyes + say silence from Capitol is enough. #LightingTheWay https://t.co/in5Pl7XpbV","gunviolence LightingTheWay"
"2016-07-05 ","22:07:25","RepJoeKennedy","Watch out world – @RepMikeCapuano just joined Twitter and he’s already coming in hot. https://t.co/asvJ8gXdYB",
"2016-07-05 ","21:39:22","RepJoeKennedy","Our Commonwealth has lost too many friends + loved ones to #gunviolence. This must stop. #DisarmHate https://t.co/u1iJL3wMuI","gunviolence DisarmHate"
"2016-02-18 ","18:06:48","RepJoeKennedy","We’re bringing #Tour34 to the @medwaypolice dept and @MillisLibrary this Saturday! Click here for more info. https://t.co/KNWY0XXKzC","Tour34"
"2015-11-25 ","17:23:45","RepJoeKennedy","And I'm thankful I'm still on your good side...and hopeful for a big win for your Lions tmrw. Happy Thanksgiving! https://t.co/DzAAulKahS",
"2015-10-29 ","14:58:13","RepJoeKennedy","Best of luck to @SpeakerRyan as he takes over. Hoping tone will be set for bipartisan compromise from the start.",
"2015-10-29 ","14:57:08","RepJoeKennedy","Always admired the deep respect @SpeakerBoehner had for this institution. Wishing him well in the next chapter.",
"2015-09-29 ","16:05:14","RepJoeKennedy","I #StandWithPP because they stand with women across our country seeking basic health care every day. #PinkOut","StandWithPP PinkOut"
"2015-09-29 ","14:41:02","RepJoeKennedy","Don’t worry, my Boston driver instincts come out in those tunnels. I pass my colleagues on the right all day long. https://t.co/hEhqPiEJ1t",
"2015-09-29 ","13:38:07","RepJoeKennedy","Hey @mviser quick question for you. On #NationalCoffeeDay do you think it’s acceptable to add a fifth shot of espresso to my iced coffee?","NationalCoffeeDay"
