"Date","Time","screen_name","text","hashtags"
"2016-02-23 ","21:51:48","RepSteveIsrael",".@HouseGOP delay of the budget is inexcusable &amp; dysfunctional. @HouseDemocrats stand ready to get to work for working families",
"2016-02-23 ","20:12:27","RepSteveIsrael","It's always been this Jewish @Mets fan's dream to meet @ArtShamsky! Great moment! https://t.co/fuW5rug9Ax",
"2016-02-23 ","18:16:13","RepSteveIsrael","Saddened to hear about the passing of Assemblywoman Barbara Clark, a dedicated public servant who represented #Queens with distinction","Queens"
"2016-02-23 ","17:46:55","RepSteveIsrael","Proud to announce first ever Pride Night at #CitiField with @Mets and @LGBTNetworkNY #PrideNightMets #LGM https://t.co/QUhqGdwa08","CitiField PrideNightMets LGM"
"2016-02-23 ","01:57:16","RepSteveIsrael","Honored to attend Hicksville VFW Voice of Democracy Essay Contest tonite.  Congrats students! https://t.co/PgTXvANUOI",
"2015-11-25 ","15:54:15","RepSteveIsrael","Proud to join @Asharoken for reopening of Village Hall after we rebuilt from #Sandy https://t.co/SzjWI8nx8g","Sandy"
"2015-10-29 ","22:19:56","RepSteveIsrael","Had fun visiting with the 8th graders of Harry B. Thompson Middle School in Syosset on the @uscapitol steps today! https://t.co/AcB6ppY7ot",
"2015-10-29 ","21:51:16","RepSteveIsrael","Get well soon, @GregoryMeeks! Wishing you a speedy recovery",
"2015-10-29 ","15:19:02","RepSteveIsrael","I don't think  Americans worried about paychecks in their houses are excited by ""regular order"" in this House.",
"2015-10-29 ","14:57:11","RepSteveIsrael","Escorting Speaker Ryan into House Chamber. https://t.co/OJV14gQCEw",
"2015-10-29 ","14:38:18","RepSteveIsrael","Nothing like a roll call of the House to get the adrenalin pumping!",
"2015-09-29 ","19:03:47","RepSteveIsrael","Great mtg with @NYCUAtweets about data security #yphikethehill http://t.co/uTtfWYrL1G","yphikethehill"
"2015-09-29 ","18:03:00","RepSteveIsrael","Glad to see US &amp; China working together to end #ivory trade. We must do more to save elephants from extinction @HumaneSociety @TheWCS","ivory"
"2015-09-29 ","17:32:15","RepSteveIsrael","Happy 50th @NEHgov! As a true history buff TY for continuously bringing it to life for future generations #NEHturns50 http://t.co/N26avbs2d0","NEHturns50"
"2015-09-29 ","16:13:42","RepSteveIsrael","I #StandWithPP because I stand with women’s constitutional right to make their own choices about their health care &amp; bodies #PinkOut","StandWithPP PinkOut"
"2015-09-29 ","15:36:50","RepSteveIsrael",".@HouseGOP aggression and disrespect directed at @CecileRichards in this hearing is disgusting #StandWithPP #PinkOut","StandWithPP PinkOut"
"2015-07-14 ","21:35:35","RepSteveIsrael","Hosting Bipartisan Taskforce for Combatting #Antisemitism mtg w/ experts to fight against online hate speech http://t.co/TVdP1KU2cD","Antisemitism"
"2015-07-14 ","21:05:36","RepSteveIsrael","I will be on @cnntoday at 5:15 to discuss the #IranDeal @cnni @holmescnn @AmaraCNN","IranDeal"
"2015-07-14 ","13:47:15","RepSteveIsrael","Read my statement on the #IranDeal http://t.co/9ppy78ri5q","IranDeal"
"2015-06-15 ","15:45:46","RepSteveIsrael","I honored local ""High School Heroes"" for their charitable work across #NewYork and around the world http://t.co/0i4yiv8UP3","NewYork"
"2015-06-15 ","15:30:32","RepSteveIsrael","#ICYMI: The @washingtonpost Ed Board endorses my bill to ban undetectable plastic firearms http://t.co/IoNuLNHisW #gunsafety","ICYMI gunsafety"
"2015-06-09 ","16:29:25","RepSteveIsrael","Speaking at #LGA abt recent #TSA failures &amp; my bill 2 ban undetectable plastic firearms 2 protect American travelers http://t.co/gds8PRU5FG","LGA TSA"
"2014-10-22 ","15:49:28","RepSteveIsrael","At Bethpage FD alerting families: make sure your college housing has fire sprinklers. http://t.co/XvG8sU0Aba",
"2014-10-22 ","14:40:17","RepSteveIsrael","Thanks to @Mets for attending Suffolk vets jobs expo today w @SteveBellone, @TimBishopNY and local employers. http://t.co/0cnCeLjcSm",
"2014-10-22 ","13:54:30","RepSteveIsrael","Headed to Vets Emplymnt Xpo @ Suff Ctty College Brentwood w @SteveBellone @TimBishopNY. If you're a vet in job market, join us.",
"2014-10-22 ","00:14:04","RepSteveIsrael","An amazing visit to the Helen Keller Natl Institute in Sands Point today. http://t.co/2uu2OV0xTk",
"2014-05-21 ","22:18:06","RepSteveIsrael","Had a great time at Mayors' Day today with Mayors from Sea Cliff, Old Brookville, Bayville, Plandome and Glen Cove! http://t.co/EkF49woUyg",
"2014-05-21 ","18:43:48","RepSteveIsrael","Great to meet with you! RT @shanemoneyman @NAIFA thanks @RepSteveIsrael for your time today http://t.co/sUeZQDnlFw",
"2014-05-21 ","18:35:48","RepSteveIsrael","Good mtg w Liz Birney of @ZOA_Campus on US-Israel relations. http://t.co/IpBba7yTVd",
"2014-05-21 ","17:28:03","RepSteveIsrael","Climate change threatens NY's economy and our children's future. Today we will #SoundTheAlarm4Climate action. @SEEC http://t.co/ImMrkdZMef","SoundTheAlarm4Climate"
"2014-04-01 ","19:18:12","RepSteveIsrael","GOP budget keeps oil company subsidies but slashes Alzheimer’s and related research by $100 billion.",
"2014-04-01 ","17:52:37","RepSteveIsrael","The House GOP budget slams the middle class &amp; protects the special interests.",
"2014-04-01 ","17:01:17","RepSteveIsrael","In Hunt. Station today, announced my bill to stop juveniles who committed violent crimes from buying firearms. http://t.co/bZtXqLctZ9",
"2014-04-01 ","15:25:18","RepSteveIsrael","Very sad. Thoughts are w/ the families MT @FiOS1News_LI Bus crash in #RoslynHeights, #Roslyn Rd Reports of fatalities http://t.co/8KpEDrSbNu","RoslynHeights Roslyn"
"2014-10-22 ","17:57:28","TimBishopNY","BISHOP HAILS SOCIAL SECURITY BENEFIT INCREASE http://t.co/84eaF6JwtL",
"2014-05-21 ","22:38:26","TimBishopNY","Last night I offered a burn pit amendment to the #NDAA, read more: http://t.co/aXGMwMOKAX","NDAA"
"2014-05-21 ","21:01:31","TimBishopNY",".@nasiripour I recently introduced a bill to protect students from these actions by private lenders http://t.co/IqND6Rqqd6",
"2014-05-21 ","14:14:02","TimBishopNY","Speaking with students from Center Moriches Middle School. Welcome to DC! http://t.co/JzDWAXrKPu",
"2014-05-21 ","14:11:04","TimBishopNY","Beautiful day outside the U.S. Capitol speaking with students from Center Moriches Middle School. http://t.co/pnWpYr2Fih",
"2014-04-01 ","14:54:16","TimBishopNY","Congrats Kwasi Enin of @WilliamFloydSD for being accepted to all 8 Ivy's! That is an incredible accomplishment and we are all very proud!",
"2013-07-24 ","23:46:34","TimBishopNY","Happy to hear @NYGovCuomo announce yesterday that qualified same-sex spouses in #NYS now eligible for tax refunds https://t.co/Pesfdxypfm","NYS"
"2013-07-24 ","21:59:26","TimBishopNY","http://t.co/JUly7ZQb4c",
"2013-07-24 ","21:27:39","TimBishopNY","Just met with Jamie Ging, an @stonybrooku student participating in the @usnistgov Summer Program. Good luck Jamie! http://t.co/oOzowj2Cp1",
"2013-07-24 ","20:17:03","TimBishopNY",".@USCG Thank you for the heroic rescue of an LI  lobster fisherman who went missing off the coast of Montauk overnight.",
"2013-07-24 ","18:21:02","TimBishopNY","Moments ago I spoke on my Federal Price Gouging Prevention  bill. Time to protect consumers from rising gas prices! http://t.co/7y7r0AhKfp",
"2013-06-05 ","19:17:36","TimBishopNY","How will #students in #NY be affected by a spike in student loan rates? check out this report:http://t.co/VrOeAfbyjE","students NY"
"2013-06-05 ","17:58:15","TimBishopNY","The percentage of 25 year olds with student debt as risen from 25% in 2003 to 43% in 2012. #DontDoubleMyRate http://t.co/LzekpTqUjF","DontDoubleMyRate"
"2013-06-05 ","15:49:08","TimBishopNY","Did you know student loan debt exceeds 1Trillion dollars?!? RT and spread the word. #DontDoubleMyRate http://t.co/ZtXOVcYoz6","DontDoubleMyRate"
"2013-06-05 ","14:58:23","TimBishopNY","Over the past 10 years the average student loan balance held by 25 year old's has grown 91% #DontDoubleMyRate http://t.co/qPbObAmH63","DontDoubleMyRate"
"2013-06-05 ","13:56:49","TimBishopNY","If Congress doesn't act, student loan rates will double on July 1st. Join me in spreading the word #DontDoubleMyRate","DontDoubleMyRate"
"2013-03-11 ","15:14:35","TimBishopNY","Had a very productive meeting this morning with @LICivicEngage to discuss the economic benefits of #immigrationReform http://t.co/qs8hvBrQ6o","immigrationReform"
"2012-05-18 ","15:07:45","TimBishopNY","Federal transportation dollars should not be used to outsource American jobs. It doesn't make sense. It isn't right. http://t.co/gYDnw5Fy",
"2016-02-23 ","16:12:23","RepDavidEPrice","I was pleased to give remarks at the 2016 NC Child Hunger Leaders Conference hosted by No Kid Hungry NC https://t.co/SEnngbBB6a",
"2015-10-29 ","16:47:40","RepDavidEPrice","I congratulate Speaker Ryan, and I am hopeful that under his leadership we will see more bipartisan cooperation https://t.co/I5PUziRH71",
"2015-09-29 ","16:59:45","RepDavidEPrice","Happy 50th bday to @NEAarts &amp; @NEHgov! Congress must renew its commitment to these critical cultural organizations http://t.co/U6K26qlETk",
"2015-07-14 ","20:32:06","RepDavidEPrice","Happy 50th birthday to the Older Americans Act, which provides critical support to seniors and caregivers! #OAA50 http://t.co/t4qafMQJ64","OAA50"
"2015-07-14 ","15:46:41","RepDavidEPrice","Did you know that I am on Instagram? You can follow me at https://t.co/xfw3sphH2R for regular updates on my work in NC-04 and Washington!",
"2014-05-21 ","17:26:35","RepDavidEPrice","Very pleased the Approps Comm. adopted my amendment to restore funding to the Council on Homelessness to FY14 levels. #ncpol @AppropsDems","ncpol"
"2014-04-01 ","22:01:37","RepDavidEPrice","The #NCGA &amp; Gov. McCrory should revisit their decision to block our poorest residents from gaining coverage under Medicaid expansion. #ncpol","NCGA ncpol"
"2014-04-01 ","22:01:28","RepDavidEPrice","Unfortunately, in states like #NC, GOP leaders continue to stand in the way of the full benefits of the #ACA. #ncpol #7MillionAndCounting","NC ACA ncpol 7MillionAndCounting"
"2014-04-01 ","21:57:42","RepDavidEPrice","Republican leaders who predicted the failure of the #ACA have been proven wrong. #ncpol #7MillionAndCounting","ACA ncpol 7MillionAndCounting"
"2014-04-01 ","21:57:15","RepDavidEPrice","With #7MillionAndCounting enrolled, the #ACA is making good on its promise to make our health system fairer. #ncpol http://t.co/LPkaFv5qAc","7MillionAndCounting ACA ncpol"
"2014-04-01 ","18:14:11","RepDavidEPrice","Great news: Thanks to the #ACA, #7MillionAndCounting have signed up for affordable, quality health insurance coverage. #ncpol","ACA 7MillionAndCounting ncpol"
"2014-04-01 ","16:04:02","RepDavidEPrice",". . . decimate programs that invest in helping our people &amp; our economy succeed.",
"2014-04-01 ","16:03:54","RepDavidEPrice","The House Republican budget is guided by the preposterous notion that the best way to help our people is to rip away the safety net &amp; . . .",
"2014-04-01 ","16:03:37","RepDavidEPrice","The GOP budget out today is NOT an #AprilFoolsDay joke. A budget is a statement of our priorities/values-Ryan budget gets both wrong #ncpol","AprilFoolsDay ncpol"
"2014-02-18 ","21:25:29","RepDavidEPrice","Busy day in @CityOfFayNC. Meeting with @CumberlandNC Sheriff Moose Butler at the County Courthouse this PM. #ncpol http://t.co/8pFTXwsIa2","ncpol"
"2013-07-24 ","18:33:25","RepDavidEPrice","A applaud President Obama for leading the call for investments in our people and our competitiveness. #ncpol #abetterbargain","ncpol abetterbargain"
"2013-07-24 ","17:38:09","RepDavidEPrice","Rebuilding middle-class security must be job #1. Pres. Obama laid out how we can start: http://t.co/vLqq42AWvM #ABetterBargain #ncpol","ABetterBargain ncpol"
"2013-07-24 ","16:18:49","RepDavidEPrice","Public-private collaboration is a powerful tool for complex projects such as #NCBPrepared. It's made possible by investments in edu. #ncpol","NCBPrepared ncpol"
"2013-07-24 ","16:13:34","RepDavidEPrice","NCB-Prepared will help first responders &amp; health professionals see the whole picture during a threat. #ncpol More:  http://t.co/xYZichWz3F","ncpol"
"2013-07-24 ","16:11:34","RepDavidEPrice","Very pleased to announce a $3M @DHSgov grant for an innovative bio-threat early warning system led by @NCState &amp; UNC. @Carolina_News #ncpol","ncpol"
"2013-06-05 ","16:24:08","RepDavidEPrice","Heading to the House floor for debate on the Department of Homeland Security Appropriations bill. Watch here: http://t.co/vdBcVxeiNt #ncpol","ncpol"
"2013-03-11 ","14:02:00","RepDavidEPrice","As we mark @AmeriCorps Week, TY to the more than 800,000 who've served their communities as members. #ACweek #ncpol http://t.co/AOqwrBEf9P","ACweek ncpol"
"2013-03-11 ","13:44:44","RepDavidEPrice","@NCFarmBureau' sPeter Daniel tells us pop. growth means that over the next 25 yrs, we need to produce more food than in the prev 10K yrs.",
"2013-03-11 ","12:56:51","RepDavidEPrice","Host my annual #NC04 farmers briefing @ the state fairgrounds. Pleased to have @FarmBureau Prez Larry Wooten joining. http://t.co/RS7tLtweA1","NC04"
"2012-12-12 ","17:32:27","RepDavidEPrice","House GOP should join @HouseDemocrats to pass an extension of middle class tax cuts, not hold them hostage. #DoTheRightThing #ncpol","DoTheRightThing ncpol"
"2012-12-12 ","17:30:28","RepDavidEPrice","Joining @HouseDemocrats calling on GOP to #DoTheRightThing. Extend the middle class tax cuts now #fiscalcliff #ncpol","DoTheRightThing fiscalcliff ncpol"
"2012-08-03 ","20:14:56","RepDavidEPrice","2) sensible approach to revenue. Pres. Obama has already proposed a sensible plan: Let the Bush tax breaks expire on income over $250,000/yr",
"2012-08-03 ","20:14:42","RepDavidEPrice","We've done it before. In the 90s the formula was 1) fiscal discipline on all fronts focusing limited $ on recovery &amp; investing in our future",
"2012-08-03 ","20:14:35","RepDavidEPrice","A common sense approach to sequestration &amp; the fiscal cliff that accelerates the recovery &amp; restores fiscal health isn't hard to imagine.",
"2012-08-03 ","19:04:00","RepDavidEPrice","In fact, the same argument applies equally to domestic investments in education, infrastructure, research and innovation.",
"2012-08-03 ","19:03:53","RepDavidEPrice","With sequestration looming, GOP says  defense spending creates jobs and cutting it means fewer jobs...Now they're ""Defense Keynesians""?",
"2012-08-03 ","14:55:31","RepDavidEPrice","Video of my remarks on sequestration and the fiscal cliff #ncpol   http://t.co/ftkK5cP4","ncpol"
"2012-08-03 ","14:55:26","RepDavidEPrice","Release: 'The Fiscal Path Forward' - Price Urges Common Sense Approach to Sequestration, Fiscal Cliff #ncpol http://t.co/kK0RDgm5","ncpol"
"2012-08-03 ","13:55:52","RepDavidEPrice","Last day of House Dems Online All-Star Competition. Will you help me &amp; others w/a #FF #fFollowFriday recommendation? http://t.co/UQnsBuvE","FF fFollowFriday"
"2012-07-18 ","19:54:40","RepDavidEPrice","We should modernize voter registration to expand access. And we should reject any attempt to attack voting rights of law-abiding citizens",
"2012-07-18 ","19:45:22","RepDavidEPrice","I've cosponsored the Voter Empowerment Act to protect voting rights &amp; ensure equal access for all: http://t.co/IbPfGLGH",
"2012-07-18 ","19:03:35","RepDavidEPrice","Not sure if you're registered to vote in #NC?  We just added an app to my website to help you check. #ncpol http://t.co/0iqrFOL0","NC ncpol"
"2016-09-21 ","19:26:11","TimRyan","Happy to join @HallieJackson on MSNBC today to discuss @HillaryClinton's superior mfg &amp; foreign policy creds. https://t.co/mPKUYuK4Ou",
"2016-07-15 ","20:09:44","TimRyan","Agreed!  https://t.co/9IZegAlliE",
"2016-07-15 ","15:17:26","TimRyan","Perhaps @realDonaldTrump didn't feel he had adequately alienated women &amp; LGBT people so far this election.  https://t.co/eDVxX8sk6L",
"2016-07-15 ","03:12:32","TimRyan","My thoughts and prayers are with all those in Nice today",
"2016-06-10 ","15:49:05","TimRyan","Up for an adventure? Explore Trump's trail of unpaid bills and underhanded business dealings. https://t.co/J0ucAkQUeF",
"2016-02-23 ","00:15:49","TimRyan","Great to spend time with Jon Kabat Zinn, @PeteCarroll, and @michaelgervais at Wisdom 2.0!!! https://t.co/ECVsEVRWCO",
"2016-02-18 ","18:01:39","TimRyan",".@OHDems @JohnKasich Hmm dunno, why don't you ask @PPAOhio &amp; the women who will be hurt by his reckless funding cuts? #PeopleOverPolitics","PeopleOverPolitics"
"2016-02-18 ","17:51:33","TimRyan","Yeah, this was kind of strange...  https://t.co/6avSCURu88",
"2016-02-18 ","17:25:12","TimRyan","Trump getting a ""huuuge"" Papal scolding regarding border wall proposals. I'm with @Pontifex on this one. #DumpTrump  https://t.co/0fcTLQzTR6","DumpTrump"
"2016-02-18 ","16:02:52","TimRyan","I might be showing my age a bit, but it's a @billyjoel radio kind of day. #CarTunes https://t.co/Zpg9EwUNdr","CarTunes"
"2016-02-18 ","03:16:27","TimRyan","Hmmm I wonder why? GOP fears @HillaryClinton the most! https://t.co/PJYOSgOcY9",
"2015-10-29 ","19:17:33","TimRyan","Looks like last night's Republican Debate was a fact free zone! https://t.co/8gJV0rsIbw @HuffingtonPost https://t.co/WEduI9Sl7n",
"2012-09-25 ","16:50:36","TimRyan","One week till early voting. Get Registered! Go Vote! @OFA_OH @Dbetras @CollegeDemsOhio #2012 http://t.co/4zUZBpeg",
"2012-12-12 ","17:46:35","RepKucinich","Critical Vote Alert: House committee to vote on drone oversight bill tomorrow.

http://t.co/OnHEhVSt",
"2012-08-03 ","14:52:49","RepKucinich","We don’t know who they are, but we know that we are for them. http://t.co/eEBRyHMU #Syria #Aleppo #Damascus","Syria Aleppo Damascus"
"2012-07-18 ","21:09:04","RepKucinich","Taking to YouTube to stand with the Japanese people who are taking to the streets in opposition to nuclear energy. http://t.co/FKv6WwYE",
"2012-07-18 ","18:38:41","RepKucinich","China is using illegal trade practices to cripple American businesses. Instead of investigating potential... http://t.co/Rwf7mj6a",
"2012-05-18 ","17:59:43","RepKucinich","NDAA Reignites Cold War with Russia, Opens Door for Hot War with Iran http://t.co/4mVSm25o",
"2011-01-12 ","18:22:02","RepKucinich","Our hearts are open. Let us be open to a new direction, an organized approach to the causes of violence #peace... http://fb.me/EZTvMNdM","peace"
"2011-01-12 ","16:38:17","RepKucinich","I uploaded a YouTube video -- Kucinich Calls for New Direction to Approaching the Cause... http://youtu.be/aA9181CrZZ4?a",
"2011-01-06 ","17:07:31","RepKucinich","I will be on Fox News at a quarter past noon to discuss the new Congress.",
"2016-09-21 ","23:19:45","RepMarcyKaptur","THOMAS EDISON STATUE UNVEILING ""His  genius moved America forward as the oldest democratic republic on earth"" #ohio 
https://t.co/rdrUndefuM","ohio"
"2016-09-21 ","00:48:40","RepMarcyKaptur","These men and their band of brothers put country before self to preserve liberty. Hold high their bravery with The Congressional Gold Medal. https://t.co/f0FMr8LDS9",
"2016-07-15 ","20:29:00","RepMarcyKaptur","Sux straight years of auto sales growth — and record sales of 17.5 million last year. #auto #jeep #wrangler #Toledo 
https://t.co/2qx29DKWih","auto jeep wrangler Toledo"
"2016-07-15 ","17:37:56","RepMarcyKaptur","When given a fair chance, we will compete and we will win. #jeep #wrangler #fca #toledo #UAW #BuyAmerican #winning
 
https://t.co/dbAPnHwefQ","jeep wrangler fca toledo UAW BuyAmerican winning"
"2016-07-15 ","02:24:49","RepMarcyKaptur","When given a fair chance, we will compete and we will win. #jeep #wrangler #toledo #UAW #USA https://t.co/l81AIvLsPc","jeep wrangler toledo UAW USA"
"2016-07-15 ","02:01:40","RepMarcyKaptur","This is almost beyond belief, given where we were eight short years ago. #jeep #wrangler #toledo #ohio #UAW #USA https://t.co/158bPlckhc","jeep wrangler toledo ohio UAW USA"
"2016-07-15 ","01:06:35","RepMarcyKaptur","This from 2014, one of the many times I spoke out to keep Jeep in Toledo…
 
#tbt.                                   https://t.co/lNNtQa8pfO","tbt"
"2016-07-05 ","21:17:34","RepMarcyKaptur","Horace Appleby, thank you for your service to our country.  May you rest in peace. #Worldwar2 #american #hero 
 
https://t.co/okWi3bHb0H","Worldwar2 american hero"
"2016-07-05 ","19:51:13","RepMarcyKaptur","Congrats, Jacob Bollenbacher of Bellevue, OH the OH winner in my 2016 American flag photo contest! Well done, Jacob! https://t.co/d1ZDnGUxMc",
"2016-07-05 ","13:31:14","RepMarcyKaptur","Congrats to Kyle Burr of Avon Lake, Ohio, the OH-9 winner in my 2016 American flag photo contest! Well done, Kyle! https://t.co/lpbrWyuqO3",
"2016-06-10 ","17:25:45","RepMarcyKaptur","They said the 2000 trade deal w/ China would open Chinese markets for US exports?  They. Were. Wrong. #StopTheTPP https://t.co/fytu7btLkJ","StopTheTPP"
"2016-06-10 ","13:35:14","RepMarcyKaptur","Have you noticed delays in mail delivery lately? My proposal passed the House Approps Cmtee &amp; restores standards.

https://t.co/CLd8nis7be",
"2015-11-30 ","21:41:51","RepMarcyKaptur","China's currency was just added to IMF elite world currencies. Raises the stakes for China's currency manipulation &amp; resulting US job drain.",
"2015-11-30 ","21:33:30","RepMarcyKaptur","My remarks at @NASAglenn @ESA celebration today marking arrival of #Orion European Space Module @ Plum Brook Station https://t.co/lqU5zTfmnl","Orion"
"2015-11-30 ","21:05:45","RepMarcyKaptur","Check it out! #NASAglenn #Orion https://t.co/uN6xqMpf7U","NASAglenn Orion"
"2015-11-30 ","19:59:22","RepMarcyKaptur","Don't forget! You can vote daily for @ToledoZoo in the @USAToday @10Best readers poll of ""Best Zoo Lights"" - https://t.co/Crcszlpbu6",
"2015-11-30 ","19:20:50","RepMarcyKaptur",".@NASAglenn &amp; @ESA teamed up to test ""Orion"" European Service Module next yr. Thx to all for today's great event! https://t.co/ZseP62dp22",
"2015-11-30 ","18:27:11","RepMarcyKaptur","w00t! https://t.co/tUWhEFuoJG",
"2015-11-30 ","18:26:22","RepMarcyKaptur","Thanks for sharing this &amp; for all your work! https://t.co/7ADffz9bFN",
"2015-11-30 ","17:58:43","RepMarcyKaptur","Wonderful celebrating @NASAglenn Plum Brook today where teams will test Orion Space Module starting early next year! https://t.co/kHI99bUBU6",
"2015-11-30 ","14:19:02","RepMarcyKaptur","Love to see this: ""...the world’s largest, most powerful space environment simulation facility... in Sandusky, Ohio"" https://t.co/g773QOVn7O",
"2015-11-25 ","16:21:03","RepMarcyKaptur","Got turkey questions? The @USDA Meat &amp; Poultry Hotline is open 8am-2pm ET on #Thanksgiving: 1-888-674-6854! #TurkeyDayTips","Thanksgiving TurkeyDayTips"
"2015-11-25 ","16:14:54","RepMarcyKaptur",".@SBAgov just reported disaster loans are available to small biz &amp; local orgs in Ohio due to bad weather this year: https://t.co/dWUMljsWvU",
"2015-11-25 ","15:53:05","RepMarcyKaptur","Between Black Friday and Cyber Monday is #SmallBizSat - a great day to shop businesses that boost local economies! https://t.co/c99aLqwtuJ","SmallBizSat"
"2015-11-25 ","15:17:21","RepMarcyKaptur","#ICYMI the @ToledoZoo is competing for the top spot in @10best @USATODAY's ""Best Zoo Lights"" for 2015! Check it out: https://t.co/Crcszlpbu6","ICYMI"
"2015-11-25 ","15:05:03","RepMarcyKaptur","#ShopSmall For All is this Saturday (11/28)! What are your favorite N. Ohio small businesses? #SmallBizSat https://t.co/dg2Pgxmd7q","ShopSmall SmallBizSat"
"2015-11-25 ","14:48:43","RepMarcyKaptur","FYI, just in case you were planning to get a head start on your taxes this week! https://t.co/72jVDEqUpT",
"2015-09-29 ","21:11:05","RepMarcyKaptur","Thanks for organizing! U.S. workers &amp; biz owners should know jobs &amp; $$ are lost thx to @GOP push to kill #exim4jobs  https://t.co/MeUn8LYzRN","exim4jobs"
"2015-09-29 ","16:36:06","RepMarcyKaptur","#ICYMI: @FT_wealth posted a piece earlier this year about opportunities emerging in Ukraine. Check it out! http://t.co/4gwqJgigPc","ICYMI"
"2015-09-29 ","16:34:31","RepMarcyKaptur","Check out this story about a couple turning food into opportunity. Many in N.Ohio could do this with family recipes! http://t.co/mY7uRjcSRC",
"2015-09-29 ","16:31:22","RepMarcyKaptur","Harmful algal blooms (HABs) are a growing international concern, via @ecowriterohio: https://t.co/gbiTqHt9HR http://t.co/iSNvpYPfuR",
"2015-09-29 ","15:42:36","RepMarcyKaptur","Congratulations @BaySchoolsOH Westerly Elementary, selected as a Blue Ribbon School for 2015! http://t.co/3q2GSdQudZ http://t.co/BPUFshXSqV",
"2015-07-14 ","18:10:22","RepMarcyKaptur","91% of Older Americans Act participants report home-delivery of meals through the nutrition program helps them stay in their homes. #OAA50","OAA50"
"2015-07-14 ","18:07:26","RepMarcyKaptur","60%+ of participants in the Older Americans Act Nutrition Program report a home-delivered meal =1/2 or more of their total food for the day.",
"2015-07-14 ","17:54:37","RepMarcyKaptur","The Older Americans Act has been working for 50 years to improve the lives of seniors, caregivers &amp; their families. Let's keep it up! #OAA50","OAA50"
"2015-07-14 ","17:50:57","RepMarcyKaptur","#Fact: The Older Americans Act Nutrition Program has delivered more than 50 million meals to older &amp; disabled Ohioans since 2005. #OAA50","Fact OAA50"
"2015-07-14 ","17:05:45","RepMarcyKaptur","Great discussion, thanks to all who participated! https://t.co/LPK8GFua5i",
"2015-06-15 ","18:48:19","RepMarcyKaptur","Sat down w/@MachinistsUnion to talk U.S. trade policy and its repeated history of harmful trade deals. Check it out: https://t.co/vddWMnWbEf",
"2015-06-09 ","21:23:57","RepMarcyKaptur","The Trans-Pacific Partnership #TPP is classified Top Secret. No wonder 48% of Americans have never even heard of it. http://t.co/upZZSOnHB4","TPP"
