"Date","Time","screen_name","text","hashtags"
"2016-09-24 ","19:30:16","RepBradAshford","I'm looking forward to seeing @HuskerFBNation take on Northwestern tonight in their new chrome uniforms. How about you? #GBR #Huskers https://t.co/CtQqkwMdFr","GBR Huskers"
"2016-09-24 ","16:00:19","RepBradAshford","It was a pleasure speaking with Nicole from Big Brothers Big Sisters this morning about the great work they do in #NE02. Thanks, Nicole! https://t.co/4bjy3N3772","NE02"
"2016-09-24 ","01:05:02","RepBradAshford","High health care costs shouldn't be a burden for Nebraskans trying to get ahead. RT if you agree! #NE02 https://t.co/xacjmq1bcA","NE02"
"2016-09-23 ","21:15:13","RepBradAshford","My message to Republican and Democratic leaders: Time is ticking, work together and pass a budget. Statement: https://t.co/tZLJxpey7O #NE02 https://t.co/HFeNPcwAvs","NE02"
"2016-09-23 ","17:45:12","RepBradAshford","From Omaha to Washington, get all the news you need to know in one email. #NE02 https://t.co/ZJFoqeb5Gr","NE02"
"2016-09-23 ","15:43:08","RepBradAshford","As the son of a veteran, I am grateful for every man and woman who sacrificed their life for our country. #NE02 https://t.co/aRFPNXvsGb","NE02"
"2016-09-23 ","02:22:03","RepBradAshford","Had the honor of commemorating John R. Sodoro's life today. He was a selfless servant and will be missed. https://t.co/AvY39Ck3BK #NE02","NE02"
"2016-07-18 ","23:41:40","RepBradAshford","Olympic Curling Trials are coming to Omaha in 2017. I am excited to see the talent visiting our great city. https://t.co/kgdqJq7hZB",
"2016-07-18 ","22:33:05","RepBradAshford","Learn more about my 2nd Annual Local Foods for Local Tables on August 19th. #NE02 https://t.co/JUATElRufS","NE02"
"2016-07-18 ","21:30:08","RepBradAshford","My VOLT Act connects veterans with high-paying construction jobs in their communities. #NE02 https://t.co/apF68sWoCo","NE02"
"2016-07-18 ","20:37:08","RepBradAshford","If you missed my interview on @1290KOIL last Friday, you can listen online. https://t.co/7LjmodwDlT #NE02 https://t.co/61nAa5iSF4","NE02"
"2016-07-18 ","19:30:34","RepBradAshford","Congress is on its longest break in 3 decades while we face a threat from ISIS and have no budget. #NE02 https://t.co/5kukjpKpA8","NE02"
"2016-07-18 ","18:00:19","RepBradAshford","Interested in interning in my DC or Omaha office? Apply by August 5th for a Fall internship! https://t.co/C0PbH58SMl #NE02","NE02"
"2016-07-18 ","16:30:20","RepBradAshford","My staff will be in Ralston this afternoon. My caseworkers are ready to answer your questions. #NE02 https://t.co/9yvS90EjiQ","NE02"
"2016-07-18 ","15:00:28","RepBradAshford","Congress is on the longest summer break in decades w/o passing a budget, addressing ISIS, or funding Zika research. https://t.co/c8hOtoOjA7",
"2016-07-18 ","13:34:04","RepBradAshford","My voting record is clear. I am not beholden to either political party. #NE02 https://t.co/lOC7MQ1N9v","NE02"
"2016-07-17 ","18:56:15","RepBradAshford","My heart breaks for the community of Baton Rouge and the state of Louisiana. https://t.co/REPygnhc9W",
"2016-07-17 ","18:19:05","RepBradAshford","Congress' inaction on ISIS is unacceptable. We should not be going on a 7 week summer break. https://t.co/hiXMRYY7TI #NE02","NE02"
"2016-07-17 ","14:15:06","RepBradAshford","Sign up to receive my newsletter and stay updated on my work for #NE02 https://t.co/6o1dn5i6cm","NE02"
"2016-07-08 ","21:30:11","RepBradAshford","Submit your best photo taken in NE by 5pm on 7/15 for a chance to be the featured cover photo on my Facebook page. https://t.co/kWztCyTWOn",
"2016-07-08 ","19:36:51","RepBradAshford","Law enforcement serves and protects our communities and families. Violence against law enforcement officers cannot be tolerated.",
"2016-07-08 ","19:36:32","RepBradAshford","We must come together to break this senseless and heartbreaking cycle of violence against each other.",
"2016-07-08 ","19:30:18","RepBradAshford","I am proud to support legislation that brings stability to military families. https://t.co/TlN36IutRg #NE02","NE02"
"2016-07-08 ","18:22:10","RepBradAshford","At my urging the House Appropriations Cmte increased funding for programs to reduce veteran homelessness. #NE02 https://t.co/rumNNuRSW1","NE02"
"2016-07-08 ","16:04:05","RepBradAshford","Contact my office for assistance with federal agencies and services. https://t.co/eK0nqOrL4u",
"2016-07-08 ","13:49:17","RepBradAshford","My statement on the deadly shooting in Dallas last night: https://t.co/qiaHfwaf2a #NE02","NE02"
"2016-07-07 ","22:50:01","RepBradAshford","Submit your best photo of Nebraska for a chance to be showcased on my cover photo. More: https://t.co/SJAPsLgV1U https://t.co/hU3WnA8Njh",
"2016-07-07 ","20:59:44","RepBradAshford","Congrats to Mallory on being selected to attend @cspan's Classroom’s 2016 Educators’ Conference in Washington, D.C.! https://t.co/KJoN9BLgdd",
"2016-07-07 ","19:40:08","RepBradAshford","I continue to support our military families who serve our country dutifully. https://t.co/TlN36IutRg #NE02 https://t.co/J8qFYOlGQs","NE02"
"2016-07-07 ","18:15:08","RepBradAshford","I am excited to see that Omaha's Union Station could be named a National Historic Landmark. https://t.co/LT4lsuhe5H https://t.co/groRGOvgjD",
"2016-07-07 ","17:00:15","RepBradAshford","ICYMI: I co-introduced Sarah's Law in honor of Sarah Root who was killed in Omaha in Jan. https://t.co/5PgFmx0p3F https://t.co/0lbeLgyPY3",
"2016-07-07 ","15:30:09","RepBradAshford","I voted to freeze Congressional salaries because I don't believe Members of Congress have earned a raise. #NE02 https://t.co/EEfe35wxG5","NE02"
"2016-07-07 ","14:55:52","RepBradAshford","My staff is at the @OmahaLibrary South Omaha Branch this morning. Stop and talk to them about federal services. https://t.co/XSKCBX6cD8",
"2016-07-07 ","13:15:05","RepBradAshford","Stop by my Mobile Office this morning to talk to caseworkers about federal services and agencies. #NE02 https://t.co/EAv0SocBd9","NE02"
"2016-06-13 ","21:30:19","RepBradAshford","Independent groups have highlighted my bipartisan record and desire to find common ground. https://t.co/IvjXpYHPa3 https://t.co/ypBvNpVb5P",
"2016-06-13 ","20:35:25","RepBradAshford","Today we observed a moment of silence outside the Capitol to honor the #OrlandoShooting victims. #OrlandoUnited https://t.co/ukNz5gv3aR","OrlandoShooting OrlandoUnited"
"2016-06-13 ","19:45:59","RepBradAshford","By working together we can prevent the tragedy in Orlando from happening again. #OrlandoUnited https://t.co/eB0ceGtDE4","OrlandoUnited"
"2016-06-13 ","18:30:15","RepBradAshford","I am fighting to end wasteful spending on Congressional perks that don't benefit you. #NE02 https://t.co/WvBVQLcA1Z","NE02"
"2016-06-13 ","17:00:54","RepBradAshford","I'm committed to protecting our vets, growing our economy, &amp; ending Congressional perks by working across the aisle https://t.co/XXQAslHlMH",
"2016-06-13 ","15:16:06","RepBradAshford","We passed a bill that blocks pay raises for Congress. RT if you agree that Congress hasn't earned a raise. #NE02 https://t.co/bLnv92iSl8","NE02"
"2016-06-13 ","13:45:08","RepBradAshford","Military families make sacrifices every day. I am proud to stand for them. #NE02 https://t.co/NBlKVL7988","NE02"
"2016-06-12 ","20:00:05","RepBradAshford","I am fighting to reign in wasteful spending and balance our national budget. #NE02 https://t.co/uZmXCvdbk1","NE02"
"2016-06-12 ","17:15:09","RepBradAshford","ICYMI: I joined my colleagues to call for increased TSA funding to cut down wait times at airports. Read more: https://t.co/d7Qogr8yfd",
"2016-06-12 ","15:00:20","RepBradAshford","I am committed to doing all I can to bring the world-class healthcare that our #veterans deserve to Omaha. https://t.co/2MYdiw683x","veterans"
"2016-06-12 ","14:48:06","RepBradAshford","As authorities investigate the Orlando shooting, we must pray for the victims &amp; act swiftly to keep these tragedies out of our communities.",
"2016-02-26 ","21:29:06","RepBradAshford","#SiliconPrairie again making the nat'l news. Real deal for our local economy. #NE02 https://t.co/ITPdamUhMm","SiliconPrairie NE02"
"2016-02-26 ","21:18:05","RepBradAshford","Thanks to @OWHnews editorial board for acknowledging the work we're doing on behalf of Offutt Air Force Base. #NE02 https://t.co/6xd0ifJZ6k","NE02"
"2016-02-26 ","20:49:05","RepBradAshford","Every American, no matter the color of their skin, should be able to achieve their full potential.
https://t.co/jP6GdRO6ac #NE02","NE02"
"2016-02-26 ","20:48:04","RepBradAshford","We're here to help. Stop by our office, give us a call, or look out for our #mobileoffice appointments. #NE02 https://t.co/7PEYILZYID","mobileoffice NE02"
"2016-02-26 ","20:16:56","RepBradAshford","I wish them well and thank them for their service and sacrifice.  https://t.co/1EuWstxifn",
"2016-02-26 ","19:49:19","RepBradAshford","Good-paying specialty jobs, puts us on the map, brings talent to #NE. What's not to like?!  https://t.co/bERkYGzhpB","NE"
"2016-02-26 ","19:33:15","RepBradAshford","ICYMI: check out my interview w/ @omaharadiomatt of @1290KOIL #NE02 https://t.co/ZXyWvaKZDf","NE02"
"2016-02-26 ","19:15:11","RepBradAshford","Jim of our local office visited the Cross Training Center in #NorthOmaha. They empower people w/skills training. https://t.co/rJPGT89end","NorthOmaha"
"2016-02-26 ","17:04:29","RepBradAshford","Good news for the #OldMarket and Nebraska history. #NE02 
https://t.co/K6np3CqoYn","OldMarket NE02"
"2016-02-26 ","17:02:20","RepBradAshford","Cool. Most people don't know we have subways to the Capitol building. For security, quick transport to votes. https://t.co/6DnUe7A2bO",
"2016-02-26 ","16:37:28","RepBradAshford","#SiliconPrairie again making the nat'l news. Real deal for our local economy. #NE02 https://t.co/ITPdanbTaW","SiliconPrairie NE02"
"2016-02-26 ","15:16:26","RepBradAshford","Every American, no matter the color of their skin, should be able to achieve their full potential #BlackHistoryMonth https://t.co/OZcGlHBRC8","BlackHistoryMonth"
"2016-02-26 ","15:13:16","RepBradAshford","Check out first segment of my speech on #BlackHistoryMonth honoring Michael Maroney, President of the OEDC. #NE02 https://t.co/z77OmDHqUY","BlackHistoryMonth NE02"
"2016-02-26 ","14:36:04","RepBradAshford","Happening now: stop by @mccneb Applied tech ctr between noon &amp; 2 for help with federal government services. #NE02 https://t.co/gYZCvyA31z","NE02"
"2016-02-25 ","18:59:04","RepBradAshford","We owe #vets a debt for their service and sacrifice. I cosponsored 14 bills for vets hcare. https://t.co/RzfyAKjh9D https://t.co/Vq7JA1Ehuq","vets"
"2016-02-25 ","16:44:03","RepBradAshford","Our office holds #mobileoffice appts weekly throughout #NE02 to ensure we serve every part of the district. https://t.co/qMoZyaPQNs","mobileoffice NE02"
"2016-02-25 ","16:40:02","RepBradAshford","Submit your work for the art competition. Follow the link for more info: https://t.co/2eabcqtDbV #NE02 https://t.co/3yxqtZPpev","NE02"
"2016-02-25 ","15:27:16","RepBradAshford","Have to act on breast cancer.  https://t.co/ZweRFkk5Gb",
"2016-02-25 ","14:49:08","RepBradAshford","Thanks to @OWHnews editorial board for acknowledging the work we're doing on behalf of Offutt Air Force Base. #NE02 https://t.co/6xd0ig1AuU","NE02"
"2016-02-25 ","04:50:03","RepBradAshford","If you need help with your Social Security, Medicare, vetsbenefits, or other fed gov srvcs, join us on Friday. https://t.co/zyu1niC3Qx",
"2016-02-25 ","02:08:03","RepBradAshford","House passed leg I cosponsored to add Korean War Memorial Wall of Remembrance to Nat'l mall. Never forgotten. #NE02 https://t.co/VVsWPpv0yL","NE02"
"2016-02-25 ","01:05:03","RepBradAshford","Thanks to David Brown, CEO of @OmahaChamber for nice Oped on need to protect @Offutt_AFB, &amp; add new missions.
https://t.co/tHYDdcsPCz #NE02","NE02"
"2016-02-25 ","00:05:02","RepBradAshford","If you need help with your Social Security, Medicare, vetsbenefits, or other fed gov srvcs, join us on Friday. https://t.co/nPDpzNTNWP",
"2016-02-21 ","21:18:02","RepBradAshford","Stop by @mccneb Fort Omaha campus in #NorthOmaha tomorrow for help with federal services. #NE02 https://t.co/593cCt2Cgp","NorthOmaha NE02"
"2016-02-21 ","19:29:05","RepBradAshford","Let's get our #vets back to work. #NE02 https://t.co/5J3yulQFB6","vets NE02"
"2016-02-21 ","17:21:04","RepBradAshford","If you're interested in receiving updates on my work in Congress, sign up for my enewsletter. #NE02 
https://t.co/7RMUYNjrj0","NE02"
"2016-02-20 ","22:21:06","RepBradAshford","ICYMI: The #NE Delegation has established a task force to bring new missions to @Offutt_AFB. 
@NickStarlingTV #NE02 https://t.co/0aPlL8PhwI","NE NE02"
"2016-02-20 ","19:16:55","RepBradAshford","@SustainableK sorry we missed you - will be holding more events soon. Check back in a few weeks.",
"2016-02-20 ","17:56:46","RepBradAshford","@MarkVondrasek Issues some call progressive are common sense to me: pay equity, LGBT rights, immigration reform, voting rights.",
"2016-02-20 ","17:35:33","RepBradAshford","Had a packed house at @cdomaha for coffee w/ur Congressman. TY to everyone who stopped by to express your opinions! https://t.co/z7PuZDjIAC",
"2016-02-20 ","17:03:20","RepBradAshford","Joan from @FreeCollegeHelp providing info on scholarships to college-bound students at our Ed Forum. #NE02 https://t.co/y4dWHT3iEZ","NE02"
"2016-02-20 ","16:50:43","RepBradAshford","@MichaelMcGuire_ good catch. Prospective*",
"2016-02-20 ","16:44:13","RepBradAshford","Extra shout out to the reps of the Service Academies for joining us this morning to speak w/interested students. https://t.co/RSCkZbQmNU",
"2016-02-20 ","16:43:12","RepBradAshford","Thanks to everyone who joined us this morning for Srvc Academy portion of our Ed forum! #NE02 https://t.co/ReyMlLgAge","NE02"
"2016-02-20 ","16:41:08","RepBradAshford","Thank you, Hope!  https://t.co/vYQzWFA7UL",
"2016-02-20 ","15:05:06","RepBradAshford","Our office is headed to our ed forum. Perspective college, service academy students are encouraged to join. #NE02 
https://t.co/NdWmkucR2C","NE02"
"2016-02-20 ","14:01:03","RepBradAshford","Starting now: I'll be listening to constituents until 9:30 this morning at @cdomaha. #NE02 https://t.co/FCyXmKLXUB","NE02"
"2015-12-03 ","22:44:03","RepBradAshford","Last night, House passed bipart bill to improve K-12 ed, reform flawed No Child Left Behind Act. https://t.co/TpNfZCk4po",
"2015-12-03 ","21:43:57","RepBradAshford","We already knew that Nebraska is #1, but now we have mathematical proof.
https://t.co/FaoLMC1cdx #NE02","NE02"
"2015-12-03 ","21:05:07","RepBradAshford","Proud to intro the Manufacturing Skills Act. Estimated by 2020, we will experience  shortage of 875k manufacturers. https://t.co/NIFKzxTgR5",
"2015-12-03 ","20:15:06","RepBradAshford","This bill helps vets and small businesses. What more could you ask for? https://t.co/ekMjHkYS5V https://t.co/Kr6URNQX1q",
"2015-12-03 ","18:56:29","RepBradAshford","Friends on both sides of aisle putting needs of American people b4 party politics. Let's keep it going. https://t.co/F5UUGF1N4u",
"2015-12-03 ","17:34:06","RepBradAshford","I applaud this important announcement. Women who wish to serve on battlefield should have option to do so. 
https://t.co/7ndExyiNcH",
"2015-12-03 ","17:15:03","RepBradAshford","Interested in the services we offer? Check out our website to request assistance-https://t.co/gsuiwTLHAF https://t.co/LbdQONPbiT",
"2015-12-03 ","15:05:03","RepBradAshford","Stop by the Sorenson branch of the @OmahaLibrary today starting at 2 for help w/ fed gov agencies. https://t.co/Z004qlR6SY",
"2015-12-02 ","22:15:05","RepBradAshford","Medicare can be tough to navigate. We're here to help. Stop by @GoodwillOmaha Friday to enroll, change coverage. https://t.co/koV2wQniev",
"2015-12-02 ","21:55:44","RepBradAshford","Thoughts and prayers are with the people of San Bernardino.",
"2015-12-02 ","21:03:07","RepBradAshford","One of my top priorities is ensuring @Offutt_AFB stays in NE. I fought for $ to ensure we keep it. 
https://t.co/mLg010tyyy",
"2015-12-02 ","15:05:06","RepBradAshford","Vets: info meetings on Omaha Nat'l cemetery on Friday @1-2pm, &amp; 5-6pm at @BellevueU More info here: https://t.co/vmeQkKss9i",
"2015-12-02 ","00:12:03","RepBradAshford","Our office is here to serve people of #NE02. Stop by #MobileOfficeHours on Thursday for help w/ fed gov agencies. https://t.co/zGEqZ2mAuP","NE02 MobileOfficeHours"
"2015-11-28 ","16:05:03","RepBradAshford","Get out today for Small Business Saturday and support your local businesses in #NE02 #ShopSmall #DineSmall https://t.co/PSrl2F4J2l","NE02 ShopSmall DineSmall"
"2015-11-28 ","01:44:04","RepBradAshford","Stay in touch by signing up for my email alerts. https://t.co/7RMUYNjrj0",
"2015-11-27 ","20:12:04","RepBradAshford","Rivalry game. I smell an upset. #GBR #NEBvsIA","GBR NEBvsIA"
"2015-11-27 ","17:05:02","RepBradAshford","This #Thanksgiving season, I am thankful for a strong local economy in #NE02 and the abundance of jobs that come with it.","Thanksgiving NE02"
"2015-11-01 ","22:49:05","RepBradAshford","Amanda attended ribbon cutting for new #Papillion public works building this week. Great new facility. https://t.co/rFObFasqod","Papillion"
"2015-11-01 ","21:18:02","RepBradAshford","Need help with a federal agency? Visit my website at https://t.co/tdUgWKqMkt to learn about the services we offer. https://t.co/8QuyVphWrp",
"2015-11-01 ","18:42:01","RepBradAshford","Mark Martinez, U.S. Marshall, visited my office this week. Thanks for keeping our city safe, Mark! https://t.co/Vq83rYbV5n",
"2015-11-01 ","18:02:06","RepBradAshford","Edwin stopped by #MobileOfficeHours in #Millard this week. All #NE02 residents are welcome-check website for dates. https://t.co/V36mYsP4xU","MobileOfficeHours Millard NE02"
"2015-11-01 ","02:00:09","RepBradAshford","#VeteranUnemployment is still a problem. We have obligation to  fulfill promises to vets. #Jobs4Vets https://t.co/MZrsUsiBsx","VeteranUnemployment Jobs4Vets"
"2015-11-01 ","00:02:01","RepBradAshford","I wish everyone in #NE02 a safe and happy #Halloween! https://t.co/jgvJzHmaMd","NE02 Halloween"
"2015-10-31 ","21:32:07","RepBradAshford","I am hopeful that #budgetdeal, #SpeakerElection pave the way for era of bipartisanship, compromise in Washington. https://t.co/hUQ8cukWBI","budgetdeal SpeakerElection"
"2015-10-31 ","17:00:18","RepBradAshford","#NebraskaGnome represents my office's Husker spirit in Washington. Stop by to visit if you're in town and #GBR https://t.co/F0DuYzewaV","NebraskaGnome GBR"
"2015-10-02 ","22:25:07","RepBradAshford","Congrats to NE Food Co-op, recipient of grant to develop local food supply network operating across the state-connecting farms with markets.",
"2015-10-02 ","21:37:58","RepBradAshford","@laspinks it actually only takes five years to get a pension here.",
"2015-10-02 ","21:37:02","RepBradAshford","@FakeHoppe @DeenaNEWatchdog https://t.co/7cGeknWmoe",
"2015-10-02 ","21:15:04","RepBradAshford","Productive meeting with @homeinstead in #Omaha to discuss options for our seniors. http://t.co/R7b54dhzb0","Omaha"
"2015-10-02 ","20:38:11","RepBradAshford","@VSI4PTSD Will try to tune in to catch it. Don't represent western Iowa, but want #vets everywhere to get quality healthcare.","vets"
"2015-10-02 ","20:33:26","RepBradAshford","Congress should be here to work for the people - not cash in. I cosponsored leg to end congressional pensions. 
http://t.co/ygUF58G5aj",
"2015-10-02 ","20:05:03","RepBradAshford","Congress should be here to serve the people, not cash in on taxpayer money. I cosponsored leg 2 end pensions. http://t.co/ygUF58G5aj",
"2015-10-02 ","19:57:01","RepBradAshford","On this day in 1967, Thurgood Marshall became first African American Supreme Court Justice. Thanks for service, RIP. http://t.co/JzkwQ2JcMc",
"2015-10-02 ","15:20:15","RepBradAshford","Contact my #Omaha office for help with government services. http://t.co/Q4DFBAJRYl","Omaha"
"2015-10-01 ","21:45:03","RepBradAshford","Bipartisanship is commonsense policy to get things done. Too many refuse to compromise. #PeopleOverPolitics. https://t.co/EAxVyjOZcA","PeopleOverPolitics"
"2015-10-01 ","20:48:05","RepBradAshford","Oct Is #LGBTHistoryMonth. I cosponsored this bill to confer #vets status to people discharged for being #LGBT. https://t.co/i9pvXi4CMu","LGBTHistoryMonth vets LGBT"
"2015-10-01 ","19:20:08","RepBradAshford","David Cote, CEO of Honeywell​, wrote a must-read op-ed on the importance of reauthorizing the Ex-Im bank. ”https://t.co/0MWHrLIqWj",
"2015-10-01 ","19:05:50","RepBradAshford","My thoughts and prayers are with the victims of the #UCCShooting.","UCCShooting"
"2015-10-01 ","17:26:03","RepBradAshford","Visiting Washington, D.C.? My staff would be honored to provide you a private, staff-led tour of the Capitol. https://t.co/ERytPhNVxV",
"2015-10-01 ","15:00:06","RepBradAshford","Stop by @mccneb in #SouthOmaha for help with Social Security, #vets benefits, etc. #MobileOfficeHours. http://t.co/NTJWN1za9H","SouthOmaha vets MobileOfficeHours"
"2015-10-01 ","13:05:02","RepBradAshford","Having issues with city services? Call the mayor's hotline. More information is available here: http://t.co/yxGLyXedJM",
