"Date","Time","screen_name","text","hashtags"
"2016-09-23 ","23:02:46","RepEvanJenkins","Meeting with Jerry James of @BlfdStateColl about how we can expand opportunities for our students. https://t.co/Qq5YCR3UXQ",
"2016-09-23 ","15:18:28","RepEvanJenkins","The Prohibiting Future Ransom Payments to Iran Act will stop the administration from putting Americans abroad in danger.",
"2016-07-18 ","19:43:58","RepEvanJenkins","The drug crisis isn’t a partisan issue – we must work together to find solutions. https://t.co/0G7fLjpXK2",
"2016-07-18 ","00:04:57","RepEvanJenkins","We grieve for the families of the fallen officers in Baton Rouge and ask for God's grace on their souls. We must stand united against hate.",
"2016-07-08 ","20:18:47","RepEvanJenkins","More than 250 groups support the Comprehensive Addiction and Recovery Act – CARA. I urge the Senate to pass it now. https://t.co/b9zFSuh66G",
"2016-07-08 ","19:01:22","RepEvanJenkins","Meeting with @ZahavaUrecki, who received a Harry S Truman Scholarship. Congratulations, Zahava! https://t.co/pT0w7WaGF9",
"2016-07-08 ","17:40:54","RepEvanJenkins","I increased funding by $2 million for HIDTA, a program that helps local law enforcement stop drug trafficking. https://t.co/E1QdNvU5Hc",
"2016-07-08 ","16:20:38","RepEvanJenkins","If you are unhappy with the answers you have received from FEMA about your WV flood claim, I want to help you. https://t.co/YfSDJMwIDW",
"2016-07-08 ","15:41:40","RepEvanJenkins","Events in the past few days, culminating in Dallas, must not divide us. Now is a time to unite as Americans &amp; remember our common humanity.",
"2016-07-07 ","19:34:27","RepEvanJenkins","More than $20 million in FEMA individual assistance has been given to West Virginians, and more than 6,000 households have registered.",
"2016-07-07 ","19:33:55","RepEvanJenkins","I just finished a call with FEMA, and I wanted to share with you the latest on the response in West Virginia. https://t.co/PVlJZKRinC",
"2016-07-07 ","13:23:33","RepEvanJenkins","Two FEMA centers are opening today: Midland Trail High School in Fayette Co. &amp; McClintic Public Library in Pocahontas Co. Open 7-7 daily.",
"2016-06-13 ","19:35:27","RepEvanJenkins","Working with the leadership of West Virginia's largest physician organization to make patient care a priority. https://t.co/lvp0qtx6tY",
"2016-06-12 ","18:14:02","RepEvanJenkins","The news out of Orlando is tragic, and we pray for the victims, the injured, and their families and friends.",
"2016-02-26 ","17:53:24","RepEvanJenkins","I just voted to pass the SHARE Act, which protects our #2A rights and expands hunting and fishing opportunities. https://t.co/bpqWgGz70K","2A"
"2016-02-25 ","18:49:41","RepEvanJenkins","Stacie Walls of Boone County and her family are the true faces of the war on coal. #WVCoalVoices https://t.co/kZghZW2fTm","WVCoalVoices"
"2015-12-03 ","18:26:08","RepEvanJenkins","The House-passed, 5-year highway bill means billions in transportation funds for West Virginia. This is a great day! https://t.co/C14UR9v6wJ",
"2015-12-03 ","17:40:05","RepEvanJenkins","H.R. 8 includes an amendment I wrote to study how American energy can be used to create new jobs &amp; make our allies more secure. #Yes2Energy","Yes2Energy"
"2015-12-03 ","17:39:25","RepEvanJenkins","Our energy laws haven’t been updated since the 1970s. We need policies that promote all energy, starting with coal. #Yes2Energy","Yes2Energy"
"2015-11-28 ","15:51:43","RepEvanJenkins","Shop small today and support West Virginia's local businesses and families. #SmallBusinessSaturday https://t.co/aS7imPBMIm","SmallBusinessSaturday"
"2015-10-31 ","00:46:31","RepEvanJenkins","Thanks to Lily’s Place @Addicted_Babies &amp; Raleigh General Hospital for welcoming me today to talk about #CradleAct. https://t.co/gZkIWWfPcV","CradleAct"
"2015-10-02 ","20:13:16","RepEvanJenkins","One bill can make a difference for more than 100,000 miners and their families.
https://t.co/avXUfKg39k",
"2015-10-02 ","18:42:23","RepEvanJenkins","I’m committed to fighting for our coal miners &amp; their families. They deserve the benefits they were promised. https://t.co/efu9KpX8nU",
"2015-10-01 ","17:58:35","RepEvanJenkins","Victims of Iranian terrorism deserve justice. #NotOneCent https://t.co/EOpnR6yWEu","NotOneCent"
"2015-07-17 ","18:22:41","RepEvanJenkins","Great news for our veterans in Fayette, Greenbrier, Monroe, Nicholas, Pocahontas, and Summers counties. http://t.co/jWWnRiJc55",
"2015-07-17 ","16:12:19","RepEvanJenkins","VA Secretary Bob McDonald has committed to reopening the Greenbrier CBOC, helping thousands of WV veterans receive treatment closer to home.",
"2015-07-16 ","19:16:51","RepEvanJenkins","The administration continues to ignore the consequences of their regulations on West Virginia’s families and West Virginia’s economy.",
"2015-07-16 ","19:16:29","RepEvanJenkins","I am outraged that the administration is moving forward with the job-killing stream buffer zone rule.",
"2015-06-18 ","20:47:24","RepEvanJenkins","Meeting with members of the Coalfield Development Corporation about their work in Lincoln, Mingo and Wayne counties. http://t.co/7ZCwIEyqHj",
"2015-06-18 ","18:24:26","RepEvanJenkins","Tune in to @WSAZnews, @wtapnews or @WHSVnews tonight to hear what I’m doing to combat West Virginia’s drug crisis. http://t.co/KrKksVkeaT",
"2015-06-18 ","16:53:52","RepEvanJenkins","I voted no today on #TPA again after reading the bill and listening to the thoughts and concerns of southern West Virginians.","TPA"
"2015-06-18 ","15:22:27","RepEvanJenkins","Parker Lane and his mother, Melissa, share their family’s experiences with mitochondrial disease with me. @UMDF http://t.co/kU6v7O54ZZ",
"2015-06-17 ","21:20:24","RepEvanJenkins","Meeting with @marshallU student Kendyl Ryan of Madison about the Gear Up Alumni Leadership Academy. @edpartnerships http://t.co/YHVe4z1Tr8",
"2015-06-17 ","21:04:50","RepEvanJenkins","Meeting with American Association of Christian Schools leaders to discuss faith-based education. @AACS_DC http://t.co/BChMYOVilK",
"2015-06-17 ","20:27:21","RepEvanJenkins","Proud to increase funding for programs to address the drug crisis in Appalachia and protect them from the president’s cuts. @HouseAppropsGOP",
"2015-06-17 ","15:54:07","RepEvanJenkins","Meeting w/ Alexis Budrevich &amp; Angie Wood of the Augusta Levy Learning Center in Wheeling about autism. #autismspeaks http://t.co/D2OJt5eZxC","autismspeaks"
"2015-06-17 ","00:51:06","RepEvanJenkins","Supporting @marshallu athletics with @DOCMUFB, Danny D'Antoni and @SenCapito. Go Herd! @HerdZone @MarshalluPres http://t.co/qDbXodd0Lq",
"2015-06-17 ","00:41:36","RepEvanJenkins","Celebrating Marshall University at tonight's State of the University address. @MarshalluPres @marshallu @HerdZone http://t.co/fcNzZoeYRZ",
"2015-06-12 ","18:28:43","RepEvanJenkins","I will continue to support policies that will put West Virginians back to work, and #TPA is not the right way forward for West Virginia.","TPA"
"2015-06-12 ","18:28:19","RepEvanJenkins","After much consideration &amp; listening to the people of the Third Congressional District, I voted no when it came before the House today. #TPA","TPA"
"2015-06-12 ","18:27:19","RepEvanJenkins","I have carefully and thoughtfully read the Trade Promotion Authority #TPA legislation, which has been public for nearly two months.","TPA"
"2015-06-12 ","02:16:52","RepEvanJenkins","An honor to spend today with WV House Speaker Tim Armstead and Senate Majority Leader Mitch Carmichael. http://t.co/YsdfXpeM9x",
"2015-06-11 ","23:14:19","RepEvanJenkins","Yesterday I helped cut the EPA’s budget, &amp; today I helped cut the president’s funding to push his climate agenda overseas. @HouseAppropsGOP",
"2015-06-11 ","19:52:24","RepEvanJenkins","Welcoming high school students from Reconnecting McDowell to Washington. http://t.co/OUNvdc5o9L",
"2015-06-11 ","15:43:59","RepEvanJenkins","ICYMI in today’s @BDTonline from @BDTOwens: Representative Jenkins cuts EPA budget by $1.2 billion http://t.co/7ypbOZCccJ",
"2016-09-23 ","22:39:09","RepAlexMooney","Beautiful day in West Virginia! I made a quick stop by the Pendleton County Chamber of Commerce this afternoon on my way to Elkins. https://t.co/mcsgv2AaQM",
"2016-09-23 ","20:03:07","RepAlexMooney","The @UN should have included #Taiwan in @icao. Contributions from all counties on international aviation security are needed.","Taiwan"
"2016-07-18 ","19:45:14","RepAlexMooney","Near Charles Town &amp; need assistance w the VA? Come 2 my mobile office hrs tmrw @ 11:30am @ the American Public Uni. https://t.co/V2B0INsSpc",
"2016-07-18 ","16:52:38","RepAlexMooney","It was great running into one of West Virginia's finest State Troopers who's helping out in Cleveland. https://t.co/OCtdtQ0lww",
"2016-07-17 ","17:37:11","RepAlexMooney","This must stop. My prayers are with these officers and their families in #BatonRouge right now. https://t.co/LuAj2nLd5B","BatonRouge"
"2016-07-08 ","18:19:15","RepAlexMooney","Happy to welcome two of our newest summer interns to the Hill today. Glad to have you with us! https://t.co/WrWxfjboUi",
"2016-07-07 ","18:47:54","RepAlexMooney","On Wed, @HHSGov announced that they are implementing the important policy changes contained in my bill, the PROP Act https://t.co/7LxScevhUB",
"2016-06-12 ","16:19:06","RepAlexMooney","My thoughts and prayers are with the people of #Orlando, the victims, and their families.  https://t.co/WSxYrwqz8B","Orlando"
"2016-02-26 ","18:19:22","RepAlexMooney","I voted for H.R. 2406, the SHARE Act. This bill will help keep the EPA out of your hunting ammunition and tackle box https://t.co/49BLa3juyD",
"2016-02-25 ","19:32:59","RepAlexMooney","It was great meeting w The West Virginia Wing of the @CivilAirPatrol this morning. Happy 75th anniv. to the Patrol! https://t.co/Ci0MJhUUYK",
"2015-12-03 ","20:48:56","RepAlexMooney","It's beginning to look a lot like Christmas in my Charleston office! https://t.co/BefUbLDgCl",
"2015-12-02 ","21:01:48","RepAlexMooney","Great talking with @KennieBassWCHS of @wchs8fox11 today in DC. https://t.co/NX0j9xn09u",
"2015-12-02 ","16:12:50","RepAlexMooney","Yesterday, I took a few moments with @RedCross to sign Christmas cards to send to our troops overseas #HolidayMail https://t.co/KMDRo5glpD","HolidayMail"
"2015-10-02 ","01:54:58","RepAlexMooney","I'm honored to have received the 2015 American Swiss Leadership Award. http://t.co/DOarEKGNnw",
"2015-10-01 ","18:01:53","RepAlexMooney","The victims of Iran’s terror deserve justice. That’s why I voted for H.R. 3457. https://t.co/lRfooq1OfA",
"2015-07-17 ","16:51:18","RepAlexMooney","Sitting down with members of the  @ephba to discuss the problems they face due to overregulation. http://t.co/SyCxb2HP4B",
"2015-07-17 ","13:59:01","RepAlexMooney","Outside of Martinsburg at the VA IT Training facility. They have trained over 8k OI&amp;T staff this year. http://t.co/z6q36YfOSg",
"2015-07-16 ","20:22:57","RepAlexMooney","(2/2)My bill, the STREAM Act will prevent this regulation from being implemented which will help save #coaljobs &amp; help keep energy costs low","coaljobs"
"2015-07-16 ","20:21:57","RepAlexMooney","(1/2)The new @OSMRE stream buffer zone rule will kill jobs and hurt our economy. https://t.co/3jF271b9ER",
"2015-06-18 ","16:45:35","RepAlexMooney","West Virginia will receive $5.2 million in funding for key job training programs to help fight unemployment. http://t.co/pM9re0JYVx",
"2015-06-18 ","16:44:57","RepAlexMooney","I signed a letter, along with the delegation, urging Sec. Perez to help combat West Virginia’s rising unemployment.
http://t.co/kQ5pjI4Uq6",
"2015-06-17 ","22:05:32","RepAlexMooney","I spoke on the House floor to voice my support for the repeal of the Medical Device tax. See my full speech here: https://t.co/qIsAIA4kTV",
"2016-09-24 ","16:16:20","RepMcKinley","We must protect the pensions &amp; health benefits of our coal miners! Let's get this done! https://t.co/cnDwEqKKNH #coal #Pensions #healthcare","coal Pensions healthcare"
"2016-09-24 ","16:05:37","RepMcKinley","Good luck today @WVUfootball Go Mountaineers!!!! https://t.co/1ytqeFLwHF",
"2016-09-23 ","15:43:13","RepMcKinley","We must not allow any more ransom payments to Iran. https://t.co/jyi9pr0vWG #nationalsecurity #ForeignPolicy","nationalsecurity ForeignPolicy"
"2016-07-18 ","18:53:18","RepMcKinley","Great read in @IntelligencerWV about our opportunity to pass the first comprehensive energy bill since 2007. https://t.co/iU2nEUiW5B #energy","energy"
"2016-07-18 ","13:39:58","RepMcKinley","On the radio right now with Mike Queen discussing coal miner benefits. Tune in here - https://t.co/6VbUfXhkol",
"2016-07-17 ","15:33:19","RepMcKinley","Very saddened to hear that more police officers have been shot. We need to come together as one nation and stop this violence. #BatonRouge","BatonRouge"
"2016-07-08 ","18:25:21","RepMcKinley","With today's vote on #CARA, the House has taken another step to combat opioid abuse and drug addiction #opioidcrisis https://t.co/enzKbuwQz2","CARA opioidcrisis"
"2016-07-08 ","14:35:50","RepMcKinley","Sorry to hear about Corky DeMarco of @WVONGA. He was a tireless advocate for WV oil and natural gas jobs and we enjoyed working with him.",
"2016-07-08 ","13:40:09","RepMcKinley","I am very saddened to hear of the shootings over the past few days. We must stand together and condemn all forms of unjustified violence.",
"2016-07-07 ","22:21:25","RepMcKinley","Had a good meeting with reps from the National Youth Science Foundation. We must continue to promote STEM education! https://t.co/LahwfPFYSg",
"2016-07-07 ","14:50:21","RepMcKinley","Had a great meeting yesterday with students from the 4-H Club. Always great to meet our future leaders! #4HCWF https://t.co/Vjp5VWzlni","4HCWF"
"2016-07-07 ","14:36:49","RepMcKinley","The @HouseCommerce is hard at work. #RecordofSuccess #Energy https://t.co/dtgwOiPqzA","RecordofSuccess Energy"
"2016-07-07 ","12:50:00","RepMcKinley","Waiting to hear Donald Trump's presentation and how he handles the Q&amp;A with my colleagues in DC.  Room is packed.",
"2016-06-13 ","17:58:56","RepMcKinley","It was a great honor to speak with future leaders at the kickoff of Girls State. Read the @IntelligencerWV https://t.co/prmzOJ0W8S",
"2016-06-13 ","13:51:17","RepMcKinley","Flags at the @uscapitol are at half-staff today in memory of the victims in Orlando. https://t.co/phDKwyIfnv",
"2016-06-12 ","14:34:12","RepMcKinley","Our thoughts and prayers are with the people of Florida.",
"2015-12-02 ","22:11:32","RepMcKinley","Amendment #2 for the day. This would stop permits for coal export facilities from being denied preemptively. https://t.co/RyIDpUoa5Y",
"2015-12-02 ","21:30:37","RepMcKinley","Yes I will  https://t.co/V9tiWk5LiO",
"2015-12-02 ","21:30:15","RepMcKinley","The House just passed our amendment to study ethane storage - would benefit WV and the entire U.S. https://t.co/9aaQC72hsp",
"2015-10-02 ","23:06:23","RepMcKinley","On the road in Marion County en route to the mine with @PeterWelch #bipartisanroadtrip http://t.co/8fkF7DJSzG","bipartisanroadtrip"
"2015-10-02 ","16:46:07","RepMcKinley","What a welcome from 1000+ miners. Rally to keep promises on pensions &amp; healthcare #bipartisanroadtrip w @PeterWelch http://t.co/qHHWs5BcY7","bipartisanroadtrip"
"2015-10-02 ","14:54:17","RepMcKinley","A great convo with laid off umwa miners with @PeterWelch - we need DC to show more compassion #bipartisanroadtrip http://t.co/a4tWmRxNk7","bipartisanroadtrip"
"2015-10-02 ","14:13:19","RepMcKinley","Started the day w/ workforce offcls 2 get feedback on what DC should be focused on w/ @PeterWelch #bipartisanroadtrip http://t.co/8tgyOnAuqI","bipartisanroadtrip"
"2015-10-01 ","20:16:01","RepMcKinley","Wild and Wonderful! https://t.co/jUQRiKNjdJ",
"2015-07-17 ","20:04:50","RepMcKinley","Thank you to all who attended our round table on domestic violence this afternoon in Wood County http://t.co/cqwEudWJSa",
"2015-07-16 ","20:53:56","RepMcKinley","Not weighing in one way or another, but the current name does have a certain ring to it... https://t.co/FAGhEj36if",
"2015-07-16 ","19:16:32","RepMcKinley","Will Obama Admin's latest #SBZ rule improve economy? Help job growth? Make us energy independent? No. http://t.co/OKvlpJjTyy","SBZ"
"2015-07-16 ","14:17:29","RepMcKinley","Good! It's about time Obama Admin officials took into account the impacts on coal communities of their #WarOnCoal https://t.co/3XO41KgNTR","WarOnCoal"
"2015-07-16 ","12:20:30","RepMcKinley","Obama Admin hurting families by breaking law and ignoring court orders - leading to confusion and heartache http://t.co/CIOBJDSqqJ",
"2015-07-16 ","12:18:50","RepMcKinley","It's. The. Law. http://t.co/CIOBJDSqqJ",
"2015-06-17 ","21:23:56","RepMcKinley","@singernews West Virginians are eager for change from the current Administration's destructive policies #wvpol","wvpol"
"2014-10-24 ","18:42:40","RepMcKinley","Bridgeport Farmers Market is a great place to spend a Sunday! http://t.co/IbKmMnThkM",
"2014-10-24 ","17:27:03","RepMcKinley","Obamacare continues to put citizens, and their personal information, at risk http://t.co/ramfK0NAvZ",
"2014-10-24 ","17:16:55","RepMcKinley","WVU is leading the way in medical research http://t.co/7lo6cypegd",
"2014-10-24 ","14:35:34","RepMcKinley","Congratulations to Christopher Morlock, Intern in our Morgantown Office, for being chosen as a Finalist for Mr. Mountaineer at WVU!",
