"Date","Time","screen_name","text","hashtags"
"2016-07-18 ","20:24:04","RepTomEmmer","Incredibly proud that St. Cloud has been named as the 12th healthiest city in the U.S.! https://t.co/1u6dAZhCm8",
"2016-07-18 ","19:47:44","RepTomEmmer","Glad the Ridgeway family could stop by my office before their Capitol tour! https://t.co/8WSXXK4YxP",
"2016-07-18 ","19:10:36","RepTomEmmer","GOP warming up to Cuba travel via @thehill https://t.co/tx0Wr2L5wo",
"2016-07-18 ","17:49:20","RepTomEmmer","Last week, my legislation to honor Eugene McCarthy passed the Senate. Now on to the President’s desk! https://t.co/KOaespn9rK",
"2016-07-18 ","16:49:28","RepTomEmmer","If you are having issues navigating a federal agency, be sure to stop by my mobile office hours this week. https://t.co/z1nve9z6j1",
"2016-07-17 ","20:49:18","RepTomEmmer","Saddened to hear about the passing of Minnesota's 33rd Governor, Wendell Anderson. Sending our prayers to his loved ones.",
"2016-07-17 ","20:25:29","RepTomEmmer","Heightened regulation and scrutiny has acted as a huge burden for small banks and credit unions. via @RiponAdvance https://t.co/TTTju5mbpC",
"2016-07-17 ","17:30:51","RepTomEmmer","We must take a stand against this sustained &amp; organized violence toward our police &amp; peace officers. Hate must end and peace must prevail.",
"2016-07-08 ","19:00:22","RepTomEmmer","Thanks for stopping by! https://t.co/oqdmTVoJ7w",
"2016-07-08 ","17:11:33","RepTomEmmer","Opioid addiction is plaguing our nation which is why today, I voted to pass the CARA Act, which will work to prevent opioid abuse.",
"2016-07-08 ","14:21:03","RepTomEmmer","Praying for calm, for peace, for healing in our nation.",
"2016-07-07 ","21:25:56","RepTomEmmer","I’m running a caption contest over on my Facebook page, so be sure to go like my page and check it out! https://t.co/UuviujPdI2",
"2016-07-07 ","18:10:59","RepTomEmmer","Today I joined the @SBECouncil to discuss the importance of #IP to entrepreneurship &amp; our nation’s economic growth! https://t.co/aYYberN1y6","IP"
"2016-07-07 ","15:41:07","RepTomEmmer","Looking forward to it! https://t.co/7PPIXfLpYD",
"2016-06-13 ","14:56:54","RepTomEmmer","This week, my staff will be holding mobile office hours in St. Augusta and Hugo. Be sure to stop by! https://t.co/u3PWVEp1EA",
"2016-06-12 ","17:49:58","RepTomEmmer","Incredibly saddened to hear of the recent shooting in Orlando. Our condolences are w/the victims' loved ones &amp; we are sending them prayers",
"2016-02-26 ","21:54:08","RepTomEmmer","Nothing is more important than the safety of the American people &amp; more must be done to protect our citizens. https://t.co/oSSW5TanqB",
"2016-02-26 ","20:18:04","RepTomEmmer","Along with the majority of my colleagues, I voted to pass the SHARE Act which will expand the right to hunt and fish on federal land!",
"2016-02-25 ","22:48:28","RepTomEmmer","Thank you @timsandersmn for your dedicated service to Blaine and #MN06. You will be missed in the #mnleg!","MN06 mnleg"
"2016-02-25 ","21:55:30","RepTomEmmer","Congrats to Brigadier General Sandy Best for becoming the 1st woman Brigadier General in @MNNationalGuard history! https://t.co/FLlVJCF9Er",
"2016-02-25 ","21:29:36","RepTomEmmer","#TBT to when I traveled to #Selma to honor those who marched for more equality in our nation. #BlackHistoryMonth https://t.co/QLM27QlvA2","TBT Selma BlackHistoryMonth"
"2016-02-25 ","20:50:26","RepTomEmmer","It was great having members of the @CivilAirPatrol stop by my office today. Congrats on your 75th Anniversary! https://t.co/DdJtKyLcL1",
"2016-02-25 ","18:32:47","RepTomEmmer","It's been 20 yrs since Officer Brian Klinefelter was killed &amp; this loss is still felt in our community today. https://t.co/iwHLy1zpDZ",
"2016-02-25 ","17:43:16","RepTomEmmer","Transportation is vital in MN &amp; I thank the @AnokaCounty Commissioners for discussing transportation solutions w/ me https://t.co/uEOfHwCSkv",
"2016-02-25 ","16:56:31","RepTomEmmer","Had a blast giving a Capitol tour to @SivarajahMN, @RobynLWest, @ScottSchulte, Jerry Soma, Matt Look, &amp; Mike Gamache https://t.co/1ISsibsBbB",
"2016-02-20 ","18:17:50","RepTomEmmer","I believe education decisions must be made close to home. Check out my op-ed in @sctimes https://t.co/ajkmw5tKsQ",
"2015-12-03 ","20:27:24","RepTomEmmer","Today, I was glad to vote on the highway bill which thankfully reversed the $3 billion in cuts to crop insurance.",
"2015-12-03 ","19:16:07","RepTomEmmer","Our country’s energy laws are old and outdated. Today, I voted to fix this problem. #Yes2Energy https://t.co/W4CyWoEKf4","Yes2Energy"
"2015-12-03 ","18:58:31","RepTomEmmer","Proud to have voted for H.R. 22 this afternoon, which will put Minnesotans back in charge of their transportation system #FASTAct","FASTAct"
"2015-12-03 ","18:07:33","RepTomEmmer","Next Monday I will be holding my 2nd Twitter town hall @ 2:00pm. Submit a question via Facebook, Twitter or https://t.co/xuAcaieO00 #AskTom","AskTom"
"2015-12-03 ","01:48:53","RepTomEmmer","Today I voted to replace #NCLB and end Common Core. Washington can't determine what is best for our students.","NCLB"
"2015-12-02 ","20:53:19","RepTomEmmer","ICYMI-Next Monday I will be hosting my 2nd Twitter town hall. Submit a question via Facebook, Twitter, or https://t.co/qDqQ18yh74",
"2015-12-02 ","19:59:48","RepTomEmmer","It’s the most wonderful time of the year! Watch the Capitol Christmas tree lighting ceremony live tonight at 4 p.m. https://t.co/sXvI4aQlxl",
"2015-12-02 ","19:00:32","RepTomEmmer","Today I spoke in support of H.R. 4166, which was introduced by @RepGwenMoore and myself. Watch my speech here: https://t.co/AWlkEFsjgd",
"2015-12-02 ","15:43:28","RepTomEmmer","Want to learn more about the work I am doing &amp; events I will be holding in the future? Sign up for my Vekeo page https://t.co/32ClkgL9kX",
"2015-12-02 ","02:37:48","RepTomEmmer","Thanks to everyone who participated in my tele-town hall! Visit https://t.co/1uSdYx1Q4p to learn about future events https://t.co/41u6mAfTbT",
"2015-11-28 ","17:57:37","RepTomEmmer","Small businesses are the backbone of our economy. Today, and every day, we must celebrate these businesses! #ShopSmall #SmallBizSaturday","ShopSmall SmallBizSaturday"
"2015-10-02 ","18:27:52","RepTomEmmer","On October 13th I will be hosting my 12th town hall this year in Sherburne County. Make sure to mark your calendars! http://t.co/FDShNZGJX3",
"2015-10-02 ","16:28:04","RepTomEmmer","Looking forward to the St. Cloud VA mtg and our following roundtable with veteran leaders. https://t.co/mKANg2PnHN",
"2015-10-02 ","15:52:32","RepTomEmmer","Had a great tour of DCI Inc. in St. Cloud. Thank you for everything you do for the manufacturing industry! http://t.co/qc71DLmhkF",
"2015-10-02 ","15:33:38","RepTomEmmer","Today is #Manufacturing day! However every day in Minnesota is manufacturing day. #MFGDay15 https://t.co/bmUsxog1gZ","Manufacturing MFGDay15"
"2015-10-01 ","18:17:21","RepTomEmmer","Remember that October is #BreastCancerAwarenessMonth. We must work to bring awareness and encourage early detection.","BreastCancerAwarenessMonth"
"2015-10-01 ","16:50:19","RepTomEmmer","This week I spoke on the House Floor to thank Branden Petersen for his impressive service in the #mnleg https://t.co/7tk45lbT6u","mnleg"
