"Date","Time","screen_name","text","hashtags"
"2016-07-08 ","16:44:32","RepKayGranger","My thoughts and prayers go to the @DallasPD and DART and families of officers killed and wounded. https://t.co/rMSSAMFxHv",
"2015-12-02 ","18:22:38","RepKayGranger","Honored to receive the Malaria Vision Award from @MalariaNoMore and to join those working hard to #defeatmalaria  https://t.co/xuDzJlSjAI","defeatmalaria"
"2015-07-16 ","21:06:17","RepKayGranger","https://t.co/1xeFUnTZ6R http://t.co/oFRsFrZYUN",
"2015-07-16 ","16:03:06","RepKayGranger","Great meeting this morning with TX Land Commissioner George P. Bush. Continuing his family's legacy of public service http://t.co/4ZRHgxEQXt",
"2015-06-18 ","17:47:18","RepKayGranger","#TBT In the honor the men of Charlie Company. They were honored at last week's #FortWorth #FlagDay event. http://t.co/Y31NmOvEAS","TBT FortWorth FlagDay"
"2015-06-17 ","19:36:39","RepKayGranger","Bud Kennedy wrote a great story about #FortWorth supporting members of #CharlieCompany
http://t.co/ejrx8V96Tm","FortWorth CharlieCompany"
"2015-06-17 ","16:31:29","RepKayGranger","Great meeting with 301st Fighter Wing Commander Colonel John Breazeale &amp; Command Chief, Chief Master Sgt.Terry Goines http://t.co/Q4XVXHCeZG",
"2014-04-04 ","21:18:02","RepKayGranger","Today, I had the honor to meet up with a DFW Honor Flight group of WWII veterans at their memorial in Washington. http://t.co/j2Fys1IOQr",
"2014-04-03 ","14:37:58","RepKayGranger","My thoughts and prayers go out to all those impacted by the tragedy at Fort Hood http://t.co/WbrQ5TJ01d",
"2014-02-21 ","16:55:23","RepKayGranger","My latest e-newsletter: ID Theft Tax Refund Crimes on the Rise http://t.co/1fo0Cq38X1",
"2013-09-17 ","16:01:32","RepKayGranger","Authorities ask that anyone with information on Aaron Alexis contact the FBI at (202) 278-2000 or 1-800-CALL-FBI. #NavyYardShooting","NavyYardShooting"
"2013-09-17 ","14:02:04","RepKayGranger","The US Constitution not only established a government by the people, but also protects freedoms for the people still today. #ConstitutionDay","ConstitutionDay"
"2013-09-16 ","21:10:15","RepKayGranger","I'm horrified by the #NavyYardShooting. I pray for the victims and their families as well as the law enforcement officials who responded.","NavyYardShooting"
"2013-09-16 ","14:04:45","RepKayGranger","#ENDALZ Sept is World Alzheimer’s Month. Thanks to all caregivers. Please learn more about Alzheimer’s &amp; its symptoms:http://t.co/8eUB4zhFRm","ENDALZ"
"2013-07-26 ","01:00:37","RepKayGranger","To turn our economy around, the 1st step must be to start doing things in DC like we’ve been doing them in Fort Worth.http://t.co/NgT6gxxBCQ",
"2013-06-07 ","18:22:31","RepKayGranger","You can now become Citizen #Cosponsor. Follow bills as they go through the legislative process. Visit http://t.co/stwmh9VuI4","Cosponsor"
"2012-12-14 ","21:39:12","RepKayGranger","My thoughts and prayers are with the families affected by the tragic events that transpired in #Newtown, CT.  We are mourning with you.","Newtown"
"2012-09-28 ","17:07:26","RepKayGranger","#FF @PaulRyanVP  @USSFortWorth  @RepCanseco  @TeamRomney  @cityoffortworth @usaid_info  @RPTPolitical  @TexasYRs","FF"
"2012-09-27 ","19:04:47","RepKayGranger","My colleagues and I sent a letter this week to President @BarackObama regarding unanswered questions on #Libya http://t.co/U13M3bVd","Libya"
"2012-02-22 ","14:04:16","RepKayGranger","Spoke last night with @TCU students interested in entrepreneurship which is critical #4jobs in the US. Shared my entrepreneurial experience.","4jobs"
"2012-02-21 ","15:27:27","RepKayGranger","Great read in @StarTelegram ‘Granger takes Air Force to task for costs of moving Hercules aircraft from #FortWorth’ http://t.co/vZSgDszc","FortWorth"
"2012-02-21 ","15:07:25","RepKayGranger","Yesterday was #PresidentsDay, a time for all Americans to honor past Presidents to our nation, starting with Washington http://t.co/pSghQ6Xh","PresidentsDay"
"2011-10-13 ","16:54:53","RepKayGranger","Good article by the Associated Press on military cuts and my view on how it affects programs. Read the whole story here http://t.co/BcUmrU2I",
"2011-10-12 ","20:23:46","RepKayGranger","Met earlier today with Bill Hammond, President of @TXbiz, to discuss legislation affecting businesses in Texas http://t.co/L6F9zLr6 #Texas","Texas"
"2011-10-12 ","15:24:48","RepKayGranger","Listen to the full audio of my panel discussion on global health hosted by CSIS and the @TCU Schieffer School here http://t.co/xxCxXQ0W #TX","TX"
"2011-09-07 ","22:55:24","RepKayGranger","See my photos from yesterday's dedication ceremony for #ACH new Julie and Glenn Davidson Family Chapel http://t.co/4m9j0Ua","ACH"
"2011-09-06 ","19:40:20","RepKayGranger","@SpeakerBoehner and @GOPLeader sent letter to @WhiteHouse noting need for bipartisan work on jobs bills passed by House http://t.co/gCFMuZ9",
"2010-08-04 ","21:46:47","RepKayGranger","View my recent E-Newsletter: Let's Keep in Touch. I discuss the upcoming communications blackout. http://bit.ly/aGx1wV",
"2010-08-03 ","15:21:50","RepKayGranger","Congrats to @cathymcmorris who announced she is expecting http://bit.ly/bMDh42",
"2016-06-12 ","21:20:24","ConawayTX11","Happy 92nd birthday to a truly great American, @GeorgeHWBush https://t.co/53qfRnxsEm",
"2013-09-16 ","21:03:00","ConawayTX11","Suzanne &amp; I pray for strength, comfort and healing for the wounded, the survivors, and the families of those killed at the Navy Yard today.",
"2012-12-14 ","22:45:41","ConawayTX11","My thoughts and prayers are with everyone in Newtown, Conn.",
"2012-02-22 ","16:18:49","ConawayTX11","RICK SMITH: Chapel honors WWII hero http://t.co/mGxoQbfI",
"2016-09-23 ","19:29:42","RepMcCaul","It was an honor to meet Hannah Adams – Hyundai Hope of Wheels Youth Ambassador at the 7th Annual Childhood Cancer Caucus today https://t.co/Vz5KPO8JXC",
"2016-09-23 ","00:29:13","RepMcCaul","Honored to be a part of the #GoldenToast this evening! Let's end childhood cancer once and for all","GoldenToast"
"2016-07-08 ","18:49:32","RepMcCaul","Pray for #Dallas. https://t.co/4uG4PI1D11","Dallas"
"2016-07-08 ","17:30:20","RepMcCaul","The attack in #Dallas is horrific. My condolences are with the victims' families &amp; the people of Dallas: https://t.co/Lz8dzTMRyY","Dallas"
"2016-07-08 ","14:58:13","RepMcCaul","Today &amp; every day, we stand with our police officers &amp; first responders &amp; with the people of my hometown of #Dallas: https://t.co/Lz8dzU4sXy","Dallas"
"2016-07-07 ","16:29:38","RepMcCaul","Terrible news, hopefully those injured in Sealy will be ok. Thank you to our first responders on the scene. https://t.co/CrAjw92x16",
"2016-06-12 ","16:43:06","RepMcCaul","Happy birthday POTUS George H.W. Bush. @USNavy @aircraftcarrier @USN_BushCVN77 is a fitting legacy to your service. https://t.co/Kandmpkxzu",
"2016-06-12 ","16:16:00","RepMcCaul","My statement on senseless tragedy in #Orlando is here: https://t.co/Xpl6oX6Rhe","Orlando"
"2016-06-12 ","15:49:19","RepMcCaul","Instead, tragedies like this only strengthen our resolve to fight back against terror &amp; prevail over extremism wherever it emerges.",
"2016-06-12 ","15:48:44","RepMcCaul","But Americans will not be intimidated by these fanatics.",
"2016-06-12 ","15:47:44","RepMcCaul","It is a sobering reminder that radical Islamists are targeting our country and our way of life.",
"2016-06-12 ","15:46:17","RepMcCaul","This appears to be the worst terrorist attack on American soil since 9/11.",
"2016-06-12 ","15:45:47","RepMcCaul","I want to thank local law enforcement for their bravery in responding to this massacre.",
"2016-06-12 ","15:44:41","RepMcCaul","Our thoughts and prayers are with the victims of this senseless tragedy, their families, and the people of Orlando.",
"2016-02-26 ","18:34:27","RepMcCaul","#POTUS' proposal to close #Gitmo proves his priority lies in leaving behind a legacy rather than protecting the American people.","POTUS Gitmo"
"2016-02-25 ","18:03:46","RepMcCaul","Watch my questioning of Secretary of State John Kerry on the Visa Waiver Program at today's @HouseForeign hearing: https://t.co/KhevUC5Dn7",
"2016-02-25 ","16:18:10","RepMcCaul","This @NationalFFA week #TBT to my legislation to exempt students from taxes on FFA and 4H projects: https://t.co/35RQWIAfWD","TBT"
"2015-11-28 ","21:25:06","RepMcCaul",".@WaterlooRecords will be celebrating #SmallBusinessSaturday in Austin with discounted records and special guests so you can #ShopSmall","SmallBusinessSaturday ShopSmall"
"2015-11-28 ","20:24:03","RepMcCaul","Celebrate #SmallBusinessSaturday in ATX at the @austinartgarage. They will be offering special treats with their neighbor @THIRSTY_PLANET","SmallBusinessSaturday"
"2015-11-28 ","18:24:02","RepMcCaul","La Grange would never be the same without Gold N’ Crisp Fried Chicken. Treat yourself to some this Small Business Saturday. #DineSmall","DineSmall"
"2015-11-28 ","17:23:03","RepMcCaul","This year marks the 55th anniversary for Gloyer’s Pharmacy in Tomball. Don’t forget to #ShopSmall this Small Business Saturday.","ShopSmall"
"2015-11-28 ","15:23:02","RepMcCaul","Honored to represent the 2015 Sealy Business of the Year, Tony’s Family Restaurant, this Small Business Saturday. #DineSmall","DineSmall"
"2015-10-31 ","01:13:42","RepMcCaul","A great night seeing an inspirational film @Until20_Film. Good to see Dr. Ronald DePinho President @MDAndersonNews. https://t.co/JMSpax3Ovo",
"2015-10-02 ","16:02:39","RepMcCaul","Yesterday's shooting was a tragedy. We need to address the mental health crisis in this country: https://t.co/0MPViDkxPM",
"2015-10-01 ","19:30:56","RepMcCaul","My heart goes out to the victims and families impacted by the #UCCSHOOTING in Roseburg, Oregon.","UCCSHOOTING"
"2015-10-01 ","19:15:16","RepMcCaul","I continue to stand with Israel and Prime Minister Netanyahu and agree that #IranDeal makes war more likely, not peace.","IranDeal"
"2015-07-17 ","22:55:28","RepMcCaul","ICYMI: My press conference from MacDill AFB on the #ChattanoogaShooting : https://t.co/o25iOoOP7H","ChattanoogaShooting"
"2015-07-16 ","15:04:01","RepMcCaul","ICYMI: My @statesman Op/Ed with Lord Saatchi (UK Parliament) on the need for compassionate use reform in U.S. &amp; U.K. http://t.co/snsecObBLG",
"2015-06-17 ","21:01:41","RepMcCaul","I voted against a resolution to withdraw us from Syria &amp; Iraq we cannot cede victory to ISIS, they must be defeated. https://t.co/tgDxDiR1RQ",
"2015-06-12 ","19:36:21","RepMcCaul","Today @HouseGOP passed a bill to place limitations on President Obama and strengthen trade policy/our economy: http://t.co/vxPs6RRZ08",
"2015-06-11 ","19:34:41","RepMcCaul","Democrats are playing politics with our troops to try to increase spending for EPA and the IRS: http://t.co/QeYAgFjVI0",
"2014-10-24 ","15:41:52","RepMcCaul","#1 on this list, Round Top is in my district, proud to represent so many great small towns! http://t.co/M9wqbUJQNH #roundtoptx","roundtoptx"
"2014-10-24 ","14:58:48","RepMcCaul","Tonight @TISDTHS honor the ’84 Cougars Football Team. Good luck to the Tomball Cougars and Brenham Cubs! #tomball #brenham @TomballSports","tomball brenham"
"2014-04-04 ","18:09:58","RepMcCaul","My weekly newsletter is out.  You can read it here http://t.co/kACFKy1Neh and sign up to receive it here http://t.co/oFq4sTz4gd.",
"2014-04-03 ","16:12:48","RepMcCaul","My thoughts &amp; prayers are with the victims, the families and the entire Ft. Hood community. http://t.co/uI3rMFCyDk",
"2014-04-03 ","13:31:36","RepMcCaul","I was on @MyFoxHouston this morning discussing the #FortHoodShooting.  You can watch the clip here http://t.co/Jum2rKJBoG.","FortHoodShooting"
"2014-04-03 ","02:31:49","RepMcCaul","Tragedy has struck Ft. Hood for the second time in 5 years. My thoughts &amp; prayers are with the victims and families. http://t.co/YJ3xjy7GDQ.",
"2013-09-17 ","23:39:57","RepMcCaul","Tune in now to  @OutFrontCNN. I'll be discussing the #NavyYardShooting with @ErinBurnett.","NavyYardShooting"
"2013-09-17 ","19:50:15","RepMcCaul","Members of my staff will be hosting a Listening Post tomorrow from 11:30 - 1:00 at my office in Katy http://t.co/9yStAwK5pI. Come on out!",
"2013-09-17 ","14:40:42","RepMcCaul","226 years ago our Constitution was adopted. Today it stands as a beacon of freedom and self government for all other nations. #Wethepeople","Wethepeople"
"2013-06-08 ","14:39:04","RepMcCaul","Congrats to Coach Rush and the Tomball High Cougars winning the state 4A baseball title!  Your community is proud. 2 state champs in CD10.",
"2013-06-07 ","01:41:53","RepMcCaul","Congrats to the LaGrange Leopards, the 2013 Texas 3A baseball champions!",
"2013-04-21 ","15:15:30","RepMcCaul","10:30am CT/11:30ET Chairman McCaul on Fox News Channel with @EricShawnonFox.",
"2013-04-21 ","14:06:37","RepMcCaul","9:30am CT/10:30ET Chairman McCaul on CBS @FaceTheNation to discuss Boston bombing case, national security.",
"2013-04-21 ","12:47:18","RepMcCaul","8amCT/9am ET Chairman McCaul on @CNNsotu to discuss national security, Boston bombing case.",
"2013-03-14 ","16:35:12","RepMcCaul","McCaul-Lipinski Cybersecurity Enhancement Act Advances to House Floor
@RepLipinski http://t.co/bXPsYIiljE",
"2012-07-20 ","12:28:35","RepMcCaul","McCaul on Fox News 10:10am ET re Ft Hood report.",
"2012-02-22 ","12:41:30","RepMcCaul","On Fox 26 Houston shortly with Kristine Galvan.",
"2012-02-22 ","12:10:03","RepMcCaul","On Fox & Friends in 5 min discussing my investigation into DHS role in Fast & Furious.",
"2011-09-06 ","12:07:11","RepMcCaul","FEMA will be on ground in Bastrop today. Assured by Dir Fugate last night. Start prelim damage assessments.",
"2011-01-08 ","22:34:37","RepMcCaul","Statement by Congressman McCaul (R-TX) on the shooting of Congresswoman Gabrielle Giffords:  http://mccaul.house.gov/index.cfm?sectionid=179",
"2010-08-04 ","20:42:49","RepMcCaul","Great America Speaking Out events in dist last cpl days. America's agenda is coming together.",
"2016-09-23 ","21:49:26","RepKevinBrady","Want to know how Congress sets the federal budget? You may be surprised! https://t.co/vyHCg87LER https://t.co/iXVp6iKw7Z",
"2016-07-08 ","13:17:40","RepKevinBrady","#DallasStrong https://t.co/BATJLx7HaP","DallasStrong"
"2016-07-08 ","12:38:30","RepKevinBrady","My heart breaks for our neighbors in Dallas. Thank you to the brave men &amp; women that serve our law enforcement.  https://t.co/oI2rJpr6Sv",
"2016-07-07 ","22:00:32","RepKevinBrady","Great to have Dr.Bobby Robbins &amp; @TXMedCenter around the table today. https://t.co/UCo2HasWxv",
"2016-07-07 ","20:27:16","RepKevinBrady","Obama Admin has spent over $7 billion without congressional consent. This is stealing from the American people. 
https://t.co/3bes6Qlbde",
"2016-07-07 ","19:12:15","RepKevinBrady","Wreck Em kind of day here on Capitol Hill with @ChancellorRLD #TTU https://t.co/IiHvt8eXyv","TTU"
"2016-07-07 ","13:40:43","RepKevinBrady","Stay tuned.
https://t.co/5p4D4V9ukP https://t.co/Xqkp3o0G2r",
"2016-06-13 ","22:02:43","RepKevinBrady","The flag flies at half staff above my Washington office in memory of the lives lost in the… https://t.co/RnxkN9sBUT",
"2016-06-13 ","13:20:30","RepKevinBrady","My weekly podcast is up. Listen for more information about the much needed federal disaster declaration for TX: https://t.co/hBsh7nJ2e7",
"2016-06-12 ","16:26:37","RepKevinBrady","We are praying for victims&amp; their families in orlando. I also thank local law enforcement for saving lives. https://t.co/D4fgnmWk1H",
"2016-06-12 ","14:06:22","RepKevinBrady","Happy Birthday to a Great American &amp; Texan, President George H.W. Bush! @USNavy @aircraftcarrier @USN_BushCVN77 https://t.co/fGbS5TTmtm",
"2016-02-26 ","14:23:15","RepKevinBrady","Kicking off The Woodlands 30th #EconomicOutlookConference https://t.co/PzzSSdkn2j","EconomicOutlookConference"
"2015-12-02 ","16:02:26","RepKevinBrady","Good luck to Team Master Builders from Mitchell Intermediate School in this weekend's competition! https://t.co/JbU06eOof3",
"2015-11-28 ","22:34:19","RepKevinBrady","Phalanx of House chairmen confront Fed Chair Janet Yellen https://t.co/lrF9qrBbht",
"2015-11-28 ","14:02:01","RepKevinBrady","Support our local #TX08 businesses on #SmallBizSaturday https://t.co/YFljdrPbjX","TX08 SmallBizSaturday"
"2015-11-27 ","21:05:37","RepKevinBrady","So let's stop the political hand-wringing and get to work creating a U.S. tax code that's built for growth https://t.co/3oM303GLlR",
"2015-11-27 ","14:30:37","RepKevinBrady","New Top Tax Writer Brady: Will Relentlessly Pursue Tax Reform; by CQNow on SoundCloud https://t.co/GCoPf1f0oT",
"2015-11-27 ","00:13:58","RepKevinBrady","Ex-Navy SEALS: Military service taught us how fortunate we are to be Americans | Fox News |  https://t.co/OCCbIYrdba",
"2015-10-31 ","21:47:09","RepKevinBrady","Tips to have a safe Halloween evening https://t.co/6TDt3zhFCr via @ScoopHouston",
"2015-10-31 ","01:11:34","RepKevinBrady","ObamaCare premiums, penalties rising as open enrollment begins |  https://t.co/pyh17OCkjA",
"2015-10-02 ","19:56:19","RepKevinBrady","Thank you to all the great manufacturing companies and hardworking Texans in the 8th District. #TX08 #MFGDay15 http://t.co/xiUZ9WNjLR","TX08 MFGDay15"
"2015-10-02 ","16:48:24","RepKevinBrady","On #ThisDayInHistory in 1835, First shots of the Texas Revolution fired in the Battle of Gonzales. Read More http://t.co/27Cq47g5pw @History","ThisDayInHistory"
"2015-10-02 ","14:20:56","RepKevinBrady","@POTUS recovery’s jobs gap hits record high topping 6 million http://t.co/WCGby705mV",
"2015-10-01 ","19:35:53","RepKevinBrady","We cannot allow our military &amp; intelligence to be hollowed out. A presidential veto will make our nation less safe. https://t.co/yyc7puQKWI",
"2016-07-08 ","22:02:48","CongCulberson","I'll be joining @LanceRoberts on @KSEV700 tonight at 6:15 CT. We will be discussing defunding sanctuary cities. Hope you'll tune in!",
"2016-07-08 ","20:08:21","CongCulberson",". @NumbersUSA reports on Rep. Culberson cutting off funding for sanctuary cities. Take a look: https://t.co/PfpXkP74xw",
"2016-07-08 ","13:26:14","CongCulberson","To our law enforcement officers, we are with you. https://t.co/4ZALXRKyDX",
"2016-07-07 ","20:54:12","CongCulberson","Culberson cuts off federal grant funding to sanctuary cities: https://t.co/H8lufva6Qm",
"2016-06-12 ","18:44:03","CongCulberson","Horrified and deeply saddened by the acts of terror in Orlando. Our thoughts and prayers are with the victims and families.",
"2016-02-25 ","23:05:08","CongCulberson","Today, I testified at the House Science Committee on the Space Leadership Preservation Act. https://t.co/ZBCFKhamec https://t.co/ckBLoxb68S",
"2016-02-25 ","20:16:14","CongCulberson","ICYMI: Watch the @oreillyfactor discuss my efforts to defund #sanctuarycities  https://t.co/klseZyvBlC","sanctuarycities"
"2016-02-25 ","01:06:58","CongCulberson","At today's CJS Subcommittee hearing, we had AG @LorettaLynch with us to discuss the FY 2017 DoJ budget. Read more, 
https://t.co/O8L24nqZZl",
"2015-12-02 ","02:05:14","CongCulberson","Thanks TX07 for great questions on #immigration, #Obamacare &amp; #PlannedParenthood @ tonight's telephone #townhall https://t.co/wEu3SNByGM","immigration Obamacare PlannedParenthood townhall"
"2015-10-02 ","15:45:00","CongCulberson","Iran owes $43.5 billion to victims of terror. #NotOneCent of sanction relief until Iran pays up. RT if you agree http://t.co/CbYZv3abzS","NotOneCent"
"2015-06-17 ","18:55:20","CongCulberson","My amendment protecting churches from IRS bullying was adopted by the @HouseAppropsGOP Committee today http://t.co/goeaS4KO1t.",
"2014-10-25 ","21:31:15","CongCulberson","Always a treat to be at Johnson Space Center and see the cool things that NASA is doing! http://t.co/Hh9KiYpTaj",
"2014-10-25 ","20:41:45","CongCulberson",".@AP_GOPO @BellaireHigh @HoustonISD Thank you for having me! I had a great time.",
"2014-10-25 ","00:12:14","CongCulberson","I led a bipartisan letter to the FDA on fighting Duchenne Muscular Dystrophy. You can read it here: http://t.co/7pjaEtwd1q",
"2014-05-24 ","20:02:10","CongCulberson","Are you an early riser? I'll be on @foxandfriends tomorrow morning at 6:15 am ET to talk about the VA. Set an alarm (or a DVR)!",
"2014-04-04 ","13:09:22","CongCulberson","Questioning Attorney General Holder in a @HouseAppropsGOP hearing in a few minutes. Watch: https://t.co/VfvDRVbqP7 http://t.co/3jlvydAoAK",
"2014-04-03 ","19:43:29","CongCulberson","The House just passed a bipartisan bill to restore lost hours and wages under Obamacare. It's time for the Senate to act.",
"2014-04-03 ","14:32:17","CongCulberson","My family and I send our thoughts and prayers to the victims, their families, and the entire Ft. Hood community. http://t.co/ofDSWXFMjf",
"2014-02-20 ","18:54:33","CongCulberson","RT @BeschlossDC: John Glenn became first American to orbit earth today 1962:  #NASA http://t.co/1nv5Kmas1n","NASA"
"2013-09-17 ","23:11:22","CongCulberson","226 years ago, our Founding Fathers created a Constitution revolutionary in its protection of our God-given rights. Happy Constitution Day!",
"2013-09-16 ","16:41:16","CongCulberson","My thoughts and prayers are with those affected by this morning's Navy Yard shooting in DC.",
"2013-07-27 ","12:23:22","CongCulberson","Honored to speak to the Texas Lonestar Chapter of Korean War Veterans today to commemorate the 60th anniversary of the armistice.",
"2013-03-14 ","13:29:59","CongCulberson","At 10:00, the Homeland Security Appropriations Subcommittee holds a hearing on immigration enforcement. Watch us live http://t.co/HWbtb6sk9n",
"2013-03-13 ","21:27:01","CongCulberson","I had a great time discussing current events &amp; government with a sharp group of seniors from Jersey Village HS today http://t.co/llkzLTar9k",
"2013-03-13 ","18:54:08","CongCulberson","I couldn't disagree with Obama more MT @RepFleming: President to House GOP: balancing budget not important and not necessarily advisable.",
"2012-12-14 ","18:18:50","CongCulberson","My thoughts and prayers are with the families affected by the senseless tragedy in Connecticut.",
"2011-10-13 ","22:24:48","CongCulberson","GOP's top priority has always been helping Americans get back to work. Learn more about our #4jobs plan here: http://t.co/kdkjd92m","4jobs"
"2011-10-13 ","17:53:12","CongCulberson","Today marks the 236th birthday of the United States Navy. Thank you to the men and women that serve our great country and their families!",
"2011-09-07 ","18:13:11","CongCulberson","Great article by the Houston Business Journal stating expanded drilling means more #jobs http://t.co/kRf4znM","jobs"
"2011-09-07 ","14:30:20","CongCulberson","""The simple fact is that Obama has put politics before job creation..."" Great piece by @GOPWhip http://t.co/HKVWNIR",
"2011-09-06 ","21:11:36","CongCulberson","The Astros will host one veteran and their guest for all remaining home game. For more information, visit here: http://t.co/2yvBF5e",
"2011-09-06 ","19:13:27","CongCulberson","@SpeakerBoehner & @GOPLeader have written a letter to the WH noting   #jobs bills that are stalled in Dem Senate: http://t.co/9lBw7Ee","jobs"
"2009-11-30 ","14:37:34","CongCulberson","Health bills fail to block illegals from coverage... http://bit.ly/72PQl6",
"2009-11-06 ","15:33:36","CongCulberson","Thank you to all of those who participated in the telephone town hall last night. I hope to hold another one soon.",
"2016-07-08 ","17:24:48","RepJoeBarton","On the House Floor to talk about the tragic shooting in Dallas and particularly Brent Thompson of Corsicana 

https://t.co/5Mm4b2IZJh",
"2016-07-07 ","16:22:16","RepJoeBarton","My final question was whether all 6 witnesses support the ace kids act. Unanimous yes! Great bipartisan legislation. #speaknowforkids","speaknowforkids"
"2016-07-07 ","16:19:53","RepJoeBarton","Wrapping up @HouseCommerce  hearing on my bill the ACE kids act. I am filling in for chairman Pitts.  #speakforkidsnow","speakforkidsnow"
"2016-07-07 ","13:47:11","RepJoeBarton","@wendtrph I am extremely disappointed in the findings. Carelessness and ignorance is no excuse for breaking the law - esp as Sec of State.",
"2016-07-07 ","13:24:23","RepJoeBarton","Tune in here to watch and hear from @cookchildrens CEO Rick Merrill. @hospitals4kids
https://t.co/kOHNM2KhCs",
"2016-07-07 ","13:22:44","RepJoeBarton","At 10:15 et @HouseCommerce will examine my bill, the ACE Kids Act. It will help many very sick children and their families. #SpeakNowForKids","SpeakNowForKids"
"2016-06-13 ","14:39:41","RepJoeBarton","#PrayForOrlando https://t.co/EqbDuiafJq","PrayForOrlando"
"2016-02-26 ","15:29:40","RepJoeBarton","I will be joining the @ChrisSalcedoTX Show at 9:45 Texas Time. Tune in at @WBAP247NEWS",
"2016-02-20 ","21:49:09","RepJoeBarton","@brandonphoto @RepJoeBarton We will look into it. Thanks. In the meantime feel free to call my Arlington office Monday morn - 817-543-1000",
"2015-12-03 ","21:54:33","RepJoeBarton","My statement on Hr 8 passing the House! #Energy #Jobs #LiftTheBan
https://t.co/SfaVgECRjO https://t.co/1Y3VZ1bcQL","Energy Jobs LiftTheBan"
"2015-12-03 ","15:12:32","RepJoeBarton","My amdt to HR 8 passed last night. Here is my floor speech! #LiftTheBan #Yes2Energy 
https://t.co/pXg1RE7BWo https://t.co/Ls88C6lQgN","LiftTheBan Yes2Energy"
"2015-12-02 ","22:01:55","RepJoeBarton","Thanks for the supporting my ammdt @taxreformer @GroverNorquist
#LiftTheBan  #Yes2Energy https://t.co/N7YU934WFT","LiftTheBan Yes2Energy"
"2015-12-02 ","20:58:20","RepJoeBarton","Today is our fall interns last day. Per tradition, on the last day my interns put up a photo on… https://t.co/QSEHgqZrrm",
"2015-12-02 ","17:56:40","RepJoeBarton","The push to #LiftTheBan continues! Common sense policy for energy and security! #Yes2Energy

https://t.co/RD9oyhdHj0","LiftTheBan Yes2Energy"
