"Date","Time","screen_name","text","hashtags"
"2016-07-18 ","20:46:02","SenatorIsakson","My @GOPHELP staffer has returned home safely along w/ his whole @USArmy 2nd Battalion, 7th Special Forces Group! They are American heroes.",
"2016-07-18 ","19:48:02","SenatorIsakson","I encourage the president to sign the Veterans’ Compensation Cost of Living Adjustment Act to increase veterans’ disability benefits ASAP.",
"2016-07-18 ","18:13:05","SenatorIsakson","Welcome to Elizabeth Foreman of @DeKalbSchools, in DC this week for #LCTeachInst @TeachingLC to bring @LibraryCongress to our classrooms!","LCTeachInst"
"2016-07-18 ","16:42:03","SenatorIsakson","In addressing Zika virus, prevention is key. I'm trying to ensure @CDCgov receives needed funding. WATCH: https://t.co/mmU6eEltr8",
"2016-07-18 ","16:25:05","SenatorIsakson","We must do everything we can to destroy ISIL, who wants us to cower in fear. Read more via @ajc: https://t.co/3pUCzHxb1Z",
"2016-07-18 ","16:09:20","SenatorIsakson","Every American citizen can play an important role in the security of our homeland. #SeeSomethingSaySomething","SeeSomethingSaySomething"
"2016-07-08 ","17:16:32","SenatorIsakson","Today I share in our nation's grief over the attack in Dallas. https://t.co/qZslfKVKtZ",
"2016-07-07 ","21:47:33","SenatorIsakson","It was a pleasure to meet Katrina &amp; Tina with #DCproject, who stopped by my office today to advocate for 2A rights. https://t.co/CNAooOgOja","DCproject"
"2016-07-07 ","21:36:40","SenatorIsakson","I was honored to welcome James Hanley earlier today &amp; thank this @AF_Academy cadet for his service to our country. https://t.co/BJa33S0aAr",
"2016-07-07 ","21:18:46","SenatorIsakson","I really enjoyed visiting with our Senate Page and his family today! We're fortunate to have Doug this summer. https://t.co/cyWgGEl7uy",
"2016-07-07 ","19:05:08","SenatorIsakson","Russia seems to know no boundaries &amp; has gone unchecked. Now the Obama admin expects them to cooperate on Syria? https://t.co/6a6VHkWjnA",
"2016-07-07 ","18:55:03","SenatorIsakson","Thank you to all of the VSOs and other organizations that support the #VeteransFirst Act. #vote4Vets1st https://t.co/cAYg9na7ON","VeteransFirst vote4Vets1st"
"2016-07-07 ","18:50:03","SenatorIsakson","Every generation of veterans will benefit from #VeteransFirst Act – from #WWII to post-9/11. #Vote4Vets1st https://t.co/tvRF3aKIJ9","VeteransFirst WWII Vote4Vets1st"
"2016-07-07 ","18:44:56","SenatorIsakson","I was proud to support the FAST Act &amp; this critical funding will help economic competitiveness of the Savannah port https://t.co/55QHxHavyR",
"2016-07-07 ","18:15:05","SenatorIsakson","The #VeteransFirst Act will improve health care and benefits for all generations of veterans. #Vote4Vets1st https://t.co/ncxhdA6xIc","VeteransFirst Vote4Vets1st"
"2016-07-07 ","18:00:27","SenatorIsakson","We are expanding GI benefits for service members. #Vote4Vets1st https://t.co/wyukkzJfDx","Vote4Vets1st"
"2016-07-07 ","17:45:07","SenatorIsakson","We’re putting #VeteransFirst by strengthening #VAAccountability. #Vote4Vets1st https://t.co/wO8BoIXwQQ","VeteransFirst VAAccountability Vote4Vets1st"
"2016-07-07 ","17:30:18","SenatorIsakson","Every generation of veterans will benefit from #VeteransFirst Act – from World War II veterans to those just returning home. #Vote4Vets1st","VeteransFirst Vote4Vets1st"
"2016-07-07 ","17:25:04","SenatorIsakson","The @DeptVetAffairs has been plagued by misconduct, mismanagement &amp; mistreatment of veterans. Time to #Vote4Vets1st https://t.co/aPKgT9YYcK","Vote4Vets1st"
"2016-07-07 ","17:10:04","SenatorIsakson","#VeteransFirst Act will hold ALL employees at the @DeptVetAffairs accountable – from rank-and-file to senior executives. #Vote4Vets1st","VeteransFirst Vote4Vets1st"
"2016-07-07 ","17:00:30","SenatorIsakson","I urge my colleagues to #vote4Vets1stand support changing the culture of the @DeptVetAffairs and improve care &amp; benefits for veterans.","vote4Vets1stand"
"2016-06-13 ","23:42:33","SenatorIsakson","I'm going to do everything I can to block harmful language intended to unfairly tip scales in tri-state ""water wars"" https://t.co/1iXKbHIsU8",
"2016-06-13 ","19:58:33","SenatorIsakson","I invite all to join the Senate in a moment of silence at 4:00 p.m. ET to reflect on the victims of the tragic terror attack in Orlando.",
"2016-06-13 ","14:10:35","SenatorIsakson","Our interns had great questions for me in our Atlanta office this morning. I appreciate their hard work. https://t.co/xUAqI8mIBS",
"2016-06-13 ","12:06:04","SenatorIsakson","I'll be talking soon with Scott Ryfun on @1440wgig in Brunswick at 8:34AM. Tune in online: https://t.co/u9kWT8hUpC.",
"2016-06-12 ","21:58:29","SenatorIsakson","Praying for victims of Orlando terror attack. We should pursue those responsible w/ full force &amp; strength of U.S. https://t.co/v6sCE4Tj6O",
"2016-02-26 ","20:26:05","SenatorIsakson","I’ve joined @Medium! Please read my first piece thanking the Veterans Service Organizations who serve our veterans: https://t.co/XdcIPJopTx",
"2016-02-26 ","14:57:58","SenatorIsakson","Ms. Corwin's class at Lewis Frasier MS was picked for @SIFMAFoundation's 2016 #CapitolHillChallege! Fun, hands-on learning! @LibertyCoSchool","CapitolHillChallege"
"2016-02-25 ","20:22:35","SenatorIsakson",".@ncte shared some great ideas ab improving literacy in America. Reading is a skill that will always be important. https://t.co/Il2sUokT9e",
"2016-02-25 ","20:12:31","SenatorIsakson","Proud to join @SenBobCorker in wearing a ❌ everywhere I go today to shine a light on ending slavery. #enditmovement https://t.co/WZoi68Labe","enditmovement"
"2016-02-25 ","19:26:18","SenatorIsakson","Proud to sponsor a resolution in the Senate recognizing February as #BlackHistoryMonth.","BlackHistoryMonth"
"2016-02-25 ","19:22:49","SenatorIsakson","Dooly County Chamber of Commerce dropped by the DC office and brought me some delicious treats from South Georgia! https://t.co/TaWzJdYTNX",
"2016-02-25 ","19:09:53","SenatorIsakson",".@actfl knows the importance of teaching foreign languages in today's world. Thanks for meeting with me today! https://t.co/8kyglBghjL",
"2016-02-25 ","18:46:59","SenatorIsakson","Georgia's ""wing"" of the @CivilAirPatrol is in the @uscapitol today. Thank you for your service. #aviationpuns https://t.co/kcSk3a3bZB","aviationpuns"
"2016-02-25 ","18:10:18","SenatorIsakson","Today, let's join the @enditmovement &amp; @SenBobCorker in shining a light on modern slavery. Together, we can #ENDIT https://t.co/OGAEwONXEw","ENDIT"
"2016-02-25 ","17:50:00","SenatorIsakson","My DC interns are joining me in the #EndItMovement to spread awareness and end modern slavery. #EndSlaveryAct https://t.co/AkDRvkXcNO","EndItMovement EndSlaveryAct"
"2016-02-25 ","15:39:52","SenatorIsakson","It was wonderful to see my old friend &amp; former Congressman @JackKingston along w/ Chatham Area Transit in DC today. https://t.co/aty5Xnf8K0",
"2016-02-25 ","15:07:46","SenatorIsakson","Proud recipient of the 2016 Veteran Healthcare Leadership Award from Natl Chiropractic Leadership Conf. #NCLC2016 https://t.co/sfXG0SaO97","NCLC2016"
"2016-02-25 ","14:54:18","SenatorIsakson","I am a proud recipient of the 2016 Vet. Healthcare Leadership Award from the National Chiropractic Leadership Conf.",
"2016-02-25 ","14:38:46","SenatorIsakson","This morning I met the lovely Honorable Peggy Walker, judge of the juvenile court in Douglas Co., #GA. https://t.co/NOQB5Wa4pb","GA"
"2016-02-25 ","14:33:00","SenatorIsakson","It was great to meet this group of Medal of Honor recipients this morning at #NCLC2016. Thank you for your service. https://t.co/2CU0l629uh","NCLC2016"
"2016-02-21 ","19:46:28","SenatorIsakson","My condolences to the family of the legendary Bill Kinney &amp; the entire @mdjonline family.",
"2016-02-21 ","14:00:40","SenatorIsakson","Happy birthday to the representative of Georgia's 5th district &amp; longtime Georgia civil rights leader @repjohnlewis!",
"2016-02-20 ","14:00:20","SenatorIsakson","Happy birthday to a great leader and friend @SenateMajLdr Mitch McConnell!",
"2015-12-03 ","21:11:45","SenatorIsakson","Today I will vote to repeal #Obamacare and protect Georgians from this disastrous law. Here's why:
https://t.co/jm86JBYcei","Obamacare"
"2015-12-03 ","15:29:29","SenatorIsakson","Always great to talk with @ChrisBeckham442 @ValdostaToday. This morning we talked #ISIL &amp; #VAaccountability. Listen: https://t.co/tlp5XtWHnh","ISIL VAaccountability"
"2015-12-03 ","14:54:16","SenatorIsakson","Merry Christmas from the @uscapitol! Here are some photos from the lighting of the 2015 #CapitolChristmasTree. https://t.co/tlAiZxmqCC","CapitolChristmasTree"
"2015-12-03 ","14:33:43","SenatorIsakson","Wow, never had a song written about me. Thanks #PapaRazziAndThePhotogs. I'm undeserving but flattered nonetheless. https://t.co/SdPaMKVgOI","PapaRazziAndThePhotogs"
"2015-12-03 ","13:13:51","SenatorIsakson","If you're in Commerce, Ga., tune in to WJJC 1270AM at 8:15AM for my interview w/host Ron Johnson. On tap? Senate effort to repeal Obamacare.",
"2015-12-03 ","12:56:05","SenatorIsakson","I'll be on with my friend, @ChrisBeckham442 at 8:05 AM on @ValdostaToday. We'll be talking ISIL, VA. Tune in LIVE: https://t.co/YcS727dScz",
"2015-12-02 ","19:30:10","SenatorIsakson","HAPPENING NOW: Hearing on Veterans Choice Program is just getting started. Watch live on @CSPAN 3 or https://t.co/qRULvcVGtf @VAChair",
"2015-12-02 ","18:54:57","SenatorIsakson","Introduced a bill to hold IRS bureaucrats accountable for gross misconduct. Mirrors #VAaccountability. https://t.co/pIl584JmVg","VAaccountability"
"2015-12-02 ","18:13:28","SenatorIsakson","Was so glad for the opportunity to write holiday cards to our heroes overseas. Thanks to @RedCross for organizing! https://t.co/IirmHbNhFq",
"2015-12-02 ","17:29:41","SenatorIsakson","Honored to donate a US flag flown over the @uscapitol for Lone Mountain Village II in Ringgold, #Georgia. Read more: https://t.co/aDX8DaRPlg","Georgia"
"2015-12-02 ","14:31:07","SenatorIsakson","My top priority as @VAChair is overseeing the Veterans Choice Program. Watch our hearing at 2:30p on @CSPAN 3 or https://t.co/qRULvcVGtf.",
"2015-11-28 ","14:38:12","SenatorIsakson","It's rivalry week which can only mean one thing: #WreckTech.

#UGA #godawgs #WRTS @FootballUGA https://t.co/UmASliD35G","WreckTech UGA godawgs WRTS"
"2015-11-28 ","14:30:06","SenatorIsakson","Be sure to support Georgia’s small businesses today on #SmallBusinessSaturday! https://t.co/r29swGgIvX","SmallBusinessSaturday"
"2015-10-02 ","18:37:50","SenatorIsakson","College students - looks like it will be a rainy weekend in #GA &amp; a perfect time to apply for #internships. Apply: http://t.co/wQjZuh5UoC","GA internships"
"2015-10-02 ","16:07:33","SenatorIsakson","This week, we should have voted on a Military Construction &amp; VA approps measure. Dems blocked it. More on the week: http://t.co/ZdnbEtwVrw",
"2015-10-02 ","15:50:23","SenatorIsakson","Congrats to @sbc1989 as they launch their mobile breast #cancer screening clinic today! #BreastCancerAwareness","cancer BreastCancerAwareness"
"2015-10-01 ","18:47:03","SenatorIsakson","Continuing our #gamil meetings with Col. John Cooper, Commander of 461st Air Control Wing at Robins AFB. https://t.co/069oNKPcIx","gamil"
"2015-10-01 ","18:32:08","SenatorIsakson","Not all of our #interns attend #GA schools, but hail from GA. @AmericanU &amp; @UofAlabama represented this fall! Apply: https://t.co/wQjZuh5UoC","interns GA"
"2015-10-01 ","17:25:40","SenatorIsakson","This bill includes funding for critical veterans' benefits, programs and sweeping #VAaccountability provisions. https://t.co/dI7ezop6WL","VAaccountability"
"2015-10-01 ","15:48:09","SenatorIsakson","Nothing is more important than our veterans &amp; military, which is why I support the Mil. Construction/VA Approps Act: http://t.co/wPKUTzeysu",
"2015-10-01 ","14:31:10","SenatorIsakson","Proud to be a strong advocate of our research universities &amp; honored to be recognized by Georgia Research Alliance. http://t.co/wxzLuPG4zH",
"2015-10-01 ","13:44:15","SenatorIsakson","Many great GA #interns in my office, incl. @GeorgiaTech &amp; @GeorgiaSouthern, plus 4 other GA colleges. Interested? http://t.co/wQjZuh5UoC","interns"
"2015-10-01 ","12:41:04","SenatorIsakson","NEXT: If you're in Commerce, tune in to WJJC-1270AM for my chat w/Ron Johnson about our #veterans at 8:46AM.","veterans"
"2015-10-01 ","12:20:04","SenatorIsakson","Look forward to my conversation w/Scott James on @talk921valdosta at 8:30 AM. We'll talk the latest from DC. Listen: http://t.co/3xyYLFjhug",
"2016-09-24 ","20:20:41","sendavidperdue","#MakingHistory with a true American hero at the opening of @NMAAHC. @JohnLewis, thank you for your leadership #gapol https://t.co/3LHzwJsMrT https://t.co/wZTc4G3lgr","MakingHistory gapol"
"2016-09-23 ","21:08:18","sendavidperdue","Sharing a photo of my wife, Bonnie, and I from the @WhiteHouse's celebration for @NMAAHC. https://t.co/KEMaRhEMwj",
"2016-09-23 ","20:25:37","sendavidperdue","Celebrating the opening of @NMAAHC w/ fellow Georgians at the @WhiteHouse. #gapol https://t.co/PgE1GGDeMg","gapol"
"2016-07-18 ","20:08:49","sendavidperdue","Proud of @GeorgiaTech's @usnews ranking as the top public university for Mechanical Engineering. https://t.co/poOp4Dto1t #GreatGASchools","GreatGASchools"
"2016-07-17 ","20:29:06","sendavidperdue","On Friday, 155 soldiers graduated from Ranger School at @FortBenning. Congratulations to all. #USA https://t.co/dLGs5vAnHp","USA"
"2016-07-17 ","16:00:21","sendavidperdue","Congratulations to the new Commander of Air Force Reserve Command. @RobinsAFB_GA https://t.co/qAXtosCW0u",
"2016-07-08 ","22:21:32","sendavidperdue","It's time to counter tragedy with compassion, hate with love, and frustration with patience. #StandUnited https://t.co/37gErXxOUl","StandUnited"
"2016-07-08 ","13:30:34","sendavidperdue","Such horrific &amp; senseless violence has to end.Our hearts break for all of the victims &amp; families dealing w/tragedy right now.#PrayForAmerica","PrayForAmerica"
"2016-07-08 ","03:41:45","sendavidperdue","Tonight, Democrats blocked defense bill to fund our troops. This is outrageous. https://t.co/CpBLPH3EvM",
"2016-07-08 ","03:40:26","sendavidperdue","The Senate passed important effort to streamline national food labeling standards. https://t.co/PofRyGLXSk",
"2016-07-07 ","16:44:40","sendavidperdue","Secretary #Clinton’s actions were a direct violation of the SCI Nondisclosure Agreement she signed. Read it here: https://t.co/zv5A9STfjS","Clinton"
"2016-07-07 ","16:43:06","sendavidperdue",".@StateDept should revoke #Clinton's clearance for mishandling classified info &amp; putting US at risk of irreparable injury. RT if you agree.","Clinton"
"2016-06-13 ","23:24:04","sendavidperdue",".@SenatorIsakson &amp; I oppose any appropriations bill including language that impacts Georgia's #water supply. https://t.co/xebwpdkGRZ #gapol","water gapol"
"2016-06-13 ","19:51:14","sendavidperdue","Hope you can join me in honoring the victims of the #Orlando tragedy with a moment of silence at 4:00 p.m.","Orlando"
"2016-06-12 ","23:40:46","sendavidperdue","Sending prayers to the victims and loved ones during this time. #PrayForOrlando https://t.co/g9hzvBeqeo","PrayForOrlando"
"2016-02-26 ","22:46:03","sendavidperdue",".@POTUS' efforts to empty out #GuantanamoBay &amp; close #GITMO must be stopped. RT if you agree. https://t.co/j4NiWgXQse","GuantanamoBay GITMO"
"2016-02-26 ","13:00:23","sendavidperdue","Happy #NationalEngineersWeek! Proud to be a @GeorgiaTech engineering alum. https://t.co/Lrnv1VFMyE","NationalEngineersWeek"
"2016-02-25 ","23:00:48","sendavidperdue","Enjoyed reading about partnership between #Senoia &amp; @WalkingDead_AMC! #Georgia’s film industry is top of the line. https://t.co/BfY19tveDP","Senoia Georgia"
"2016-02-25 ","21:31:55","sendavidperdue","That's a cool jacket, @SteveKornacki! @GeorgiaTech #GoJackets https://t.co/deU7gbDqOQ","GoJackets"
"2016-02-25 ","19:38:31","sendavidperdue","Excellent news from GA schools! AP scores on the rise. Keep up the great work. https://t.co/8ttsONneYo #education","education"
"2015-12-03 ","22:00:30","sendavidperdue","Over the next decade #Obamacare = $2.7 billion in new taxes for Georgians. #RepealObamacare #gapol https://t.co/xFlPwy8S4O","Obamacare RepealObamacare gapol"
"2015-12-03 ","20:00:34","sendavidperdue","Largest Health Care Co. may exit #Obamacare marketplace. CEO says joining exchange was “bad decision.” Via @TheHill https://t.co/9SDemlbolk","Obamacare"
"2015-12-03 ","19:00:26","sendavidperdue","Nearly ½ #Obamacare co-ops have failed, leaving Americans scrambling to find new insurance. #RepealObamacare https://t.co/XfTizbD6wz","Obamacare RepealObamacare"
"2015-12-03 ","17:36:24","sendavidperdue","I’m voting to #RepealObamacare and protect Americans from the law’s #brokenpromises. https://t.co/c9V5iqBrTz","RepealObamacare brokenpromises"
"2015-12-02 ","22:21:22","sendavidperdue","Good news! @InComm plans to create 275 jobs &amp; invest $20 million in Atlanta area via @AtlBizChron https://t.co/P6Y3ZNpVFX",
"2015-11-28 ","17:12:09","sendavidperdue","Cheering for my alma mater @GeorgiaTech today! No matter who wins, I'm proud of our GA sports teams. #TogetherWeSwarm","TogetherWeSwarm"
"2015-11-01 ","17:14:52","sendavidperdue","Have 2 mins? Watch why we can’t afford Washington’s backroom budget deal: https://t.co/GkCARX2SV5 https://t.co/aBbA2kcUQe",
"2015-11-01 ","17:00:11","sendavidperdue","#Georgia is basically a border state when it comes to illegal #immigration, via @zpolitics: https://t.co/WHQsVqyJuR","Georgia immigration"
"2015-10-31 ","18:00:11","sendavidperdue","#EPA overregulation costs Georgians jobs &amp; money. @SenatorIsakson &amp; I work to unlock our full #energy potential.
https://t.co/Cv0A4VooKS","EPA energy"
"2015-10-02 ","21:00:17","sendavidperdue","@GeorgiaTech President &amp; friend Bud Peterson stopped by. It’s always great to hear what’s new at my alma mater. http://t.co/9HBz2lDZ6Q",
"2015-10-02 ","16:47:43","sendavidperdue","Happy Belated Birthday, President Jimmy Carter! I hope you had a great day celebrating with family &amp; friends. #HBD","HBD"
"2015-10-02 ","13:39:31","sendavidperdue","Bonnie and I are keeping our thoughts and prayers with @umpquacc and all affected by this terrible tragedy. #StandWithUCC","StandWithUCC"
"2015-10-02 ","12:00:03","sendavidperdue","Happy birthday to @RepHankJohnson! Have a wonderful day.",
"2015-10-01 ","22:00:01","sendavidperdue","Congratulations to @dancathy for receiving @QualityGrowth's Four Pillar Tribute. Thank you for your great contributions to #GA communities.","GA"
"2015-10-01 ","20:12:10","sendavidperdue","“Our veterans sacrificed so much for our freedom...We cannot fail them” https://t.co/xLaKzrdjjX",
"2015-10-01 ","20:11:41","sendavidperdue","I just spoke about @SenateDems willingness to obstruct a bill that would #FundOurTroops &amp; #FundOurVets. Watch here: https://t.co/xLaKzrdjjX","FundOurTroops FundOurVets"
"2015-10-01 ","18:22:44","sendavidperdue","About to speak on @SenateFloor about providing for our military &amp; veterans. Watch LIVE on @CSPAN’s website https://t.co/5IUHA8ZTgW #gapol","gapol"
"2015-10-01 ","18:13:36","sendavidperdue","We are obligated to care for our military &amp; vets. I'm proud to support them. #FundOurTroops #FundOurVets https://t.co/zDZ7UbZweB","FundOurTroops FundOurVets"
"2015-10-01 ","18:11:06","sendavidperdue",".@SenateDemocrats failing to #FundOurVets is a disservice to those who have risked their lives to serve our country. https://t.co/KDQxlSeCa4","FundOurVets"
"2015-10-01 ","18:10:37","sendavidperdue","I voted to ensure military readiness &amp; to improve the quality of life for military families. #FundOurTroops https://t.co/reabWrFPZq","FundOurTroops"
"2015-10-01 ","18:08:24","sendavidperdue","We have an obligation to take care of our military &amp; veterans. I'm proud to support a bill that supports them. #FundOurTroops #FundOurVets","FundOurTroops FundOurVets"
"2015-07-17 ","18:12:00","sendavidperdue","We stand with #Chattanooga. Among those lost in the sensless shootings was Marine LCpl Skip Wells from #Georgia...  http://t.co/zFAMlX4yFl","Chattanooga Georgia"
"2015-07-17 ","14:56:48","sendavidperdue","Moving forward with a United Nations Security Council vote on the #IranNuclearDeal is outrageous...http://t.co/0uuiOTYu43","IranNuclearDeal"
"2015-07-17 ","13:18:00","sendavidperdue","ICYMI: Yesterday, I discussed the #IranDeal, @USArmy cuts, &amp; #CommonCore with @GANewsNetwork. Listen here: http://t.co/6KhqzuSv2n #gapol","IranDeal CommonCore gapol"
"2015-07-17 ","13:12:26","sendavidperdue",".@WSJ: ""Perdue said he had hoped to see a deal fully eliminating #Iran’s path to a #NuclearWeapon."" Read more here: http://t.co/fgfhdEOCe2","Iran NuclearWeapon"
"2015-07-16 ","19:39:20","sendavidperdue","Our children shouldn't have to wait another school year for Congress to act and stop #commoncore... http://t.co/oSETwAbfk7","commoncore"
"2015-07-16 ","16:46:28","sendavidperdue","RT if you agree. http://t.co/eWjA6kd16h",
"2015-07-16 ","14:44:42","sendavidperdue","Congress will have 60 days to review the #IranDeal. Georgians, please contact my offices &amp; share your opinions http://t.co/xRBbtyB2Xg #gapol","IranDeal gapol"
"2015-07-16 ","12:50:22","sendavidperdue","I'll join Michael Graham on @NewsRadio1067 at 9:05 to discuss the #IranNuclearDeal. Listen live here: http://t.co/Qg6XCLNSCz #gapol","IranNuclearDeal gapol"
"2015-06-18 ","18:03:09","sendavidperdue","Joined a prayer vigil at the Capitol for the people of #Charleston and the victims' families after this tragedy. http://t.co/8Jczvl1p7H","Charleston"
"2015-06-17 ","20:06:46","sendavidperdue","Congratulations to Brian Cooksey, @GeorgiaTech's ""Face of Manufacturing"" for June! http://t.co/pklFKwoukp #GAFacesofMfg","GAFacesofMfg"
"2015-06-17 ","15:42:24","sendavidperdue","Great news! ""Brazilian IT firm Stefanini to create 400 jobs in Atlanta"" http://t.co/QD8f1yAkAk",
"2015-06-17 ","14:27:53","sendavidperdue","Talked with @Albany_Herald about our growing global security crisis. http://t.co/wf8cSnZ82B #Georgia","Georgia"
"2015-06-12 ","16:56:41","sendavidperdue","Great news! 400 high-tech jobs are coming to Atlanta! http://t.co/5k7g5W1L16 #Georgia","Georgia"
"2015-06-12 ","13:32:32","sendavidperdue","It's a busy Friday! Listen LIVE to @NewsRadio1067 as we discuss today's important issues: http://t.co/PC6S6GHiHw #TGIF","TGIF"
"2015-06-12 ","13:01:01","sendavidperdue","Tune in LIVE in a few minutes to @WDUN to hear my thoughts on how to get our country back on track. Click here: http://t.co/Z9ai1wQGHB",
"2015-06-11 ","19:58:37","sendavidperdue","We must protect life. I'm proud to cosponsor the Pain-Capable Unborn Child Protection Act.  http://t.co/5WOL5Zo7EY",
"2014-10-24 ","18:25:31","SaxbyChambliss","Thanks for having me RT @GRU_news: Many thanks to attendees of Cyber Ed Summit @nsa_pao @SaxbyChambliss @ricardoazziz http://t.co/Ni9yf17rTn",
"2014-04-03 ","18:56:56","SaxbyChambliss","My Statement on the vote to declassifying CIA interrogation report http://t.co/Z7w9uGsxOM",
"2014-04-03 ","15:07:28","SaxbyChambliss","Sending my thoughts and prayers to the victims and their families of the tragedy at Fort Hood and to entire the Army community today.",
"2013-09-17 ","16:33:31","SaxbyChambliss","On this #ConstitutionDay, we celebrate the 226th anniversary of the signing of the Constitution, uniting us as one nation in democracy.","ConstitutionDay"
"2013-09-16 ","18:12:03","SaxbyChambliss","Thankful for all the brave first responders and authorities on the scene today. #NavyYardShooting","NavyYardShooting"
"2013-09-16 ","18:11:51","SaxbyChambliss","Thoughts &amp; prayers go out to the victims and all those affected by the #NavyYardShooting. Deeply saddened by this senseless act of violence.","NavyYardShooting"
"2013-09-16 ","16:06:19","SaxbyChambliss","3 years later, Americans are as negative toward #Obamacare as they have ever been http://t.co/MHBH5n8D7w","Obamacare"
"2013-07-26 ","20:00:16","SaxbyChambliss","To do so would be nothing short of an invitation for Al Qaeda to continue to attack us.",
"2013-07-26 ","20:00:01","SaxbyChambliss","One former detainee was involved in #Benghazi attacks, we can't afford to take that risk w other detainees just to satisfy political promise","Benghazi"
"2013-07-26 ","19:58:49","SaxbyChambliss","w recidivism rate at 28%, no detainee should be transferred unless we're confident he will be monitored and can't renew terrorist ties.",
"2013-07-26 ","19:57:31","SaxbyChambliss","Sending them to countries where Al Qaeda and its affiliates operate and continue to attack our interests is not a solution",
"2013-07-26 ","19:57:16","SaxbyChambliss","People across America are very concerned that WH still has no plan for these hard-core terrorists if efforts to close Gitmo are successful.",
"2013-07-26 ","19:13:46","SaxbyChambliss","Chambliss Statement on Transferring Detainees Out of Guantanamo http://t.co/97waLbYzOj",
"2013-03-14 ","21:40:09","SaxbyChambliss","Glad I could meet with the folks from Rome, Georgia this afternoon:... http://t.co/b8477fkBny",
"2013-03-14 ","14:16:24","SaxbyChambliss","This weekend I'll be in #Macon GA for their #CherryBlossom festival. This is Julianne and I riding in the parade... http://t.co/GuQXyurawu","Macon CherryBlossom"
"2013-03-13 ","18:14:24","SaxbyChambliss","Just voted in favor of Senator Ted Cruz's amdt that would defund #ObamaCare. Retweet if you agree.","ObamaCare"
"2012-12-15 ","16:14:38","SaxbyChambliss","As a parent and grandparent, there are no words to describe my grief at the senseless loss of life at Sandy Hook... http://t.co/Da4A3i4N",
