"Date","Time","screen_name","text","hashtags"
"2016-09-23 ","17:18:03","JimInhofe","Thank an #OKNG soldier today for his or her service. #OklahomaProud #CitizenSoldier https://t.co/xVc36PcaEa","OKNG OklahomaProud CitizenSoldier"
"2016-07-08 ","19:11:49","JimInhofe","An important-read in WashPo: Acts of heroism during a deadly night in Dallas: https://t.co/HzHE3nHBKe",
"2016-07-08 ","14:38:00","JimInhofe","PD upheld their pledge to protect &amp; serve, shielding peaceful protestors. These are the powerful images to remember: https://t.co/2FMrLAscNd",
"2016-07-08 ","14:33:58","JimInhofe","My statement on the unspeakable violence in Dallas last night: https://t.co/0Wa2HSMEZD",
"2016-06-12 ","17:31:26","JimInhofe","My prayers are w/all those impacted by this senseless act of terror in Orlando. Thank you to brave 1st responders who saved lives.",
"2015-10-02 ","15:44:43","JimInhofe","I always enjoy my time talking to hosts of KRMG. The NAB Marconi Radio Award going to KRMG comes as no surprise. Continue to make us proud.",
"2015-10-02 ","15:29:08","JimInhofe","Praying for our military and the family members of the servicemembers that lost their lives in the C-130J crash in Afghanistan.",
"2015-10-01 ","20:17:56","JimInhofe",".@EPA restricting ozone standard to 70ppb is another example of OAdm's enthusiasm for needless regulation https://t.co/N5jchc88ml @EPWMaj",
"2015-07-16 ","14:56:34","JimInhofe","It's ironic that the president will empower Iran to get to the export market w/ oil&amp;gas, but not allow the U.S. #BadDeal","BadDeal"
"2015-07-16 ","14:43:55","JimInhofe","Susan Rice tells CNN that US-Iran nuke deal will give Iran $$ to beef up its military &amp; potentially aid Assad in Syria. #BadDeal","BadDeal"
"2015-06-18 ","23:39:16","JimInhofe","Thanks Oklahomeruns for letting me guest coach your softball team tonight before I head back home to Tulsa http://t.co/3W4BccqfpW",
"2015-06-18 ","14:45:14","JimInhofe","Praying for the Charleston community &amp; #EmanuelAME http://t.co/wMK3IaQdEH","EmanuelAME"
"2015-06-11 ","18:24:54","JimInhofe",".@farmbureau analysis determines EPA’s final #WOTUS rule is worse for farmers than the original proposal. http://t.co/gFmTIroEQL","WOTUS"
"2015-06-11 ","15:19:57","JimInhofe","EPA science advisor Dr. Thomas Burke confirms science is never settled, even when it comes to climate. Watch here: https://t.co/Qjv9UCCWmO",
"2015-06-11 ","13:08:38","JimInhofe","Thanks @JimDeMint for the Political Leadership on Climate Change Award 2015. Cc: @Heritage http://t.co/XoVNaj5J6F",
"2015-06-11 ","12:26:29","JimInhofe","“@Timothy_Cama: .@jiminhofe on snowball throw: 'You can’t take these things too seriously. You’ve got to have fun in life'”",
"2014-04-03 ","22:04:22","JimInhofe","My thoughts and prayers are with Army community and families that were affected by the Fort Hood shooting last night.",
"2014-02-20 ","21:57:58","JimInhofe","I will continue to support funding for infrastructure projects that will make OK an even better place to do business. RT to stand with me!",
"2013-09-17 ","17:23:01","JimInhofe","It would be easy to send a few cruise missiles into Syria-if it would end there. We do not have a clear military objective &amp; could escalate.",
"2013-09-16 ","20:10:24","JimInhofe","My thoughts and prayers are with the victims and all those affected by the senseless act of violence at the Navy Yard today.",
"2016-09-24 ","17:01:28","SenatorLankford",".@NMAAHC is a great milestone. I applaud @jcwatts @repjohnlewis, @govsambrownback &amp; many others for making this happen. #APeoplesJourney","APeoplesJourney"
"2016-09-23 ","23:33:45","SenatorLankford","Paying ransom sends the wrong message to the world. I'm glad the House passed @RepEdRoyce's bill to ban cash ransom payments to #Iran","Iran"
"2016-09-23 ","00:31:32","SenatorLankford","Another day, another bad revelation re: #Iran -- Pres. Obama Kept Military Out of the Loop on Cash #IranPayments https://t.co/pLnu1esqUf","Iran IranPayments"
"2016-07-17 ","20:08:31","SenatorLankford","I'm thankful for police all across #Oklahoma &amp; America that remain committed to go to work &amp; keep us safe, even as police are targeted.","Oklahoma"
"2016-07-17 ","20:05:37","SenatorLankford","Today's cowardly murder of #BatonRouge police is another senseless national tragedy. We all mourn their loss. Attacks on police must end.","BatonRouge"
"2016-07-08 ","22:15:44","SenatorLankford","Today, I was grateful to meet with the Guthrie #Police Dept to thank them &amp; all law enforcement. #PrayForDallas https://t.co/z8imzyHwtn","Police PrayForDallas"
"2016-07-08 ","12:22:31","SenatorLankford","I grieve the horrific ambush #DallasPoliceShooting. I pray for the victims, their families &amp; #Dallas. I also pray for national unity &amp; peace","DallasPoliceShooting Dallas"
"2016-07-07 ","23:13:14","SenatorLankford","Today, I asked Sec. Kerry to suspend security clearances of Clinton &amp; her aides. Now, State is reopening the case https://t.co/98YpYoo6nZ",
"2016-07-07 ","21:28:36","SenatorLankford","The rules shouldn't be different just because her name is Hillary Clinton, &amp; not Hillary Jones, Smith, or Thompson. https://t.co/ihLwl4vpQe",
"2016-07-07 ","19:30:22","SenatorLankford",".@OklahomaFosters met their goal of 1,000 new #fostercare families! Keep up the great work for our Oklahoma kids. https://t.co/1MXKUSVrmr","fostercare"
"2016-07-07 ","14:30:40","SenatorLankford","Inexcusable → Sec. Clinton put national security at risk w/ her private server. Her security clearance should be suspended immediately.",
"2016-07-07 ","13:48:55","SenatorLankford","Very proud to join @marcorubio &amp; request that @StateDept immediately suspend security clearance of Sec. Clinton https://t.co/zFr6rEVXV4",
"2016-06-12 ","19:49:27","SenatorLankford","My statement on the Orlando shooting: https://t.co/GNOLK0Cjui",
"2016-06-12 ","13:55:07","SenatorLankford","The massacre shooting in Orlando is a horrific tragedy. I pray for the victims, their families &amp; community, who must be terribly shaken.",
"2016-02-25 ","22:02:22","SenatorLankford","Academics &amp; legal experts agree--Dept. of Ed use of ""guidance"" is clear example of executive overreach. https://t.co/TiIA4XvOGe",
"2016-02-25 ","18:06:43","SenatorLankford","Questioned AG Lynch on #Gitmo &amp; @TheJusticeDept budget requests this morning. Watch here: https://t.co/TWfd4KudZ1","Gitmo"
"2016-02-25 ","18:05:15","SenatorLankford","Even AG Lynch admits it's illegal to transfer terrorists from #Gitmo to the US. The law that prohibits it was signed by POTUS last year.","Gitmo"
"2016-02-25 ","14:56:18","SenatorLankford","Discussed Dept. of Education, #Iran, and #SCOTUS vacancy on @NEWSRADIOKTOK this morning. Check it out: https://t.co/WcrUKq7ooZ","Iran SCOTUS"
"2015-12-03 ","17:52:30","SenatorLankford","Take it from @jimmyfallon. This way the gov't is spending money is ridiculous. #FederalFumbles https://t.co/6Gdpg7ge5Y","FederalFumbles"
"2015-12-02 ","21:02:36","SenatorLankford","We can't have enough government oversight. To your Wastebook I'm looking forward. @JeffFlake #TheFarceAwakens https://t.co/LExnor1jYw","TheFarceAwakens"
"2015-12-02 ","19:48:46","SenatorLankford","Have you seen what the major government watch and taxpayer protection groups are saying about #FederalFumbles? https://t.co/U6S6zOTUBd","FederalFumbles"
"2015-12-02 ","17:06:56","SenatorLankford","Spoke on the floor about #PlannedParenthood funding, #Obamacare, and my amendment for the #HealthCareCompact. WATCH: https://t.co/kwSqdZQaUI","PlannedParenthood Obamacare HealthCareCompact"
"2015-12-02 ","17:02:21","SenatorLankford","The Affordable Care Act has proven to be neither affordable, nor caring for many people in my state. #Obamacare is full of #brokenpromises.","Obamacare brokenpromises"
"2015-12-02 ","00:41:54","SenatorLankford","ABC News “World News Tonight” reports on #FederalFumbles. WATCH: https://t.co/zd7iXFYTHx via @ABC @marykbruce","FederalFumbles"
"2015-12-02 ","00:14:44","SenatorLankford","My floor speech about the federal debt, gov't waste &amp; my #FederalFumbles report. WATCH: https://t.co/ZhwOc111Ex","FederalFumbles"
"2015-12-02 ","00:10:19","SenatorLankford","""Fed Fumbles Add Up to Ridiculous Waste"" via @CBNNews @PaulStrandCBN https://t.co/e4K7EuD3Qs #FederalFumbles","FederalFumbles"
"2015-11-28 ","13:34:17","SenatorLankford","It's another great football Saturday in #Oklahoma. #Big12 title will be decided in-state! #Bedlam #gopokes #boomer #CollegeGameday #OUvsOKST","Oklahoma Big12 Bedlam gopokes boomer CollegeGameday OUvsOKST"
"2015-11-28 ","12:56:41","SenatorLankford","It’s #SmallBusinessSaturday, a day to celebrate the vital role of small businesses to our economy. #ShopSmall","SmallBusinessSaturday ShopSmall"
"2015-10-01 ","21:51:17","SenatorLankford","Congress has passed a bill to protect #smallbusiness from #Obamacare premium hikes! #PACEAct https://t.co/Deat5S0MmY","smallbusiness Obamacare PACEAct"
"2015-10-01 ","14:55:41","SenatorLankford","Discussed #crudeoil exports, #WOTUS &amp; a new bill I'm introducing next week on the Exploring Energy show. LISTEN: https://t.co/5DzGPdBERe","crudeoil WOTUS"
"2015-07-16 ","20:57:51","SenatorLankford","""Every adult who can hear me now was once 20 weeks old in the womb. That's a human being we're talking about."" https://t.co/FWDOGuhXXV",
"2015-07-16 ","20:26:00","SenatorLankford","#PlannedParenthood outrage: ""We cannot be a nation that does this to our children"" http://t.co/UAQQZMqbMM #PPSellsBabyParts","PlannedParenthood PPSellsBabyParts"
"2015-07-16 ","18:31:04","SenatorLankford","Planning to speak on Senate floor 4p-4:30p ET on #PlannedParenthood &amp; their gruesome abortion practices. Watch on C-SPAN2. #PPSellsBabyParts","PlannedParenthood PPSellsBabyParts"
"2015-06-18 ","20:11:16","SenatorLankford","In case you missed today's U.S. Capitol prayer vigil for #Charleston, join our #PrayersForCharleston WATCH: https://t.co/7H7LXnjEyl","Charleston PrayersForCharleston"
"2015-06-18 ","16:55:50","SenatorLankford","We stand together as Americans to pray for #Charleston &amp; all those affected by the #CharlestonShooting. http://t.co/TwgCtzJGTA","Charleston CharlestonShooting"
"2015-06-18 ","14:44:31","SenatorLankford","My heart grieves with the #Charleston community &amp; Emanuel AME church. The #CharlestonShooting is a senseless tragedy! #PrayForCharleston","Charleston CharlestonShooting PrayForCharleston"
"2015-06-18 ","14:17:53","SenatorLankford","After decade of implementation we must ask ourselves if the #RFS goals of yesterday are worth the increased costs to food, gas &amp; environment","RFS"
"2015-06-18 ","14:16:08","SenatorLankford","Ideals of the #RFS program are laudable: improve nation’s energy security &amp; preserve the environment... but its unworkable in current form.","RFS"
"2015-06-18 ","13:10:21","SenatorLankford","Our hearing ""Re-examining EPA’s Management of the #RFS Program"" has just started. Watch live on C-SPAN3 or online:  http://t.co/pgELsorVGR","RFS"
"2015-06-17 ","18:08:54","SenatorLankford","Chairing the Homeland Security hearing on the nomination of Carol Ochoa to be IG of @usgsa. Watch LIVE here: http://t.co/dBlC9r1MmW",
"2015-06-17 ","04:18:13","SenatorLankford","Congrats to the #GoldenStateWarriors for winning #NBAFinals2015. But watch out for the @okcthunder next year! #NBAFinals #ThunderUp #OKC","GoldenStateWarriors NBAFinals2015 NBAFinals ThunderUp OKC"
"2015-06-12 ","15:23:10","SenatorLankford","ICYMI: Here is my convo w/ @IngrahamAngle about my letter to @DHSgov on the free exercise of #religion https://t.co/l35otJVvQq","religion"
"2015-06-11 ","22:02:20","SenatorLankford","I'll be LIVE on the Laura Ingraham radio show tomorrow AM at 10:35 ET/9:35 CT. Be sure to tune in! @IngrahamAngle",
"2015-06-11 ","18:55:16","SenatorLankford","Standing for international #religiousfreedom at the @CoptSolidarity Policy Day on the Hill. #CopticSolidarity http://t.co/cRVoMWMf5P","religiousfreedom CopticSolidarity"
"2015-06-11 ","17:02:31","SenatorLankford","Proud to defend life &amp; cosponsor the Pain Capable Unborn Child Protection Act introduced today by @GrahamBlog. #ProLife #theyfeelpain","ProLife theyfeelpain"
"2015-06-11 ","13:52:08","SenatorLankford","I talked with @OKCFOX yesterday for their ""Connect to Congress"" segment. WATCH here: http://t.co/gGmr18amfy",
"2014-10-24 ","14:40:58","SenatorLankford","Federal judge tosses tea party suit seeking permanent protection from #IRS targeting http://t.co/4NIibA5wuM","IRS"
"2014-04-04 ","16:44:21","SenatorLankford","#FBF Sat. marks 3 years since @RepPaulRyan introduced FY12 Path to Prosperity #budget proposal. #futuregenerations http://t.co/nHNKJND7fc","FBF budget futuregenerations"
"2014-04-03 ","13:42:41","SenatorLankford","Please continue to pray for everyone impacted by Wednesday's tragedy at Ft. Hood.",
