"Date","Time","screen_name","text","hashtags"
"2014-10-24 ","16:33:26","JohnKerry","Enjoyed first-ever @StateDept #Diwali celebration. cc: @NishaBiswal @State_SCA / #HappyDiwali to all http://t.co/xRG90l3E3V","Diwali HappyDiwali"
"2014-10-24 ","15:55:07","JohnKerry","Insightful parting thoughts from my friend Bill Burns in @ForeignPolicy: http://t.co/BDnnboq3tm",
"2014-05-23 ","01:56:40","JohnKerry","Thought a lot about my Dad tonight and his career in Foreign Service #FS90","FS90"
"2014-04-04 ","21:58:07","JohnKerry","Couldn’t leave #Casablanca w/out hearing Sam play it again at Rick’s Café – started by former @StateDept FSO. http://t.co/VpZvpjTMVR","Casablanca"
"2014-04-04 ","18:54:46","JohnKerry","An honor to swear in new @PeaceCorps volunteers in #Rabat -- ‘ambassadors’ for US/incredible commitment to service. http://t.co/vwBwFUgwDo","Rabat"
"2014-04-04 ","00:58:41","JohnKerry","Met some future Team L’Algerie/#WorldCup stars today – great game, wish I’d been that good! cc: @SportsDiplomacy http://t.co/rmog4znlGe","WorldCup"
"2014-04-03 ","13:39:35","JohnKerry","Welcome @HHigginbottom to Twitter: reformer,numbrs cruncher,innovatr,glass ceiling brkr &amp;not a bad ctr mid in soccer! http://t.co/bQ3YMJ7I3A",
"2014-02-21 ","21:45:37","JohnKerry",".@HonJohnBaird two close ones! Congrats to #TeamCanada. Making good on my promise:case of @SamuelAdamsBeer on the way http://t.co/RMkPIJlpr8","TeamCanada"
"2014-02-21 ","17:41:52","JohnKerry","Looking forward to having @tomperriello join @StateDept team to lead #QDDR efforts–smart &amp; committed to work ahead http://t.co/SpftDyeu8H","QDDR"
"2014-02-21 ","16:32:48","JohnKerry","Usually pulling for Claude Julien &amp; Patrice Bergeron to get the win in #Boston but no chance of that today in Sochi #USAvsCAN -- #GoTeamUSA!","Boston USAvsCAN GoTeamUSA"
"2014-02-20 ","23:30:49","JohnKerry","You may have seen Clooney, Damon, Murray &amp; Goodman on the big screen but check out @StateDept’s own #MonumentsMen http://t.co/PltzMNkwGF","MonumentsMen"
"2014-02-20 ","22:13:16","JohnKerry","@StateDept’s hardworking @TravelGov team received a great surprise: Thank you from #TeamUSA. Now proudly on display. http://t.co/3tlp4kBQT8","TeamUSA"
"2014-02-20 ","16:50:04","JohnKerry","Good luck to MA’s @schaus729 @kbells22 @carpy05 @mduggan10 @shellfish20/@BostonCWHL players/all #TeamUSA Women’s Hockey on matchup v #Canada","TeamUSA Canada"
"2014-02-20 ","14:54:53","JohnKerry",".@zhangjialong I’m still listening http://t.co/Mlt9kGQvB4",
"2010-08-04 ","22:51:29","JohnKerry","@THE_REAL_SHAQ Welcome to Massachusetts, big guy.",
