"Date","Time","screen_name","text","hashtags"
"2012-09-27 ","18:02:41","SaxbyChambliss","Join me in supporting the Army's Suicide Prevention Stand-Down today. We can all help to minimize the risk of... http://t.co/NRXQNqL9",
"2012-09-27 ","16:47:48","SaxbyChambliss","Thanks for writing RT @savoythegreat: Additional gratitude to Senator Saxby Chambliss' office for the time and speedy correspondence",
"2012-09-27 ","14:24:59","SaxbyChambliss","Representatives from the U.S. Military Academies and the GA congressional delegation will be available to answer... http://t.co/9pJnpSOK",
"2012-08-06 ","19:52:34","SaxbyChambliss","Base number two today: Ft. Benning in Columbus, Georgia

To avoid sequestration we need to get America’s... http://t.co/VH7a7LKk",
"2012-08-06 ","19:24:14","SaxbyChambliss","Ft. Benning mtg: All Georgians - not just those associated w military- need 2 understand effects of  sequestration http://t.co/No0T83hT",
"2012-08-06 ","18:52:19","SaxbyChambliss","Chambliss, Isakson, Bishop: Across-the-board cuts will hurt military http://t.co/HRLaIgH8",
"2012-08-06 ","15:44:23","SaxbyChambliss","Kicking off my Georgia military base tour with Sen. Johnny Isakson and Rep. Sanford Bishop in Albany Georgia this... http://t.co/DFJcsxMA",
"2012-07-21 ","20:02:04","SaxbyChambliss","Reforming entitlements must be part of any solution to reduce our deficit: @WSJ Cheat Sheet on the Budget http://t.co/83AOAhWK",
"2012-07-21 ","19:31:49","SaxbyChambliss","Have you ""liked"" me on Facebook yet? http://t.co/gJgjRkER",
"2012-07-20 ","14:49:55","SaxbyChambliss","I am deeply saddened at the horrible tragedy and senseless loss of life in Colorado last night.  My prayers go... http://t.co/0xYDIThl",
"2012-05-21 ","18:34:03","SaxbyChambliss","Congrats to the Valdosta State Lady Blazers for winning the 1st softball championship in school history:... http://t.co/3dE7dqTh",
"2012-05-21 ","15:46:10","SaxbyChambliss","It was great to meet you too @robinw: Met @saxbychambliss tonight at my friend's sip and see. Very nice and cordial.",
"2012-05-21 ","15:39:02","SaxbyChambliss","I enjoyed meeting with the Sandy Springs Chamber this morning in Atlanta. Read more about my visit here:... http://t.co/GUPxe1jl",
"2012-04-03 ","14:57:38","SaxbyChambliss","Cant get US back to work with highest #CorporateTax. Lower rate will stop jobs from going overseas and attract new biz investments to the US","CorporateTax"
