"Date","Time","screen_name","text","hashtags"
"2016-09-24 ","23:03:06","SenCapito","Big game tonight for @HerdFB in @huntingtoncity. Let’s go #HERD! #Stampede16 #BEHERD","HERD Stampede16 BEHERD"
"2016-09-24 ","18:05:59","SenCapito","Headed in to #FedExField to cheer on @WVUfootball! This is my grandkids' first game! #WVUatFedEx16 #HailWV https://t.co/49XLBiTaR3","FedExField WVUatFedEx16 HailWV"
"2016-09-24 ","13:09:06","SenCapito","#Education &amp; #EconomicDevelopment go hand in hand in WV. Here’s why:  https://t.co/kJrzd9IPPk","Education EconomicDevelopment"
"2016-09-23 ","19:16:01","SenCapito","Do you receive my weekly recap? If not, here’s the link to sign up: https://t.co/3peS95yrSV",
"2016-09-23 ","18:35:16","SenCapito","ICYMI, here’s a look at yesterday’s Senate #Broadband Caucus meeting: https://t.co/bWciT7D1DF","Broadband"
"2016-09-23 ","18:34:51","SenCapito","Rural America is open for business and the time is NOW to connect WV. https://t.co/E9lP72etFc",
"2016-09-23 ","17:41:04","SenCapito","Before starting your weekend, check out a few highlights from the Senate: https://t.co/N4Hru267qJ",
"2016-09-23 ","17:04:02","SenCapito","My staff is hosting our 2nd Academy Day in the Eastern Panhandle tomorrow at 2PM at Spring Mills High School. Stop by! https://t.co/mxw9PPRaSv",
"2016-09-23 ","16:39:03","SenCapito","Just announced new funding from @fema for Emergency Protective Measures following #wvflood: https://t.co/g7f7aF4qQ1","wvflood"
"2016-09-23 ","16:17:50","SenCapito","ICYMI: announced new funding to help expand opportunities for our displaced miners. More here: https://t.co/IxRovbifLP",
"2016-09-23 ","13:02:05","SenCapito","This @WVLiving piece showcases the beauty &amp; history of #HarpersFerry that I saw during my small biz tour: https://t.co/kTNU3kvzm3 #gotowv https://t.co/wdwRCCyxs9","HarpersFerry gotowv"
"2016-07-18 ","20:38:05","SenCapito","Don’t miss my op-ed in @heralddispatch on how #CARA will help fight against the drug epidemic in WV. https://t.co/kiUDvorJ0n","CARA"
"2016-07-18 ","13:13:07","SenCapito",".@wvstatejournal has the details on my latest push to improve #internet access in underserved parts of rural America https://t.co/eBfRw7XgWj","internet"
"2016-07-17 ","20:21:04","SenCapito","Law enforcement officers put their lives on the line to keep us safe. My heart is with Baton Rouge &amp; the families of the officers killed.",
"2016-07-17 ","15:01:01","SenCapito","Catch up on the happenings in Washington in my newsletter here: https://t.co/hnJnoqxMUx https://t.co/bKXt11lZ0S",
"2016-07-17 ","13:34:02","SenCapito","FACT: Nearly ½ of WV households don’t have #broadband access. Learn what I’m doing to change this: https://t.co/ypZm9YNaVI","broadband"
"2016-07-08 ","20:27:51","SenCapito","Sadden by the passing of my friend Corky DeMarco-a true champion for our state. My prayers are w/ Catherine, their children &amp; grandchildren.",
"2016-07-08 ","19:56:05","SenCapito","Always fun to see folks from home. Thanks to Morgan County Commissioner Brad Close &amp; his family for stopping by. https://t.co/ZC3Hi3qSXa",
"2016-07-08 ","18:50:06","SenCapito","Have a minute? Here's a recap of my week in West Virginia and Washington https://t.co/EVnIVt3F7d",
"2016-07-08 ","18:23:06","SenCapito",".@FEMA Disaster Recovery Center now open in Lincoln Cty. at Morrisville Fire Department Substation, 2508 Straight Fork Rd. in Alkol #wvflood","wvflood"
"2016-07-08 ","17:23:50","SenCapito","Glad the House passed #CARA to help combat the #drugepidemic. Time for the Senate to do the same. https://t.co/v5gsDmP6Wt","CARA drugepidemic"
"2016-07-08 ","15:00:55","SenCapito","Devastated for the families of the officers who were tragically killed last night and praying for the wounded.",
"2016-07-07 ","23:04:06","SenCapito","Had the chance to meet w/ @RudyTanzi and talk about my commitment to finding a cure for #Alzheimers. https://t.co/v7XPHUAgdv","Alzheimers"
"2016-07-07 ","22:33:03","SenCapito","Joined some of our nations brightest, including WVians Drew &amp; Amy at @NYSF Luncheon today. #STEM https://t.co/5i7gcxst7S","STEM"
"2016-07-07 ","22:07:40","SenCapito","Urging my colleagues to pass #CARA–a needed step to combat nat’l drug crisis. WATCH from @SenateFloor: https://t.co/lvLr2QM5m5","CARA"
"2016-07-07 ","21:26:03","SenCapito","Today my staff talked with workers on Baker’s Island about restoring the river bank after #wvflood. https://t.co/j5bNT1lKV1","wvflood"
"2016-07-07 ","21:05:37","SenCapito",".@fema is offering tips on rebuilding stronger &amp; safer homes after #wvflood. More info on my #Facebook page: https://t.co/OfZFfBoRpg","wvflood Facebook"
"2016-07-07 ","20:34:20","SenCapito","Significant funding for rural health care initiatives will help improve our health care systems &amp; is headed to #WV: https://t.co/HbxKYdrT5o","WV"
"2016-07-07 ","19:26:19","SenCapito","Joined @SenCoryGardner &amp; @JohnCornyn on the #TRUSTact to revoke Secretary Clinton’s security clearance: https://t.co/IAq7BmH3s7","TRUSTact"
"2016-07-07 ","18:25:03","SenCapito","Thanks to @PeterRoskam &amp; @RepLindaSanchez for leading House bill on this bicameral, bipartisan effort to help those living w/ #Alzheimers","Alzheimers"
"2016-07-07 ","18:24:37","SenCapito","@SenStabenow &amp; I have a new bill 2 help Alzheimer’s patients &amp; caregivers, reduce cost burden on Medicare &amp; Medicaid https://t.co/EQPkpeJc79",
"2016-07-07 ","14:08:06","SenCapito","Residents or businesses in Greenbrier, Kanawha &amp; Nicholas Co-you may qualify for tax relief after flood https://t.co/nnBDil9lmP via @IRSNews",
"2016-07-07 ","13:33:06","SenCapito","I’ll be speaking with @Talkradiowrnr this morning at 9:45 a.m. If you’re in the Eastern Panhandle, hope you’ll tune in.",
"2016-06-13 ","23:37:05","SenCapito","Helped kick off @WVGirlsState at @WheelingJesuit yesterday. WV’s future looks bright w these women leading the way! https://t.co/de0rRgD8r1",
"2016-06-13 ","22:23:03","SenCapito","Loved meeting the Griffith’s during their D.C. visit last week! https://t.co/sYtj9anQ9D",
"2016-06-13 ","21:18:07","SenCapito","Recognized the tenacity &amp; entrepreneurship of biz leaders at the @wvstatejournal Who's Who in WV Biz event today. https://t.co/TWnIImp719",
"2016-06-13 ","20:14:29","SenCapito","Updated the @wvscpas on the Senate’s progress today in Charleston. https://t.co/Nn93ZLLPkL",
"2016-06-13 ","12:58:06","SenCapito","Always enjoy catching up w/ WVians at my wkly coffee. Take a look @ future dates &amp; sign up: https://t.co/VOAVxPt5IV https://t.co/12jCX1Ag1m",
"2016-06-12 ","15:59:23","SenCapito","Praying for the Orlando community in the wake of this morning’s unthinkable act of violence.",
"2016-06-12 ","15:02:04","SenCapito","National defense, chemical safety reform &amp; WV health programs–a few topics covered this wk https://t.co/u6tqL4ygmK https://t.co/dX3mDANtSq",
"2016-07-18 ","15:11:06","Sen_JoeManchin","My #WVParkoftheWeek is @HarpersFerryNPS in the Eastern Panhandle, where history &amp; scenic beauty collide. Learn more: https://t.co/nBvDwRLq0X","WVParkoftheWeek"
"2016-07-17 ","23:14:43","Sen_JoeManchin","Saddened by another act of senseless violence against our law enforcement officers. Gayle &amp; I send our thoughts &amp; prayers to #BatonRouge","BatonRouge"
"2016-07-08 ","21:10:03","Sen_JoeManchin","Gayle and I join all West Virginians in keeping Corky DeMarco’s entire family in our hearts and prayers during this difficult time.",
"2016-07-08 ","18:20:10","Sen_JoeManchin","Gayle &amp; I are deeply saddened by the shooting in #Dallas last night &amp; our prayers are with loved ones of those who lost their lives.","Dallas"
"2016-07-08 ","17:07:05","Sen_JoeManchin","Visit my website for a recap of what I've been working on this week in DC: https://t.co/vmAEkKc5NJ #CatchingUpWithJoe","CatchingUpWithJoe"
"2016-07-08 ","15:19:04","Sen_JoeManchin","This week I met a group of #WV 4-Hers in DC to learn about citizenship w/ 4-Hers from across the country. #4HCWF https://t.co/IhlnOe9ZKn","WV 4HCWF"
"2016-07-07 ","22:15:08","Sen_JoeManchin","Today I read another letter on the @SenateFloor from a WVian impacted by the opioid epidemic. WATCH: https://t.co/2U5Vq8Dx8P",
"2016-07-07 ","20:37:04","Sen_JoeManchin","Every WVian deserves access to quality healthcare. Pleased to announce over $900K for #WV healthcare initiatives. https://t.co/vZCuBUPdF7","WV"
"2016-07-07 ","19:16:07","Sen_JoeManchin","I was honored to speak at the @NYSF Senate Luncheon, and enjoyed meeting #WV’s delegates, Drew and Amy. https://t.co/EorezRNy1r","WV"
"2016-06-13 ","14:09:03","Sen_JoeManchin","Thanks to the nearly 300 riders who joined to show solidarity with #WV Gold Star Families. https://t.co/pwed2aKy4d","WV"
"2016-06-13 ","14:09:02","Sen_JoeManchin","Yesterday I hosted the 2nd annual Ride for Fallen Heroes in Charleston. https://t.co/c0dLpEHjfV",
"2016-06-12 ","15:11:26","Sen_JoeManchin","Gayle and I join all WVians in extending our thoughts and prayers to the victims and families in Orlando.",
"2016-02-26 ","22:10:11","Sen_JoeManchin","Visit my website 4 a recap of what I’ve been working on this week in DC: https://t.co/56LIXUdAVc #CatchingUpWithJoe https://t.co/Nd1g6BmPIi","CatchingUpWithJoe"
"2016-02-25 ","21:06:02","Sen_JoeManchin","Had a great visit today w/the #WV Wing @CivilAirPatrol. Thank you 4 your dedication &amp; service to our country &amp; #WV. https://t.co/k3EB3auZvu","WV WV"
"2016-02-25 ","16:30:21","Sen_JoeManchin","@nytopinion Impt editorial on states' role in fighting opioid crisis. I look 4ward to reviewing @NatlGovsAssoc opioid prescribing protocols.",
"2016-02-21 ","15:00:18","Sen_JoeManchin","Tonight I'll definitely be tuning in to @ABCSharkTank to watch #WV #smallbiz owners. Good luck,@CustardStand! https://t.co/HCx940QPFm","WV smallbiz"
"2016-02-20 ","17:00:20","Sen_JoeManchin","It was wonderful to be back in Charleston this week and visit with so many of my old friends and colleagues. https://t.co/D5QSYprWTn",
"2015-12-03 ","19:15:10","Sen_JoeManchin","Although this conviction doesn’t bring back the 29 miners we lost, I hope this brings some closure to their families https://t.co/0E2Wlmp6YB",
"2015-12-02 ","15:40:08","Sen_JoeManchin","Good editorial in the @HeraldDispatch on why new @CDCgov prescribing guidelines are needed to end opioid abuse: 
https://t.co/xCxvjKJWgk",
"2015-12-02 ","14:59:02","Sen_JoeManchin","House passage of our measures to stop @EPA’s #CleanPowerPlan shows the world we will continue to fight absurd regs: https://t.co/1yExpKgXMh","CleanPowerPlan"
"2015-11-28 ","17:00:10","Sen_JoeManchin","#WV’s more than 120k small businesses make up about 96% of our economy. Remember to @ShopSmall today. #SmallBizSat","WV SmallBizSat"
"2015-11-28 ","15:00:09","Sen_JoeManchin","It’s #SmallBizSat – a day for all WVians and Americans to @ShopSmall &amp; support local communities. #SmallBizSat https://t.co/s6UaBJe8Ll","SmallBizSat SmallBizSat"
"2015-11-27 ","17:00:09","Sen_JoeManchin","When you @ShopSmall this holiday season, you’re investing back into our #WV communities. Remember #SmallBizSat is tomorrow.","WV SmallBizSat"
"2015-10-31 ","16:00:21","Sen_JoeManchin","Wishing WVians a happy &amp; fun #Halloween! Be sure your family enjoys the holiday safely w these tips from @CDCgov: https://t.co/uDB2PSEOOC","Halloween"
"2015-10-02 ","18:45:11","Sen_JoeManchin","Glad to stand with #UMWA today at the rally in Morgantown because our miners deserve the pensions they’ve earned. http://t.co/AnikZUAlCm","UMWA"
"2015-10-02 ","18:00:31","Sen_JoeManchin","Urging WVians to attend the job fair on Oct. 5 w/ 58 employers &amp; @ProcterGamble hiring:  http://t.co/TJusrc1zF3 http://t.co/EyE4BGb88c",
"2015-10-02 ","17:45:11","Sen_JoeManchin","Investing in modern advanced manufacturing boosts our economy  and creates a path to the middle class. #MFGDay15 http://t.co/skyPDJoEAD","MFGDay15"
"2015-10-02 ","16:25:06","Sen_JoeManchin","All WVians should have access to wireless/broadband tech &amp; I’m calling for a hearing 2 address the lack of services: http://t.co/eT193AKEqL",
"2015-10-02 ","15:45:07","Sen_JoeManchin","We need to end failed Syria Train &amp; Equip Program &amp; seek alt ways forward instead of aiding forces we aim to defeat: http://t.co/Wv9pDc8I76",
"2015-10-01 ","21:37:08","Sen_JoeManchin","I urge my colleagues to take immediate action on the CASE Act to rein in the new harmful @EPA ozone rule. Read more: https://t.co/rUGNdgdbJk",
"2015-10-01 ","20:05:06","Sen_JoeManchin","Today, I voted against the MilCon-VA bill b/c it shorts spending for impt veterans’ benefits programs. Read more: https://t.co/UJuAqP0FRF",
"2015-10-01 ","17:27:03","Sen_JoeManchin","Glad to announce important funding to improve drug courts and help curb drug abuse across #WV. Read more here: http://t.co/EbxRxrjqMD","WV"
"2015-07-17 ","21:00:20","Sen_JoeManchin","Visit my website for a recap of what I’ve been working on this week in DC: http://t.co/M5hddjQLMP
#CatchingUpWithJoe http://t.co/MFvcNxk6z3","CatchingUpWithJoe"
"2015-07-17 ","18:53:41","Sen_JoeManchin","Glad 2 meet Patrick Friend &amp; Carli Woodyear yesterday 2 talk abt being National Youth Correspondents at @WJMC_Mason. http://t.co/p8tyo9aQVX",
"2015-07-17 ","17:55:06","Sen_JoeManchin","Inrto’d legislation today w/ @SenHoeven that create a states-first approach to regulating coal ash and protects jobs: http://t.co/8uz15XdJL8",
"2015-07-17 ","16:30:39","Sen_JoeManchin","Yesterday I spoke with @DeptVetAffairs Secretary McDonald &amp; he committed to reopening the Greenbrier CBOC. Read more: http://t.co/EcI9SX6WMX",
"2015-07-17 ","16:00:58","Sen_JoeManchin","Encouraging all veterans to participate in @BoyScouts’ Veterans Appreciation Day in Fayette Co. Saturday. Sign up: http://t.co/Y9nCT9cE4y",
"2015-07-17 ","14:55:08","Sen_JoeManchin","Welcomed @WVUhealthcare Ruby Memorial Hospital Clinical Pharmacist Dr. Jon Wiethole and his family to DC yesterday. http://t.co/M2TdM2LEAi",
"2015-07-16 ","23:00:38","Sen_JoeManchin","My staff was honored to attend @WVNationalGuard Morgantown Readiness Center grand opening. Thanks 4 all you do 4 #WV: http://t.co/SgMnQW3kmo","WV"
"2015-07-16 ","22:00:56","Sen_JoeManchin","My amendment to #ESEA will urge states to adopt a strategy to educate students who face substance abuse at home: http://t.co/3CwICxJdAL","ESEA"
"2015-07-16 ","20:30:16","Sen_JoeManchin","Congrats to the more than 3,200 #WV students on receiving the #PROMISE scholarship to pursue your higher education: http://t.co/DMDGLM1dby","WV PROMISE"
"2015-07-16 ","19:50:04","Sen_JoeManchin","Worked hard to include important measures to #ESEA that will benefit students and families in #WV. Read more: http://t.co/O5OsjhfFGs","ESEA WV"
"2015-07-16 ","18:56:04","Sen_JoeManchin","The @Interior's harmful proposed Stream Protection Rule would devastate #WV families and businesses. Read more: http://t.co/z6YVpm29Nl","WV"
"2015-07-16 ","17:22:02","Sen_JoeManchin","Happening Now: I'm on the @SenateFloor urging support for my Substance Abuse amendment to the #ESEA. Watch live: http://t.co/fXePJASdz1","ESEA"
"2015-06-18 ","22:00:18","Sen_JoeManchin","#TBT to 1983 when I was sworn into the #WV House of Delegates with my uncle A. James by my side. http://t.co/J6CVHMiauQ","TBT WV"
"2015-06-18 ","21:10:04","Sen_JoeManchin","While I fully support the troops, I cannot support fiscally irresponsible defense bills. My statement: http://t.co/RyhezFrf61",
"2015-06-18 ","20:25:05","Sen_JoeManchin","Today I responded to @Pontifex's encyclical calling for action on #ClimateChange. Read my statement: http://t.co/dpGap35vOs","ClimateChange"
"2015-06-18 ","17:42:05","Sen_JoeManchin","Gayle &amp; I join all WVians in sending our prayers to Charleston SC &amp; the Emanuel AME Church community. http://t.co/Y2zMjLl0Jq",
"2015-06-18 ","17:15:07","Sen_JoeManchin","I applaud @USDOL for approving $5.2 million for #WorkForceWV to expand job training programs across #WV. Read more: http://t.co/N7rwztsnPx","WorkForceWV WV"
"2015-06-18 ","13:30:16","Sen_JoeManchin","I encourage WVians to honor veterans by participating in #VASummerofService. More info on how to volunteer in #WV: http://t.co/uyFwINvdOM","VASummerofService WV"
"2015-06-18 ","13:00:27","Sen_JoeManchin","Happy birthday to my dear friend and a devoted West Virginian, Jay Rockefeller. http://t.co/WZGEnrFj2Y",
"2015-06-17 ","16:25:03","Sen_JoeManchin","Proud to welcome CounterTop Solutions to our business-friendly state. Great news for Berkeley County #WV. More: http://t.co/1yvNt0ANCT","WV"
"2015-06-17 ","14:45:07","Sen_JoeManchin","Glad the @FCC is expanding broadband service to 89K additional homes and businesses in rural #WV. Read more: http://t.co/VasIxvrodv","WV"
"2015-06-12 ","21:15:05","Sen_JoeManchin","I'll be on @CNN around 5:25pm today to talk about #NDAA and the U.S. approach to fighting ISIS in Iraq. Tune in if you can.","NDAA"
"2015-06-12 ","20:24:34","Sen_JoeManchin","Visit my website for a recap of what I've been working on this week in DC: http://t.co/6J09twXYa2 #CatchingUpWithJoe http://t.co/iVH2otlrIj","CatchingUpWithJoe"
"2015-06-12 ","19:25:07","Sen_JoeManchin","My staff presented flags in towns across #WV this week. Looking fwd to continuing #FlagDay festivities this weekend. http://t.co/4ufGRlZIBZ","WV FlagDay"
"2015-06-11 ","18:05:05","Sen_JoeManchin","Proud of #WV natives Emily Davis &amp; Emily Spangler who were selected 4 the '15 Junior Fellows Program @LibraryCongress http://t.co/eDKmKKxmwE","WV"
"2014-10-24 ","15:10:36","Sen_JoeManchin","Just added new photos to my Facebook page from the #WV #ClimateCommonSense tour with @SenWhitehouse. Check them out: http://t.co/FqXubUbFTI","WV ClimateCommonSense"
"2014-10-24 ","14:51:30","Sen_JoeManchin","Thanks @GenChuckYeager for stopping by our office yesterday to speak w/ @marshallu's Society of Yeager Scholars. #WV http://t.co/JJA1nE6NXY","WV"
"2014-05-23 ","20:11:09","Sen_JoeManchin","As a member of #SASC, I'm proud to have worked on the bipartisan defense package &amp; included ten important provisions: http://t.co/DmTmgDQiGm","SASC"
"2014-05-23 ","19:47:04","Sen_JoeManchin","Today at the @WhiteHouse I had the honor of standing w/ four Fighter Aces at the presidential bill signing ceremony. http://t.co/svKwvGbUDe",
"2014-05-23 ","16:34:26","Sen_JoeManchin","Starting #MemorialDay, Blue Star Museums will offer free admission 2 military members &amp; their families. More info: http://t.co/78mINPp5Nx","MemorialDay"
"2014-05-23 ","14:24:43","Sen_JoeManchin","Very pleased that my bill  honoring American Fighter Aces will be signed into law this afternoon:  http://t.co/SBK3VQKKtJ",
"2014-04-04 ","17:47:16","Sen_JoeManchin","PHOTO: Always a privilege to visit Camp Dawson &amp; meet w/ our dedicated WV National Guardsmen and women. http://t.co/is4xipFHXb",
"2014-04-04 ","16:32:44","Sen_JoeManchin","Pleased to meet Wendy Bailey, #WV Asst Principal of the Year yesterday. Congrats &amp; great work, @wdbaileywv. #apoy14 http://t.co/VxjuvEYf1o","WV apoy14"
"2014-04-04 ","13:34:32","Sen_JoeManchin","Wishing the Charleston Daily Mail another 100 years of exceptional journalism. Happy anniversary @charleywest!",
"2014-04-03 ","21:23:24","Sen_JoeManchin","Congratulations @emcmillion on winning a 2014 Peabody Award for your extraordinary project, @hollowthefilm. http://t.co/Mx2wBn1mT6",
"2014-04-03 ","18:01:08","Sen_JoeManchin","Today we're one step closer to making sure our chemical facilities are appropriately monitored and inspected: http://t.co/2n83Cksc8g",
"2014-04-03 ","14:30:40","Sen_JoeManchin","Very proud of Paige for her efforts to save young lives in WV. Congrats on winning the No School Spirits PSA contest. http://t.co/JwxVuanCSg",
"2014-04-03 ","01:38:05","Sen_JoeManchin","Gayle &amp; I join all WVians in sending our thoughts and prayers to the Soldiers and families of the victims of today's shooting at Fort Hood.",
