"Date","Time","screen_name","text","hashtags"
"2012-12-14 ","01:30:47","SenatorAkaka","Senator Tom Harkin of Iowa pays tribute to Senator Akaka: http://t.co/l52qpZVx",
"2012-07-20 ","21:59:59","SenatorAkaka","AP: Akaka said native communities are disproportionately impacted because they depend on nature for food, sacred sites, &amp; for ceremonies.",
"2012-07-20 ","21:58:27","SenatorAkaka","AP on Indian Affairs hearing: ""Leaders say climate is changing Native way of life"" http://t.co/Pv0Ctywj",
"2012-05-21 ","19:03:12","SenatorAkaka","LIVE NOW CSPAN-3: Akaka subcommittee hearing on the shortage of foreign language speakers in the federal government. http://t.co/bVSuPkgC",
"2012-02-22 ","20:32:09","SenatorAkaka","Senators encourage FCC effort to make campaign advertisements more transparent http://t.co/GpGKygTF",
"2011-10-13 ","19:26:38","SenatorAkaka","Akaka holding hearing on ""Carcieri"" Crisis; effect on jobs, econ development & public safety in Indian Country.  Live: http://t.co/WXubp0Fy",
"2011-10-13 ","13:37:29","SenatorAkaka","Hawaii to receive more than $14 million for new buses and repairs. http://t.co/exBvRnvi @Daniel_Inouye @maziehirono @RepHanabusa",
"2011-09-07 ","22:17:20","SenatorAkaka","Hau`oli la hanau to my good friend @Daniel_Inouye.",
"2011-09-06 ","23:39:56","SenatorAkaka","Maui Now coverage: Akaka Urges Legislation to Prevent a Postal Shutdown http://t.co/4wV2hnZ",
"2011-09-06 ","23:37:02","SenatorAkaka","Akaka, Inouye support kama`aina businesswoman Patricia Loui's nomination to Export-Import Bank of the US: http://t.co/nqrnLGe",
"2011-09-06 ","23:35:03","SenatorAkaka","Hawaii to receive more than $5 million for airport repairs: http://t.co/oZYqVbV",
"2011-09-06 ","18:39:19","SenatorAkaka","Sen Akaka is introducing long-time friend Pat Loui at her confirmation hearing to the Board of the Export-Import Bank. http://t.co/Rh7J8xB",
"2011-09-06 ","18:26:58","SenatorAkaka","Live coverage of the hearing on the US Postal Service here: http://t.co/SRwgN8X",
"2011-09-06 ","18:19:24","SenatorAkaka","Sen Akaka is at a hearing on the financial crisis facing the US Postal Service, set to question Postmaster Donahue and OPM Director Barry",
"2012-09-27 ","14:59:23","Daniel_Inouye","#Hawaii to receive more than $4M to repair aircraft hangar and setup DUI checkpoints. http://t.co/Mn0iS7WV","Hawaii"
"2012-08-06 ","23:08:46","Daniel_Inouye","Senator Inouye enjoying the beef stew, poke and lau lau from Highway Inn in Waipahu http://t.co/wBDm8UsQ",
"2012-08-06 ","21:46:38","Daniel_Inouye","Senator Inouye speaking at the dedication of the @Hnl_Rail maintenance and storage facility. http://t.co/e4nF8Mg2",
"2012-08-06 ","20:20:54","Daniel_Inouye","Senator Inouye at the @Hnl_Rail columns with Kiewit workers and HART CEO Dan Grabauskas http://t.co/NTgQBEzK",
"2012-08-06 ","20:17:46","Daniel_Inouye","Senator Inouye and @Hnl_Rail HART CEO Dan Grabauskas at the rail columns in Kapolei http://t.co/WfeDPXhv",
"2012-08-06 ","19:45:59","Daniel_Inouye","Senator Inouye is spending the morning @Hnl_Rail columns with HART CEO Dan Grabauskas",
"2012-08-06 ","02:05:21","Daniel_Inouye","Senator Inouye is back home in #Honolulu","Honolulu"
"2012-07-20 ","20:06:08","Daniel_Inouye","""This is the first important step towards sovereignty for Native Hawaiians."" @SenatorAkaka http://t.co/RzULQ7an",
"2012-07-20 ","19:13:39","Daniel_Inouye","On behalf of the people of the state of HI, I extend my heartfelt condolences to the victims of the Colorado shooting http://t.co/ovYobjU8",
"2012-05-21 ","22:04:58","Daniel_Inouye","#Kauai and #Maui to receive $400K for storm cleanup. @SenatorAkaka @maziehirono @RepHanabusa http://t.co/tqxLKLbb","Kauai Maui"
"2012-05-21 ","19:28:01","Daniel_Inouye","Senator Inouye is meeting with 50 students from Kapolei Middle School in the U.S. Capitol",
"2012-05-20 ","19:44:22","Daniel_Inouye","TODAY at 4 p.m. #Hawaii time watch Senator Inouye being interviewed by @UHManoa journalism students on @K5theHomeTeam http://t.co/zB1MHceQ","Hawaii"
"2012-05-20 ","19:32:27","Daniel_Inouye","""Federal recognition is long overdue."" http://t.co/SBY7pfmD",
"2012-04-02 ","18:57:56","Daniel_Inouye","""The bill that the two angels of Washington, @US_Sen_Cantwell and @PattyMurray have come up with will....."" http://t.co/Af6MHOyn",
"2012-02-21 ","21:42:33","Daniel_Inouye","Senator Inouye speaking at the dedication of the @usnoaagov Pacific Regional Center. http://t.co/IkLGEoVA",
"2012-02-21 ","21:20:57","Daniel_Inouye","Senator Inouye and @maziehirono at the @usnoaagov Pacific Resource Center dedication at Ford Island http://t.co/iKYH8da1",
"2012-02-21 ","19:13:42","Daniel_Inouye","Senator Inouye and @usnoaagov administrator Dr. Jane Lubchenco at United Fishing Agency in #Hawaii http://t.co/ZbZx3BlF","Hawaii"
"2012-02-21 ","19:02:43","Daniel_Inouye","Senator Inouye is attending the morning fish auction at the United Fishing Agency in #Hawaii http://t.co/d5pzRkFQ","Hawaii"
"2012-02-21 ","18:23:42","Daniel_Inouye","Isles hold on to military might http://t.co/k1PpZmxt",
"2012-02-21 ","01:47:42","Daniel_Inouye","""I would say that the vast, vast majority of Americans try their best."" http://t.co/tcURLPME @JLin7",
"2011-09-07 ","23:44:56","Daniel_Inouye","Mahalo for all of your birthday wishes and kind words. I am humbled and very grateful for your continued support.",
"2011-09-07 ","23:11:01","Daniel_Inouye","Senator Inouye's opening statement from @SenateApprops markup. http://t.co/65QuYED",
"2011-09-07 ","19:19:33","Daniel_Inouye","Senator Inouye is chairing the full @SenateApprops committee as they markup three FY2012 spending bills. Energy/Homeland Security/Ag",
"2011-09-06 ","22:59:30","Daniel_Inouye","Hawaii to receive more than $5 million for airport repairs. http://t.co/koTWBs1  @SenatorAkaka @maziehirono @RepHanabusa #FAA","FAA"
"2011-09-06 ","18:39:34","Daniel_Inouye","WATCH Senator Inouye and @SenatorAkaka speak to the @SenateBanking committee about Pat Loui's nomination to @ExportGov board on @cspan 3.",
"2011-09-06 ","18:34:24","Daniel_Inouye","Sen Inouye introducing Pat Loui, nominee to the board of @ExportGov to Senate Banking @SenatorAkaka. http://t.co/C6k4u5W",
"2010-08-04 ","16:13:27","Daniel_Inouye","@BarackObama Hau'oli la Hānau Mr. President.",
"2010-08-03 ","16:18:07","Daniel_Inouye","Hawaii will receive $6.2 million to build an aircraft rescue and fire fighting building at Lanai Airport. http://bit.ly/b8GUhw",
"2009-11-30 ","21:30:56","Daniel_Inouye","Senator Inouye is meeting with Ambassador Sudjadnan Parnohadiningrat of Indonesia.",
"2009-11-06 ","00:15:03","Daniel_Inouye","Senate approves $74 million for commerce, justice and science initiatives in Hawaii. http://bit.ly/12UZCP",
"2016-09-23 ","18:44:42","maziehirono",".@SenSherrodBrown Thanks for sending over a note to welcome @SenGaryPeters. We're counting on @OhioStAthletics! https://t.co/GHQ1Fvquyx",
"2016-09-23 ","17:40:28","maziehirono",".@SenGaryPeters Hope you enjoyed your plate lunch! My Rainbow Warriors will get your Wolverines next time #GoBows https://t.co/0WtiMRsnUc","GoBows"
"2016-09-23 ","01:31:06","maziehirono","Today the Senate passed my &amp; @SenatorFischer's bill to equalize paid leave for vets who work for FAA &amp; TSA https://t.co/axBMoY2eRr",
"2016-07-07 ","18:55:50","maziehirono","Today, @louiseslaughter &amp; I introduced legislation to strengthen #TitleIX &amp; build on Patsy Mink's legacy https://t.co/39BRG6yvVb","TitleIX"
"2016-06-12 ","17:54:14","maziehirono","Sending aloha to Orlando today. My thoughts are with the victims &amp; loved one of this senseless act of violence",
"2016-02-25 ","21:05:42","maziehirono","ICYMI: Yesterday, I introduced a reso commemorating #DayofRemembrance &amp; saying #neveragain to xenophobia https://t.co/PT9jF1YWeF","DayofRemembrance neveragain"
"2015-12-03 ","17:07:22","maziehirono","My amdt creates stability for families using Pell &amp; ensures that it keeps up with the cost of college tuition https://t.co/dCHyGA68xy",
"2015-12-03 ","16:57:51","maziehirono","Almost half of all college students in the U.S. receive #PellGrants to help fund their education, including 23,000 in Hawaii","PellGrants"
"2015-12-03 ","16:53:50","maziehirono","This morning, I introduced an amendment to help familes afford college by strengthening #PellGrants https://t.co/dCHyGA68xy","PellGrants"
"2015-12-02 ","19:13:24","maziehirono","ICYMI: I joined several of my @SenateDems colleagues to defend Planned Parenthood's vital work #StandWithPP https://t.co/ckarKlLnsc","StandWithPP"
"2015-12-02 ","18:50:47","maziehirono","Having control over one's health care decisions is a fundamental right &amp; that's why I #StandWithPP https://t.co/pchoLzxT2j","StandWithPP"
"2015-12-02 ","17:43:01","maziehirono","Heading to the Senate Floor to #StandWithPP &amp; condemn these latest attacks on women's health","StandWithPP"
"2015-12-02 ","15:35:08","maziehirono","#OceanAcidification is a serious threat to our environment. Today's briefing with @OurOcean will raise awareness of this important issue","OceanAcidification"
"2015-10-31 ","00:46:51","maziehirono","The bipartisan budget agreement is a reasonable compromise &amp; avoids a disastrous default on our nation's debt https://t.co/oSoekEEcog",
"2015-07-17 ","18:17:41","maziehirono","This week, @SenJoniErnst &amp; I introduced legislation to help seniors access quality medical care http://t.co/oEKdsQX8B4",
"2015-07-16 ","18:50:33","maziehirono","The Every Child Achieves Act leaves behind harmful NCLB-era policies &amp; includes priorities for Hawaii students http://t.co/lkRPaHA0Wi",
"2015-06-18 ","15:04:11","maziehirono","At #HawaiiOnTheHill last week, @SenatorDurbin missed the HI grown papaya- glad we could remedy that this morning http://t.co/I8lwmSItfm","HawaiiOnTheHill"
"2015-06-17 ","22:05:08","maziehirono","Though 3 federal grants, HI orgs will be better able to preserve the sites and stories of Japanese Americans  http://t.co/ht0Ket7P4E",
"2015-06-17 ","21:55:37","maziehirono","Glad to join my friend @SenatorShaheen to try delicious donuts, ice cream, and more at #ExperienceNH http://t.co/B1E7FZkfGV","ExperienceNH"
"2015-06-17 ","15:46:41","maziehirono",".@SenatorReid, @SenDeanHeller &amp; I are fighting to protect the Filipino WWII Vets fund http://t.co/eVxyHQWAw2",
"2015-06-12 ","21:34:47","maziehirono","This Philippine Independence Day, we honor Hawaii's vibrant Filipino community &amp; Filipino vets who fought for the US http://t.co/cSKwA1ylJV",
"2015-06-11 ","23:50:07","maziehirono","Congratulations @HI_Volcanoes_NP on being recognized as a Federal Green Challenge Regional Winner by the @EPA. http://t.co/1pC5RkRR1E",
"2015-06-11 ","22:08:57","maziehirono","We pause today to honor King Kamehameha I, who united Hawaii and charted a vision for human rights http://t.co/G3UztNCX5o",
"2015-06-11 ","18:10:07","maziehirono","#HawaiiOnTheHill https://t.co/EGKBi5NQO4","HawaiiOnTheHill"
"2014-10-25 ","21:08:28","maziehirono","Urging affected Hawaii Island residents to be vigilant as evacuation notice is issued due to lava flow. Details here: http://t.co/P0Hk5PZhyL",
"2014-10-24 ","00:59:57","maziehirono","About six weeks left in #Medicare Open Enrollment!! Don’t delay!! Here are some great tips courtesy of @aarphawaii -- http://t.co/QJUnJfr9xe","Medicare"
"2014-04-03 ","22:06:36","maziehirono","Raising #minimumwage would allow 15,000 HI workers to stand on their own. Good for families #RaiseTheWage http://t.co/jqGMXW84mJ","minimumwage RaiseTheWage"
"2014-04-03 ","22:01:19","maziehirono","Ridiculous that avg rent in HI is more than what a full #minimumwage worker makes in a year. #RaiseTheWage http://t.co/jqGMXW84mJ","minimumwage RaiseTheWage"
"2014-04-03 ","22:00:26","maziehirono","Spoke about the need to #RaiseTheWage. 1 in 5 women in HI would get a raise if  #minimumwage = $10.10. http://t.co/jqGMXW84mJ","RaiseTheWage minimumwage"
"2014-04-03 ","20:09:02","maziehirono","Great to talk story w/ inspiring @runningstartDC Emerging Young Leader @brittanyamano. #instagram http://t.co/LwjCC77Ny7","instagram"
"2014-04-03 ","20:02:13","maziehirono","Great to see @brittanyamano &amp; @TulsiPress representing Hawaii at @runningstartDC #womentowatch awards","womentowatch"
"2014-04-03 ","20:00:43","maziehirono","Nice to join @KellyAyotte to accept @runningstartDC #womentowatch award on behalf of the 20 Senate women http://t.co/Dbb63AVbUX","womentowatch"
"2014-04-03 ","18:29:51","maziehirono","My mom raised our family on #minimumwage jobs, but it's harder today as the real $ value drops. That's why we must #RaiseTheWage","minimumwage RaiseTheWage"
"2014-04-03 ","18:24:36","maziehirono","Full-time #minimumwage worker makes $14K/year, which leaves families across Hawaii struggling. It's way past time to #RaiseTheWage","minimumwage RaiseTheWage"
"2014-04-03 ","18:17:16","maziehirono","More than 1/2 of #minimumwage workers are women working full-time. We must #RaiseTheWage http://t.co/x5Q6e5aLKG","minimumwage RaiseTheWage"
"2014-04-03 ","18:14:35","maziehirono","Raising #minimumwage to $10.10 would help families across the country, including more than than 100,000 in Hawaii. #RaiseTheWage","minimumwage RaiseTheWage"
"2014-04-03 ","15:45:47","maziehirono","@DearGirlProject my mom's example taught me that we can take risks and survive",
"2014-04-03 ","15:33:03","maziehirono","So proud of #RunningStart Emerging Young Leader Brittany Amano from Hawaii! https://t.co/FS7KzhUurO","RunningStart"
"2014-02-21 ","03:51:42","maziehirono","A warm mahalo @DeptVetAffairs &amp; @IHSHawaii for coming together to provide transitional housing for our vets in need. http://t.co/bT7DHeIdVy",
"2014-02-20 ","11:19:45","maziehirono","Kudos to @UPS driver Tommy Ayala for being accident free in Honolulu for 25 years &amp; earning spot in Circle of Honor! http://t.co/UPc2cW1kd9",
"2013-09-17 ","18:41:12","maziehirono","Happy Constitution Day http://t.co/QE85ZKcSv3",
"2013-09-17 ","15:09:39","maziehirono","#SpeakerBoehner - AAPIs demand immigration reform NOW with family reunification and path to citizenship! #AAPIs4CIR http://t.co/UBFb1pUpZI","SpeakerBoehner AAPIs4CIR"
"2013-09-16 ","16:50:58","maziehirono","My thoughts are with the Navy Yard workers &amp; first responders, their families &amp; all affected by the #NavyYardShooting","NavyYardShooting"
"2013-04-22 ","22:20:47","maziehirono","Happy Earth Day! Let’s recommit to protecting natural resources &amp; making communities more energy/food independent http://t.co/RR9X6PveLu",
"2013-03-14 ","23:23:41","maziehirono","I spoke on the Senate Floor today for the first time to stop efforts to cut alternative energy research http://t.co/ezrRIGvUy7",
"2013-03-14 ","21:21:44","maziehirono","Going to Senate floor to talk about why we shouldn't cut military's alternative energy research http://t.co/yoJPjHxsME",
"2013-03-14 ","18:24:22","maziehirono","Molokai’s Michael &amp; Waiakea’s Keagan are doing a great job representing Hawaii in  #USSYP Senate Youth Program http://t.co/kxRrdAxH5v","USSYP"
"2013-03-14 ","14:16:55","maziehirono","As we recognize MS Awareness Week, I’m supporting @mssociety #MSactivist friends in their fight to end multiple sclerosis","MSactivist"
"2013-03-13 ","22:13:19","maziehirono","These terrible incidents of rape &amp; violence in the military are very troubling. We must address this http://t.co/x7kEkVupJD #MSThearing","MSThearing"
"2012-09-28 ","21:46:29","maziehirono","Mahalo to @SmlBizMajority and everyone who joined our #smallbiz webinars yesterday and today. Good info on how to save $ on health care.","smallbiz"
"2012-09-28 ","17:20:04","maziehirono","Few slots left for today’s 8:30 am webinar on tax credits for #smallbiz under the new health care law. Register: http://t.co/CBmCVhuH","smallbiz"
"2012-09-27 ","23:15:50","maziehirono","16,300 HI #smallbiz can get tax credits under the new health care law. Join our webinar Fri at 8:30 am to learn how. http://t.co/CBmCVhuH","smallbiz"
"2012-09-27 ","20:11:27","maziehirono","Attn #smallbiz owners: room still available for Fri webinar on tax credits available under health care law. Sign up at http://t.co/CBmCVhuH","smallbiz"
"2012-09-27 ","20:07:53","maziehirono","Mahalo to everyone who joined today’s webinar on tax credits available for #smallbiz under the new health care law.","smallbiz"
"2012-09-27 ","18:21:48","maziehirono","Still a few slots open for our 8:30 webinar today on tax credits available for #smallbiz under the new health care law. http://t.co/CBmCVhuH","smallbiz"
"2012-07-20 ","23:40:03","maziehirono","Catholic Charities Hawaii is helping not only our vets and their families, they are helping to strengthen our communities. (8/8)",
"2012-07-20 ","23:39:52","maziehirono","By providing supportive services to help our #veterans transition to permanent housing, (7/8)","veterans"
"2012-07-20 ","23:39:38","maziehirono","This work serves those in #Oahu’s rural communities, including the Leeward coast, North Shore, and Windward coast. (6/8)","Oahu"
"2012-07-20 ","23:39:20","maziehirono","That’s why the @DeptVetAffairs’s support for Catholic Charities’ work to care for #Hawaii’s veterans is so important. (5/8)","Hawaii"
"2012-07-20 ","23:39:01","maziehirono","#Veteran #homelessness is a national tragedy; we need to work together to address the needs of American veterans and their families. (4/8)","Veteran homelessness"
"2012-07-20 ","23:38:37","maziehirono","Just as we must support our #veterans during deployment, it is essential that we help our veterans transition back to civilian life. (3/8)","veterans"
"2012-07-20 ","23:38:21","maziehirono","We, as a nation, must keep our commitments to those who have bravely sacrificed for our freedoms. (2/8)",
"2012-07-20 ","23:38:08","maziehirono","Congresswoman Hirono Urges Teamwork to Prevent #Veteran #Homelessness http://t.co/3XDKVB6K (1/8)","Veteran Homelessness"
"2012-07-20 ","18:52:41","maziehirono","My thoughts and condolences go out to the families of all the victims and hope justice will be served” (3/3)",
"2012-07-20 ","18:52:07","maziehirono","“I am truly saddened by the senseless act of violence in Colorado. It is particularly tragic that young victims were likely involved (2/3)",
"2012-07-20 ","18:51:47","maziehirono","Congresswoman Hirono Statement on Mass Shooting in #Aurora, Colorado http://t.co/B25jF0hb #theatershooting (1/3)","Aurora theatershooting"
