"Date","Time","screen_name","text","hashtags"
"2015-07-14 ","13:25:39","RepFitzpatrick","While I support all diplomatic efforts to promote peace &amp; cooperation, there is little reason to believe deal will halt Iran’s nuc. program",
"2015-07-14 ","13:24:47","RepFitzpatrick","I have deep concerns about the direction the Obama Administration has taken in reaching this agreement with #Iran.","Iran"
"2015-07-14 ","13:19:32","RepFitzpatrick","“I have deep concerns about the direction the Obama Administration has taken in reaching this agreement with Iran.... http://t.co/ibrh7dOLjD",
"2015-07-14 ","13:17:34","RepFitzpatrick","Fitzpatrick Statement on Announcement of Iran Nuclear Deal &gt;&gt;&gt; http://t.co/c0lMOUL2Ri http://t.co/mrhNTnrt50",
"2015-06-15 ","18:57:05","RepFitzpatrick","What can the #PhillyVARO learn from #Eagles coach Chip Kelly? http://t.co/ZeNp9Sw5rT http://t.co/xN4ZFUzELk","PhillyVARO Eagles"
"2015-06-15 ","16:39:26","RepFitzpatrick","Just wrapped up an inspection of the #PhillyVARO. To fix it's problems, leaders need to fix the culture: http://t.co/ZeNp9SNGQt","PhillyVARO"
"2015-06-09 ","22:00:01","RepFitzpatrick","Thanks to the team at Derbyshire Marine Products LLC for inviting me to take a tour of their operation in... http://t.co/AGETgGuqHQ",
"2015-06-09 ","13:28:43","RepFitzpatrick","A must read piece from Ukrainian Prime Minister Arseniy Yatsenyuk:

""Russian President Vladi­mir Putin wants us... http://t.co/asEO91GpVv",
"2014-10-22 ","21:30:02","RepFitzpatrick","Today I joined my colleagues Congressman Patrick Meehan, Congressman Charlie Dent and Congressman Chaka Fattah at... http://t.co/qp49dKPT5B",
"2014-05-21 ","23:00:02","RepFitzpatrick","Thanks for helping us hit 11k! It's an honor to represent you on #CapitolHill. http://t.co/hpZPkb3aLk","CapitolHill"
"2014-04-01 ","21:45:01","RepFitzpatrick","The #bipartisan 'Partnership to Build America Act' creates a large-scale #infrastructure financing capability... http://t.co/T3Nl3KnXJH","bipartisan infrastructure"
"2014-04-01 ","17:00:01","RepFitzpatrick","April is Sexual Assault Awareness Month. Stand with survivors and their families in speaking out against sexual... http://t.co/wycJN1sJzk",
"2014-04-01 ","12:00:02","RepFitzpatrick","ICYMI: Last week, I announced a new competition for #PA8 high school students.

Learn more about the... http://t.co/l1jlpYAV7F","PA8"
"2014-02-18 ","14:16:01","RepFitzpatrick","http://t.co/e3oMNGaxB4",
"2014-02-18 ","13:00:01","RepFitzpatrick","I’m glad President Obama acted swiftly to sign this legislation [S. 25] into law and offer a sense of stability... http://t.co/U182cUYin8",
"2013-09-14 ","19:40:49","RepFitzpatrick","Appreciate the opportunity to address the Doylestown Pilots Association earlier today. In addition to aviation,... http://t.co/gt4YN26ZPV",
"2013-09-14 ","14:00:02","RepFitzpatrick","I wrapped up my '50 Businesses, 50 Days' tour of Montgomery County yesterday with a stop at the Franconia Heritage... http://t.co/9bhghJyDQy",
"2016-09-21 ","21:04:22","RepBillShuster","Pleased to see Senate taking a step forward on this bill to help PA #miners. I’m a proud cosponsor in the House. 
https://t.co/xr6DQOvQcr","miners"
"2016-07-15 ","02:03:36","RepBillShuster","We stand shoulder to shoulder with our friend and ally France in the face of what appears to be another horrific act of terror. #NiceFrance","NiceFrance"
"2016-07-05 ","20:44:13","RepBillShuster","#HillaryClinton “extremely careless” in words of director of the @FBI. Well connected DC insiders like Hillary should not be above the law.","HillaryClinton"
"2016-02-23 ","21:22:01","RepBillShuster","Obama has been trying to transfer terrorists to the US for 7 yrs. You better believe I will continue to fight this. 
https://t.co/e1248x0iLM",
"2015-11-30 ","18:26:11","RepBillShuster","Best of luck to all our #hunters and happy opening day! Did you go #hunting today? How did you do? #deerhunting","hunters hunting deerhunting"
"2015-11-25 ","16:03:25","RepBillShuster","Obama's decisions in the #MiddleEast have been timid, half-hearted, and done little to solve a serious situation. https://t.co/3bFZq29sM5","MiddleEast"
"2015-10-29 ","16:10:36","RepBillShuster","Passing a multi-year #highway bill will benefit our economy &amp; strengthen our transport network which is good for PA. https://t.co/uWs8RGSWgL","highway"
"2015-09-29 ","22:00:50","RepBillShuster","Today I helped pass legislation that empowers states to help halt #PlannedParenthood's sale of fetal body parts. http://t.co/EHaVNwCgzc","PlannedParenthood"
"2015-09-29 ","14:25:29","RepBillShuster","Right now the House is holding a hearing to examine the use of taxpayer funding by #PlannedParenthood. Watch live: https://t.co/Xpi2urAhm9","PlannedParenthood"
"2015-09-29 ","12:37:56","RepBillShuster","If we have vets in need of work, let’s offer them good-paying jobs with Border Patrol. Proud to vote for the Border Jobs for #Veterans Act.","Veterans"
"2015-07-14 ","21:55:03","RepBillShuster","Proud to vote for the #Veterans Entrepreneurship Act yesterday to help vets start new businesses and provide them better access to capital.","Veterans"
"2015-07-14 ","18:56:22","RepBillShuster","My statement on the #IranDeal: http://t.co/OYpWnvRWcZ","IranDeal"
"2015-06-15 ","23:10:04","RepBillShuster","Tonight the House passed H. Res 233 which expresses the sense of the House that Iran should immediately release the 3 US citizens it holds.",
"2015-06-15 ","17:02:35","RepBillShuster","Today I will be announcing plans to modernize and reform the @FAANews.
Read more : http://t.co/OrLsKw9kHD #FAA","FAA"
"2015-06-09 ","18:38:43","RepBillShuster","Was happy to support amndmnt to FY16 CJS Approps to prohibit use of funds to treat common #ammo as armor piercing + protect our #2A rights.","ammo 2A"
"2014-10-22 ","21:03:35","RepBillShuster","Very saddened by what happened in Ottawa. #Canada is one of our closest allies, and my prayers go out to everyone affected by this attack.","Canada"
"2014-10-22 ","18:08:02","RepBillShuster","High-ranking Democrats from all backgrounds are concerned about Obama’s weak foreign policy. I share that concern. http://t.co/vjis8jSGeg",
"2014-05-21 ","23:58:03","RepBillShuster","I voted tonight to give the Sec. of the Dept. of Veterans Affairs the power to remove senior employees whose behavior warrants it.",
"2014-04-01 ","20:56:22","RepBillShuster","Proud to be on the list to protect seniors MT @ProtectmyMA 262 in Congress told CMS to protect Medicare Advantage. http://t.co/RcBMT0qCPv",
"2014-04-01 ","17:24:08","RepBillShuster","You can delay it all you want, Mr. President, but the glitches in #Obamacare go far beyond the website. http://t.co/7b06Q4Zh3Z","Obamacare"
"2013-07-24 ","19:44:45","RepBillShuster","It's time for Obama to focus more on #jobs and less on speeches that sell his shortsighted vision for our economy. http://t.co/iUR3IsVNNW","jobs"
"2013-07-24 ","18:21:44","RepBillShuster","Since Obama Took Office, we have lost 592,000 manufacturing jobs. #Numbersdontlie #SpeechesDontHire","Numbersdontlie SpeechesDontHire"
"2013-07-24 ","17:36:27","RepBillShuster","Numbers don't lie, and #SpeechesDontHire: since the President took office, we have lost 742,000 construction jobs.","SpeechesDontHire"
"2013-07-24 ","14:34:29","RepBillShuster","Just a reminder, my staff will be at the Brownsville Borough Building TODAY from 11am to 1pm. Be sure to stop by! http://t.co/d3MN3ygBPU",
"2013-06-05 ","19:18:32","RepBillShuster","My bill HR 2125, the No IRS Implementation of Obamacare Act, is building support. Click on the link below and... http://t.co/cswFjXlPd9",
"2013-06-05 ","16:38:05","RepBillShuster","Yesterday's testimony reminds us why the IRS can't be trusted, why we need HR 2125 to stop their plans for Obamacare. http://t.co/um2z6Zn0CX",
"2013-04-19 ","17:47:56","RepBillShuster","I posted 5 photos on Facebook in the album ""Conversations with the Chair"" http://t.co/mf2zRm9NpD",
"2011-01-12 ","22:42:16","RepBillShuster","I uploaded a YouTube video -- Remarks Honoring Rep. Giffords and the Victims of the Ari... http://youtu.be/jzbo9T0uRsA?a",
"2011-01-12 ","21:51:31","RepBillShuster","Watch my remarks honoring Rep. Giffords and the victims of the Arizona shooting on the #House floor today http://tinyurl.com/4spkg4v","House"
"2011-01-12 ","21:24:31","RepBillShuster","Today, I met with Georgian President Mikheil Saakashvili to discuss bilateral relations between our two nations. http://fb.me/HU98rEcW",
"2011-01-12 ","19:04:48","RepBillShuster","I will be speaking shortly on the Resolution honoring the victims of the AZ shooting.  Tune to #CSPAN to watch.","CSPAN"
"2011-01-12 ","15:09:10","RepBillShuster","The House is now taking up the Resolution to honor the lives lost and those wounded in the Tucson shooting.  I... http://fb.me/IfIvfrzA",
"2011-01-11 ","18:44:49","RepBillShuster","Be careful out there today on the roads. http://fb.me/PFku5twr",
"2011-01-11 ","18:44:12","RepBillShuster","Be careful driving out today. http://fb.me/JuV9fSTe",
"2011-01-10 ","16:35:20","RepBillShuster","I agree @RoyBlunt that we cannot let this senseless tragedy keep elected officials from doing our jobs & meeting the people we represent.",
"2011-01-10 ","15:23:23","RepBillShuster","Monday follow:  Welcome @repjefflandry to the House of Representatives by following him on Twitter.",
"2011-01-10 ","14:50:12","RepBillShuster","I hope you will join me, my colleagues and the nation in a moment of silence at 11:00am in honor of the victims of Saturday's tragic events.",
"2011-01-08 ","19:47:12","RepBillShuster","Reports that Rep. Giffords is in critical condition - please keep her in your prayers.",
"2011-01-08 ","19:08:39","RepBillShuster","My thoughts and prayers are with Rep. Gabrielle Giffords, her staff and everyone involved in today's tragic shooting in Arizona.",
"2011-01-08 ","19:01:03","RepBillShuster","My thoughts and prayers are with Rep. Giffords, her staff and everyone impacted by today's tragic shooting http://tinyurl.com/2g83psd",
"2011-01-06 ","17:36:36","RepBillShuster","House has moved into debate on cutting House of Rep. budgets by 5%",
"2011-01-06 ","16:08:46","RepBillShuster","The House is reading the Constitution now.  Watch it Live on #CSPAN","CSPAN"
"2011-01-06 ","15:12:19","RepBillShuster","For those of you with access to C-Span 2, they are broadcasting the Rules Committee meeting on the House GOP bill... http://fb.me/RK8jcuEI",
"2011-01-06 ","14:23:54","RepBillShuster","To prepare for this morning's reading of the Constitution, here is the full text from the National Archives. http://fb.me/NApypcSF",
"2011-01-06 ","14:17:51","RepBillShuster","At 11:00am this morning, Speaker Boehner and Majority Leader Cantor will lead the House in reading the... http://fb.me/OMrw8OZH",
"2011-01-06 ","00:07:06","RepBillShuster","My ceremonial swearing-in with Speaker John Boehner. http://fb.me/RQ6YLo2L",
"2009-11-03 ","21:14:46","RepBillShuster","Just how large is Pelosi's healthcare bill?  A size comparison here: http://tinyurl.com/yjvavg8 #TCOT @gopconference #GOP @redstate","TCOT GOP"
"2009-11-03 ","20:07:11","RepBillShuster","Will be going to the House floor in a few minutes to deliver a 1 min. speech on healthcare reform.  Tune in @cspan #TCOT #GOP @gopconference","TCOT GOP"
"2009-11-03 ","19:58:59","RepBillShuster","RT @GOPLeader Section 413: A New 8% Payroll Tax on Employers and Employees http://amplify.com/u/sdm",
"2009-11-03 ","19:07:09","RepBillShuster","http://amplify.com/u/sp5",
"2009-11-03 ","17:57:17","RepBillShuster","House GOP unveils new healthcare website http://amplify.com/u/sof",
"2009-11-03 ","17:49:33","RepBillShuster","House Republicans unveil new website on healthcare reform: http://healthcaretruth.amplify.com/ #GOP @gopconference #TCOT","GOP TCOT"
"2016-09-21 ","21:55:14","MikeKellyPA","Today I said farewell to my dedicated sr. legislative assistant, Jeff Rein. Thanks for 5 years of service to the people of #PA03! Godspeed! https://t.co/SW65jGQTUM","PA03"
"2016-07-15 ","20:59:36","MikeKellyPA","ICYMI — Video of my floor speech earlier this week in support of the Conscience Protection Act: https://t.co/icwmI7mOYr #1A","1A"
"2016-07-15 ","00:18:27","MikeKellyPA","Praying for #France right now. Praying for peace, for safety, for resolve, for courage, for strength to end this evil forever. #PrayForNice","France PrayForNice"
"2016-07-05 ","20:49:41","MikeKellyPA","The House GOP tax reform plan will raise GDP by 9.1%, lift wages by 7.7%, and add some 1.7 million jobs. https://t.co/xPjVLCWTM3 #BetterWay","BetterWay"
"2016-07-05 ","20:38:24","MikeKellyPA","We now know that our former Sec of State was ""extremely careless"" (FBI's words) in her handling of Top Secret info. Shameful &amp; outrageous.",
"2016-07-05 ","17:48:05","MikeKellyPA","Proud to be part of the hearing that got results (and $$ back) for innocent American wrongly targeted by the #IRS. https://t.co/v2jYAAGhiQ","IRS"
"2016-07-05 ","03:31:09","MikeKellyPA","Good night, and God bless America! #Freedom #4thOfJuly #IndependenceDay https://t.co/QuEJnl05ZF","Freedom 4thOfJuly IndependenceDay"
"2016-06-10 ","20:56:49","MikeKellyPA","Who gets hurt the most by Pres. Obama's taxes on American energy? Everyday hardworking Americans, of course. VIDEO: https://t.co/wIoEnEiAxf",
"2016-06-10 ","19:08:10","MikeKellyPA","ICYMI — @POLITICO piece spotlights my new bill, the Public Buildings #RenewalAct, to help repair America's schools: https://t.co/nvQPkYodty","RenewalAct"
"2016-06-10 ","19:01:28","MikeKellyPA","Proud to speak out against President Obama's unfair &amp; ideologically driven tax proposals on American energy. VIDEO: https://t.co/wIoEnEiAxf",
"2016-06-10 ","15:54:15","MikeKellyPA","Thank you! https://t.co/PX1Kfruvzv",
"2016-02-23 ","23:54:41","MikeKellyPA","Very glad to join @SpeakerRyan at today's signing ceremony for the bipartisan customs bill to help American workers. https://t.co/0auFSvC3Bu",
"2016-02-23 ","19:43:42","MikeKellyPA","@fairlyspiritual Bills to combat human trafficking, prevent veteran suicides, and expand free trade, + 9 tax bills: https://t.co/uM3vLbXYzR",
"2016-02-23 ","19:01:15","MikeKellyPA","POTUS's plan to shut down #Gitmo is a non-starter. Congress will not sacrifice national security for the sake of one man's campaign promise.","Gitmo"
"2015-11-30 ","20:31:26","MikeKellyPA","Sometimes a picture says it all. https://t.co/eU2O62apBe #ParisClimateConference #COP21 #ISIS https://t.co/o1fgUCBYOp","ParisClimateConference COP21 ISIS"
"2015-11-30 ","19:32:39","MikeKellyPA","Pres. Obama says #ParisClimateConference will be a ""powerful rebuke"" to #ISIS terrorists. A more powerful rebuke? Deadly American-led force.","ParisClimateConference ISIS"
"2015-11-30 ","17:50:24","MikeKellyPA","Any deal POTUS strikes at #ParisClimateConference must first be sent to US Senate. Mine &amp; @SenMikeLee's resolution: https://t.co/t28AMuojFc","ParisClimateConference"
"2015-10-29 ","18:24:55","MikeKellyPA","Proud to introduce bipartisan Historic Tax Credit Improvement Act w/@RepBlumenauer: https://t.co/e5Ge1xmjIf #PA03 #PA #PreserveHistory","PA03 PA PreserveHistory"
"2015-10-29 ","16:56:59","MikeKellyPA","Congratulations to my friend, @SpeakerRyan — the right kind of Speaker we need right now; a conservative leader who will unite our team.",
"2015-09-29 ","22:59:34","MikeKellyPA","Here's the bipartisan letter I sent @USTradeRep today, w/44 co-signers, urging an open US sugar market in #TPP: http://t.co/wpeFUCNrZ3","TPP"
"2015-07-14 ","21:13:01","MikeKellyPA","Congress must do everything in our power to defeat the #IranDeal and deny #Iran a victory the world cannot afford. http://t.co/KB7WzDtYUu","IranDeal Iran"
"2015-07-14 ","21:05:54","MikeKellyPA","Obama's #IranDeal leaves #Iran newly emboldened, wrongly legitimized, and ominously free to keep sponsoring terror. http://t.co/KB7WzDtYUu","IranDeal Iran"
"2015-07-14 ","20:54:52","MikeKellyPA","My official statement on the Obama admin's #IranDeal — a dangerous mistake of potentially historic proportions: http://t.co/KB7WzDtYUu #Iran","IranDeal Iran"
"2015-07-14 ","18:05:38","MikeKellyPA","An extremely dark &amp; disturbing revelation, and a reminder of why we fight to #DefendLife: http://t.co/vw0vsnsCZB #PlannedParenthood #ProLife","DefendLife PlannedParenthood ProLife"
"2015-06-09 ","19:26:31","MikeKellyPA","The truth must be told about how #TPA empowers Congress to secure the strongest trade deals for America. #TPA4USjobs http://t.co/qRPhput9eh","TPA TPA4USjobs"
"2014-05-21 ","23:01:06","MikeKellyPA","Proud to support bill to hold VA officials accountable for failing our nation's #veterans. VIDEO of my floor speech: https://t.co/MMyPn9U9cu","veterans"
"2014-05-21 ","15:59:35","MikeKellyPA","The #VA is failing “to care for him who shall have borne the battle” (Lincoln). Our #veterans deserve better! #PJNET http://t.co/XZOgkbpZqA","VA veterans PJNET"
"2014-04-01 ","22:00:47","MikeKellyPA","ICYMI: ""How to Save the Internet"" http://t.co/6PGFqHxHH0 via @WSJ House action on the way!",
"2014-04-01 ","21:56:14","MikeKellyPA","If #Obamacare has cut your hours, I want to hear #YourStory: http://t.co/PvQja3SQRf #SaveAmericanWorkers Act on the floor this week! #HR2575","Obamacare YourStory SaveAmericanWorkers HR2575"
"2014-04-01 ","20:12:04","MikeKellyPA","Obama's #ImperialPresidency demands continued vigilance in fight to stop tax $$ from ever funding the #UNATT. http://t.co/sEcHLyOcwk #UN #2A","ImperialPresidency UNATT UN 2A"
"2014-04-01 ","19:40:20","MikeKellyPA","Under #Reagan: ""Peace thru strength;"" Under #Obama: ""strength thru reluctance."" My latest op-ed explains difference: http://t.co/FTavm1ZNau","Reagan Obama"
"2014-04-01 ","18:12:38","MikeKellyPA","Obama believes that by retreating from the world, peace will somehow follow. Just one glance abroad proves otherwise. http://t.co/FTavm1ZNau",
"2014-04-01 ","17:39:14","MikeKellyPA","The ban on taxpayer funding of the #UNATT must continue beyond 2014. Read my letters to 4 subcommittees here: http://t.co/sEcHLyOcwk #UN #2A","UNATT UN 2A"
"2014-02-18 ","02:59:37","MikeKellyPA","I hope everyone in Western #PA and across our great country had a happy &amp; safe President's Day weekend! #PA03 http://t.co/C0TFUqL1Mq","PA PA03"
"2013-07-24 ","22:01:05","MikeKellyPA","Earlier today, #HR2579 was approved by House Oversight Committee. Crucial step to gov't accountability. http://t.co/q5eRSnpqzt #RestoreTrust","HR2579 RestoreTrust"
"2013-07-24 ","18:49:08","MikeKellyPA","Very glad to see House Approps Committee approve ban on funding for #UN Arms Trade Treaty. http://t.co/OCr6ArXMyk #2A #Sovereignty #UNATT","UN 2A Sovereignty UNATT"
"2013-07-24 ","18:22:25","MikeKellyPA","#Obamacare’s looming rate shock…not exactly #ABetterBargain, Mr. President. http://t.co/wSqGRrazjh Time for #repeal. #SpeechesDontHire #jobs","Obamacare ABetterBargain repeal SpeechesDontHire jobs"
"2013-07-24 ","17:28:35","MikeKellyPA","Not likely to be heard in POTUS's speech today: Obamacare is killing #jobs and hurting families http://t.co/lXNUS1uMyP #SpeechesDontHire","jobs SpeechesDontHire"
"2013-07-24 ","17:24:22","MikeKellyPA","Fact: Since Pres Obama took office, USA has lost 592k manufacturing #jobs &amp; 742k construction #jobs http://t.co/XTiD2vbBcM #SpeechesDontHire","jobs jobs SpeechesDontHire"
"2013-06-05 ","16:46:57","MikeKellyPA","Gov-sponsored #fear cannot win. Share your #IRS abuse story here: http://t.co/jEzGDyyjiD Major corruption calls for major action. #taxreform","fear IRS taxreform"
"2013-06-05 ","15:27:00","MikeKellyPA","Americans should be able to trust &amp; have faith that the tax code will treat them fairly -- NOT live in fear of #IRS. http://t.co/yWDOJmGQ9q","IRS"
"2016-09-21 ","21:08:46","CongressmanGT","House Approves Thompson Special Needs Trust Fairness and Medicaid Improvement Act
 https://t.co/X23z51Zp0E",
"2016-09-21 ","19:08:52","CongressmanGT","Attending the Capital Statue Dedication of Thomas Alva Edison",
"2016-09-21 ","15:45:56","CongressmanGT","On Floor to recognize the 8 day, 2,000 mile #Fireballrun road rally that will pass through #PA05 raising awareness for missing children.","Fireballrun PA05"
"2016-09-21 ","14:09:14","CongressmanGT","In #Education &amp; #Workforce Subcommittee hearing on ""Supplanting the Law and Local Education Authority Through Regulatory Fiat.""","Education Workforce"
"2016-07-15 ","22:23:38","CongressmanGT","Thompson Supported Bill to Fight Opioid and Heroin Epidemic Heads to President’s Desk  https://t.co/np05bWyooA",
"2016-06-10 ","12:47:48","CongressmanGT","On Floor recognizing effort of #Pennsylvania State Rep Matt Baker #TiogaCounty for legislative #leadership addressing #OpioidEpidemic  #PA05","Pennsylvania TiogaCounty leadership OpioidEpidemic PA05"
"2015-11-25 ","17:22:47","CongressmanGT","Factcheck: #ESEA Reauthorization passes 39-1 in Conference Committee &amp; ENDS Obama Administration #CommonCore mandate #NCLBreform #education","ESEA CommonCore NCLBreform education"
"2015-11-25 ","17:11:58","CongressmanGT","Thank you to the #Manufacturers who attended to the #Manufacturing in Our Region #Industry Luncheon yesterday #IRC https://t.co/XAIDB9Mj7S","Manufacturers Manufacturing Industry IRC"
"2015-10-29 ","22:14:01","CongressmanGT","""Fewer plans to be on biggest Obamacare exchange in 2016"" Fewer choices /Bigger monopolies /Higher costs = Obamacare https://t.co/nC8F92CWLK",
"2015-10-29 ","22:06:41","CongressmanGT","Vets still struggle to get mental health care at VA.  Exactly why Congress should pass the VETS Act! #telemedicine  https://t.co/q20jKMGwxz","telemedicine"
"2015-10-29 ","15:33:17","CongressmanGT","The House has found it's voice today.  Congratulations #SpeakerRyan https://t.co/qz3y1wRY5i","SpeakerRyan"
"2015-09-29 ","15:40:08","CongressmanGT","Appreciate the opportunity to meet Togo President Faure Gnassingbe today.  Thank you to #CapitalMinistries for hosting","CapitalMinistries"
"2015-09-29 ","14:46:13","CongressmanGT","In #Ag #Biotechnology, #Horticulture &amp; #Research hearing highlighting research innovations by nation’s agricultural colleges &amp; universities","Ag Biotechnology Horticulture Research"
"2015-09-29 ","14:28:30","CongressmanGT","On Floor to honor #PA05 #FFA teams placing 1st &amp; 2nd at national competition.  Congrats to #Bellefonte &amp; #CPI!  Great job Future #Farmers","PA05 FFA Bellefonte CPI Farmers"
"2015-09-29 ","14:24:22","CongressmanGT","Introduced #CTE #Career #Technical #Education Caucus Briefing on #Boeing #Apprenticeship #workforcedevelopment program #jobs #jobtraining","CTE Career Technical Education Boeing Apprenticeship workforcedevelopment jobs jobtraining"
"2015-09-29 ","14:10:46","CongressmanGT","Great early start to the day on both #FLN #Family Life Network &amp; #WCED #ClearfieldCounty radio this AM.","FLN Family WCED ClearfieldCounty"
"2015-07-14 ","15:02:55","CongressmanGT","In #Energy &amp; Mineral Resources Oversight Hearing “The Fundamental Role of Safe #Seismic Surveying in #OCS Energy Exploration &amp; Development.”","Energy Seismic OCS"
"2015-07-14 ","13:52:26","CongressmanGT","On Floor to congratulate the 49th Central #Pennsylvania #Festival of the #Arts attended by more than 125,000 this past weekend. #artsfest","Pennsylvania Festival Arts artsfest"
"2015-06-15 ","23:15:34","CongressmanGT","On Floor recognizing Susan Gibson Perry/Sherri Huston Schulze #Bradford Oil Field Yellow Dog Award recipients 4 preserving #oilfield history","Bradford oilfield"
"2015-06-15 ","16:26:01","CongressmanGT","Spoke this AM at the #Pennsylvania #Aggregates &amp; #Concrete Association #PACA Summer Summit Kick-Off #Transportation #wotus #EAS #NLEB #NLRB","Pennsylvania Aggregates Concrete PACA Transportation wotus EAS NLEB NLRB"
"2015-06-15 ","16:17:00","CongressmanGT","Honored to speak last PM in #OilCity #VenangoCounty at French Creek #BSA Council Troop 17 #Flag Retirement Ceremony #FlagDay2015 #OldGlory","OilCity VenangoCounty BSA Flag FlagDay2015 OldGlory"
"2015-06-09 ","20:39:12","CongressmanGT","My bill, the @NationalForests Foundation Reauthorization Act of 2015, just passed the House by voice vote http://t.co/1m67dADWT1",
"2015-06-09 ","19:18:25","CongressmanGT","On Floor managing HR 2394 National Forest Foundation Reauthorization Act that leverages private &amp; federal dollars for #nationalforest health","nationalforest"
"2015-06-09 ","14:48:54","CongressmanGT","In #Tidioute #WarrenCounty last PM to say goodbye to a good friend &amp; #Scouter Kevin Bonner. Thoughts &amp; prayers are with Beth, Dan &amp; Brian.","Tidioute WarrenCounty Scouter"
