"Date","Time","screen_name","text","hashtags"
"2015-09-29 ","16:41:48","RepJimCosta","As we celebrate the @NEHgov, let's also recognize @ucmerced for encouraging students to explore the arts, music, and literature.#NEHturns50","NEHturns50"
"2015-07-14 ","18:46:33","RepJimCosta","In order to help more Americans #MakeItInAmerica, we need to spur innovation &amp; job creation #MIIAWhatsNext","MakeItInAmerica MIIAWhatsNext"
"2015-07-14 ","16:55:13","RepJimCosta","In Ex-Im Bank's 81-year history, it has been reauthorized 16 times, with huge bipartisan majorities. Congress must pass #ExIm4Jobs!","ExIm4Jobs"
"2014-04-01 ","19:54:26","RepJimCosta","Have questions for me &amp; members of @HispanicCaucus? Join us tomorrow morning for a live @facebook Q&amp;A! http://t.co/rr0MJm6rJF",
"2014-02-18 ","22:13:37","RepJimCosta","Apparently it is National Drink Wine Day. Who is enjoying one of California's finest? @RepThompson ?",
"2014-02-18 ","19:17:29","RepJimCosta","Take a look at this @WhiteHouse recap of the President's visit to our Valley: http://t.co/s0Jz7XoBx0 #cawater #drought","cawater drought"
"2014-02-18 ","16:43:43","RepJimCosta","Sad to hear about the loss of some of CA's finest. Thoughts &amp; prayers to the family &amp; friends of #CHP Officers Juan Gonzalez &amp; Brian Law.","CHP"
"2013-07-24 ","20:50:46","RepJimCosta","@WashKastles Thrilled to have you all!",
"2013-06-05 ","21:02:19","RepJimCosta","Checking in on @SoloFlight2013 who is trying to become youngest person to fly solo around the world. Proud of you! http://t.co/t0ZYFzsOEP",
"2013-06-05 ","17:50:07","RepJimCosta","#StudentDebt has passed $1 trillion. We should be working to slow &amp; reduce debt, not adding barriers to a degree. http://t.co/VZXVPULT6I","StudentDebt"
"2013-03-11 ","19:45:10","RepJimCosta","Honored to participate in the dedication of the Foster Farms Poultry Education &amp; Research Facility @Fresno_State http://t.co/iJ8tGFtlyk",
"2012-12-12 ","20:51:02","RepJimCosta","Small businesses &amp; families need Congress to act before the holidays to avoid a middle class tax increase. #DoTheRightThing #FiscalCliff","DoTheRightThing FiscalCliff"
"2012-12-12 ","19:53:09","RepJimCosta","Meeting w/ @RepJeffDenham to discuss advancing Valley interests in the next Congress.  #bipartisanship http://t.co/bHVhHXxT","bipartisanship"
"2012-12-12 ","17:32:10","RepJimCosta","While we deal w/ #FiscalCliff, Congress must #DoTheRightThing: protect small businesses &amp; middle class from a tax increase.","FiscalCliff DoTheRightThing"
"2012-09-25 ","15:57:19","RepJimCosta","It's National Voter Registration Day. CA registration goes until Oct 22. RT To make sure your friends &amp; fam make their voices heard #925NVRD","925NVRD"
"2012-07-18 ","17:25:42","RepJimCosta","Farmers need certainty only a #FarmBill can give. House Leadership must bring it up for a vote immediately. Video: http://t.co/w6ebRVYO","FarmBill"
"2012-07-18 ","15:04:52","RepJimCosta","@FresnoBee on my bipartisan bill to expand #Yosemite: Does size matter? Yosemite National Park advocates think it might http://t.co/2jOsUpUv","Yosemite"
"2011-01-13 ","21:17:55","RepCardoza","Homeowners who need emergency assistance, please apply as soon as possible.  Read my press release fro more info: http://bit.ly/fjBhZq",
"2011-01-10 ","20:53:05","RepCardoza","I will be relocating my Stockton District Office to better provide service to my constituents.  Read the release here: http://bit.ly/eKlbMl",
"2011-01-06 ","19:50:06","RepCardoza","As part of my commitment to fiscal responsibility, today I voted to reduce Congress’ budget by 5 percent.",
"2011-01-06 ","17:09:37","RepCardoza","This week, I introduced legislation targeting political corruption.  Read my release here: http://bit.ly/hyrMAM",
"2016-06-10 ","18:15:55","RepZoeLofgren","42 million+ Americans are celebrating #ImmigrantHeritageMonth in June. Take part by telling your #ImmigrationStoryIn5Words!","ImmigrantHeritageMonth ImmigrationStoryIn5Words"
"2016-06-10 ","16:44:29","RepZoeLofgren","this election season there is no limit to racial invectives House Rs will hurl in pursuit of dehumanizing and vilifying immigrant community",
"2016-06-10 ","16:31:02","RepZoeLofgren","Like “illegal alien,” the Library of Congress has also stopped using terms like “negro” and “crippled”. But Congress didn’t interfere then",
"2016-06-10 ","16:22:55","RepZoeLofgren","Attacking immigrants, Muslims, &amp; judges weren’t enough; #GOP now taking feud to librarians, forcing outdated, insulting “illegal alien” term","GOP"
"2016-02-18 ","00:03:56","RepZoeLofgren","Ordering Apple to create a back door using the 'All Writs Act' is an astonishing overreach of authority by fed gov: https://t.co/kbhweWwOSg",
"2015-10-29 ","20:48:22","RepZoeLofgren","California Democrats are urging @CMSGov for timely and full renewal of the State's Medi-Cal waiver https://t.co/gkYE9bPcTf",
"2015-10-29 ","19:37:27","RepZoeLofgren","House Democrats seek answers &amp; solutions to “confounding” Visa Bulletin revision https://t.co/A4ltJyTDxA",
"2015-10-29 ","18:28:48","RepZoeLofgren","1/3 retirees lives on about $1300/month. In my district, that’s not enough. We should expand #SocialSecurity &amp; increase retirement security","SocialSecurity"
"2015-10-29 ","18:16:54","RepZoeLofgren","Proud to join @HouseDemocrats in committing to protect &amp; expand #SocialSecurity","SocialSecurity"
"2015-09-29 ","16:04:27","RepZoeLofgren","New federal funds for Downtown College Prep http://t.co/63lxT0Aqgy",
"2015-07-14 ","16:40:27","RepZoeLofgren","Troubling horror stories from the medical ward of a Texas immigration family detention center: http://t.co/8868Oxhjcr",
"2015-07-14 ","16:34:43","RepZoeLofgren","Release of detained families an encouraging step, but family detention in its current form must end http://t.co/PjXc6vBgo7",
"2015-06-15 ","19:51:18","RepZoeLofgren","If DACA and DAPA take effect in CA, approximately 9,500 jobs will be created every year for the next 10 years #DACAworks","DACAworks"
"2015-06-15 ","19:48:33","RepZoeLofgren","California's GDP would increase by $75.8 over 10 years if #DACA and #DAPA were implemented.  #DACAworks","DACA DAPA DACAworks"
"2015-06-15 ","18:58:42","RepZoeLofgren","640,000 young people are contributing to our economy and strengthening our country today because #DACAworks","DACAworks"
"2014-05-21 ","20:57:27","RepZoeLofgren","#USAFreedomAct is now cause for concern-It's ironic a bill intended to increase transparency was changed in secrecy http://t.co/IsRChIPuKc","USAFreedomAct"
"2014-04-01 ","23:33:00","RepZoeLofgren","Great seeing students from Morgan Hill's Britton Middle School visiting DC this week-got them in to see Congress vote http://t.co/U7IJaaOJvR",
"2013-07-24 ","21:24:24","RepZoeLofgren","@JimiK_Says I'm supporting it and urging my colleagues to support it too. Here's why: http://t.co/c10K8zWAQS",
"2013-07-24 ","20:13:10","RepZoeLofgren","@twrling @DevinNunes @LoisCapps @BuckMcKeon I support #AmashConyers amendent &amp; urge my colleagues to do the same: http://t.co/c10K8zWAQS","AmashConyers"
"2013-07-24 ","19:34:59","RepZoeLofgren","I'm urging support for #AmashConyers amendment to stop #NSA surveillance of Americans @repjustinamash @repjohnconyers http://t.co/c10K8zWAQS","AmashConyers NSA"
"2013-07-24 ","18:41:50","RepZoeLofgren","Education, good jobs, innovative economy w/opportunities for working &amp; middle class families to pursue the American Dream is #ABetterBargain","ABetterBargain"
"2013-07-24 ","17:12:43","RepZoeLofgren","@davidli19 it was nice meeting you, thanks for sharing the pic!",
"2013-07-24 ","01:16:31","RepZoeLofgren","DREAMers @ #immigration hearing said they&amp;their families want to be as American on paper as they are in their hearts http://t.co/jdS2rXSYnY","immigration"
"2013-07-24 ","00:43:34","RepZoeLofgren","Great meeting today w/ @WomensHighTech Coalition to talk about #STEM &amp; #highskilled #immigration to boost our country http://t.co/ocrC8LokmB","STEM highskilled immigration"
"2013-06-05 ","00:40:57","RepZoeLofgren","Great meeting w/ San Jose @BoatPeopleSOS advocates today about improving human rights in Vietnam &amp; immigration reform http://t.co/NyniLJp5dC",
"2012-09-25 ","19:00:03","RepZoeLofgren","I've introduced #InternetFreedom bills to spark dialogue on protecting a free &amp; open Internet from #SOPA like threats http://t.co/RhcKFuPX","InternetFreedom SOPA"
"2012-09-25 ","16:03:38","RepZoeLofgren","Transparency&amp; balance needed in Trans Pacific Partnership or #TPP may threaten online free speech, privacy &amp; innovation http://t.co/Px9Y4K8D","TPP"
"2012-09-25 ","15:06:27","RepZoeLofgren","Any #CyberSecurity executive order should have narrow focus on critical infrastructure &amp; protect 1st Amendment rights http://t.co/FHm4ELMM","CyberSecurity"
"2012-07-18 ","22:35:03","RepZoeLofgren","Thanks to @SpeakerPerez for our meeting today discussing how we can work to help Californians http://t.co/eptuEW9o http://t.co/FFrPZTYP",
"2012-05-18 ","21:09:57","RepZoeLofgren","@safeway SVP/Gen. Counsel Bob Gordon a reminder when in public: if you can't say anything nice, don't say it at all http://t.co/f1tupFYI",
"2012-05-18 ","18:29:41","RepZoeLofgren","@YahooBHRP I enjoyd speaking @ #YahooCYW about lessons learned from SOPA defeat &amp; achieving + change thru social media http://t.co/lY54LHCp","YahooCYW"
"2012-05-18 ","00:36:23","RepZoeLofgren","#Veterans shouldn't have to wait months &amp; years for help, @DeptVetAffairs needs to fix failing claims offices in CA http://t.co/KcNGlz68","Veterans"
"2012-05-18 ","00:30:51","RepZoeLofgren","Thanks to SJ's Windmill Springs Elementary School for visiting with me today during your Washington, DC trip. http://t.co/NN63PTuU",
"2016-09-21 ","19:08:03","RepMikeHonda","Happy @PeaceDay! https://t.co/yYFZMI8II4",
"2016-09-21 ","14:18:10","RepMikeHonda","LIVE on #Periscope: .@rephankjohnson &amp; I are introducing 2 bills to secure our democracy from hacks &amp; protect our v… https://t.co/hnonJ5x5Tg","Periscope"
"2016-07-15 ","14:35:27","RepMikeHonda","Congrats @SanJosePD for implementing body cameras. Thank you for your service &amp; dedication to transparency and accountability to the public.",
"2016-07-05 ","18:48:02","RepMikeHonda","Welcome to Jupiter! Congrats to @NASA for @NASAJuno’s successful arrival at #Jupiter after 5 years in #Space! #Juno #Science","Jupiter Space Juno Science"
"2016-06-10 ","17:48:00","RepMikeHonda","Reunite families separated by backlogs #ImmigrationStoryIn5Words #IHM2016 https://t.co/00jgFGABKa","ImmigrationStoryIn5Words IHM2016"
"2016-06-10 ","17:05:00","RepMikeHonda","We’re a country of immigrants. What's your story? #ImmigrationStoryin5Words https://t.co/wqeaUvHH6j","ImmigrationStoryin5Words"
"2016-02-23 ","22:26:19","RepMikeHonda","BTW @RepHalRogers: one big problem with Silicon Holler. #SiliconValley runs on #renewables. You can't innovate w/ coal #CA17 #BayAreaPride","SiliconValley renewables CA17 BayAreaPride"
"2016-02-23 ","22:25:43","RepMikeHonda","Nice thought @RepHalRogers but I believe Silicon Valley &gt; Silicon Holler. #CA17 #SV #BayAreaPride","CA17 SV BayAreaPride"
"2016-02-23 ","22:06:47","RepMikeHonda","Q to @PennyPritzker: Would these #NNMI centers develop if we didn’t have seed money from @CommerceGov? #CA17 #manufacturing #Appropriations","NNMI CA17 manufacturing Appropriations"
"2016-02-23 ","22:06:39","RepMikeHonda","Q to @PennyPritzker: What is the current status of the NNMI hubs and what’s @NIST’s role? #CA17 #Appropriations","CA17 Appropriations"
"2016-02-23 ","21:51:07","RepMikeHonda","As the lead Democrat for this funding hearing I’m glad to have @PennyPritzker here to discuss @CommerceGov’s $ reqs https://t.co/YSKA53g3QJ",
"2016-02-23 ","19:06:07","RepMikeHonda","Amazing statistic from #SiliconValley:of worldwide perfect AP Computer Science scores, more than 20% are from #CA17! https://t.co/suEiqKNoVd","SiliconValley CA17"
"2016-02-23 ","16:08:23","RepMikeHonda","Celebrate #NationalEngineersWeek. Show every child how engineers solve socially relevant problems #inspire #diversity #Eweek2016","NationalEngineersWeek inspire diversity Eweek2016"
"2016-02-18 ","22:27:03","RepMikeHonda","So much great technology in #CA17 Silicon Valley.  https://t.co/0eJBSGEVCY","CA17"
"2016-02-18 ","22:16:43","RepMikeHonda","Enjoying the tour of Ames Research Center with NASA Administrator Bolden. #CA17 https://t.co/bJyCr0kQma","CA17"
"2016-02-18 ","21:39:56","RepMikeHonda","That's right @jennafischer - it's just research. Time for @SpeakerRyan to stop blocking the vote. TY for the retweet https://t.co/bYT8Goax2y",
"2016-02-18 ","21:17:10","RepMikeHonda",".@rooseveltinst asked 1,000 college students for their priorities–the answer= education, economy &amp; human rights https://t.co/IkOEz6sbuC",
"2016-02-18 ","19:10:25","RepMikeHonda","Gun violence research is not about taking guns. It's about taking care of our people. #Enough #LiftTheBan My take:
https://t.co/jNKRmgiaeB","Enough LiftTheBan"
"2016-02-18 ","15:00:43","RepMikeHonda","I support the new @LGBTEqCaucus Task Force on Aging, chaired by @RepTedDeutch. We must confront unique challenges facing LGBT seniors.",
"2016-02-18 ","04:18:15","RepMikeHonda","Great news, #CA17: 1st 250 miles of track of CA HS rail will go to San Jose. Now @VTA #BART &amp; @CaHSRA will be in #SV https://t.co/lW63iOttm2","CA17 BART SV"
"2015-11-30 ","19:53:31","RepMikeHonda","Opening day of #COP21 in Paris! In this critical time for our planet, we must #ActOnClimate https://t.co/3VGsu8lbz9","COP21 ActOnClimate"
"2015-10-29 ","21:30:06","RepMikeHonda","Honored to receive an honorary doctorate from @StudyInKorea for my worldwide fight for civil &amp; human rights https://t.co/Cjuvl32sH6",
"2015-10-29 ","14:23:27","RepMikeHonda","I'm proud to vote for @NancyPelosi for the next #Speaker of the House. She would help us address our ever-increasing #incomeinequality","Speaker incomeinequality"
"2015-07-14 ","19:17:13","RepMikeHonda","It was great to host Former Secretary of State @HillaryClinton at our #CAPAC meeting today. http://t.co/8Xyg28hsjq","CAPAC"
"2015-07-14 ","17:41:50","RepMikeHonda","Congrats @NASA &amp; #NewHorizons team for historic #PlutoFlyby! What an inspiration to keep pushing our frontiers. http://t.co/gThofNsH86","NewHorizons PlutoFlyby"
"2015-07-14 ","10:39:17","RepMikeHonda","I'm looking forward to President @BarackObama's statement on the #IranDeal at 7am ET https://t.co/ImmHquCTVL","IranDeal"
"2015-06-09 ","16:52:30","RepMikeHonda","Thank you @VTA bus driver Tim Watson for your #heroism in saving the 3-year old boy from a kidnapper. You make me proud to represent #CA17","heroism CA17"
"2014-05-21 ","21:55:04","RepMikeHonda","Human-induced #climatechange is overwhelming &amp; undeniable --&gt; Pass my Climate Change Edu Act #ActOnClimate #p2 http://t.co/AvvCUWnpOn","climatechange ActOnClimate p2"
"2014-05-21 ","20:13:10","RepMikeHonda","Today I am going to #SoundTheAlarm4Climate! RT if you agree that we must act now. Watch here --&gt; https://t.co/0xAbFnMFmy","SoundTheAlarm4Climate"
"2014-04-01 ","20:00:17","RepMikeHonda","#GOPbudget: Cutting #SNAP, #Medicare, #Medicaid, Transportation, &amp; refuses to #RenewUI. Least funny #AprilFoolsDay prank of all time","GOPbudget SNAP Medicare Medicaid RenewUI AprilFoolsDay"
"2014-04-01 ","14:49:31","RepMikeHonda","Check out my proposal to extend BART to Washington, DC! http://t.co/otU1A2uTR4",
"2014-02-18 ","22:40:49","RepMikeHonda","Happy to speak #CA17 @AARP monthly meeting &amp; discuss debt ceiling, health care, immigration &amp; Social Security http://t.co/HCd6rzHLhX","CA17"
"2014-02-18 ","21:37:16","RepMikeHonda","Start thinking of ideas for this year's first ever @WhiteHouse Maker's Faire! #STEMTues http://t.co/8ZCPBD4sDm","STEMTues"
"2013-09-14 ","17:10:48","RepMikeHonda","Happy to meet volunteers &amp; donors @redcrossbaltdc @Muslimsforlife Ahmadiyya blood drive! http://t.co/kPpLotk7u9",
"2013-07-24 ","22:08:56","RepMikeHonda","Met US-Japan exchange students @JapanTomodachi, hope they grow through cultural exchange as @PeaceCorps did for me! http://t.co/0KPIN3jxmZ",
"2013-06-05 ","19:29:51","RepMikeHonda","Thanks @OTLCampaign @IAmKidPresident for working to close the #education #opportunitygap, an issue I champion http://t.co/0fHUd7ipQW","education opportunitygap"
"2013-06-05 ","18:32:31","RepMikeHonda","Hosted #antibullying caucus event on prevention w/@rfkcenter @TheBullyProject @CommonSense @facebook #projectconnect http://t.co/Cvk5pBXywx","antibullying projectconnect"
"2013-06-05 ","15:34:53","RepMikeHonda","As Chair of the #antibullying caucus, today I re-affirmed our central goal: To empower discriminated, scapegoated &amp; silenced individuals","antibullying"
"2013-04-19 ","16:34:01","RepMikeHonda",".@GLSEN As founder &amp; chair of anti-bullying caucus &amp; vice-chair of #LGBT equality caucus, I am w/#DayOfSilence http://t.co/WPe1Anc4Xw","LGBT DayOfSilence"
"2012-09-25 ","17:29:49","RepMikeHonda","Joined @usprogressives in issuing a poverty plea to Congressional leaders asking for focus on most vulnerable Americans http://t.co/o7XUCF5c",
"2012-09-25 ","17:26:53","RepMikeHonda","Today is Ntl #Voter Registration Day! In 08, 6m people didn’t vote because they didn't register or missed the deadline http://t.co/I0pelqM6","Voter"
"2012-07-18 ","20:19:45","RepMikeHonda","The White House is hosting a special Twitter chat through @whitehouseostp on the President's big announcement on #STEM Issues right now!","STEM"
"2011-10-10 ","20:27:01","RepMikeHonda","Passing of the CA #DreamAct will allow talented youth to achieve higher education & contribute to CA’s economy. A historic & important step!","DreamAct"
"2011-01-06 ","18:06:20","RepMikeHonda","CBO ltr to @johnboehner estimates #HCR repeal political stunt adds $230B to deficit & increases insur. premiums  http://bit.ly/gAjR4j","HCR"
"2016-02-18 ","18:32:57","RepAnnaEshoo","Alleluia! #UnlockTheBox https://t.co/PwB1pePHuE","UnlockTheBox"
"2016-02-18 ","14:54:59","RepAnnaEshoo",".@USATODAY weighs in with support for @FCC #UnlockTheBox proposal. https://t.co/IG2ilhcTrE","UnlockTheBox"
"2016-02-18 ","14:49:32","RepAnnaEshoo","""Thinking outside of the cable box""--my op-ed in @thehill today in support of @FCC's #UnlockTheBox proposal. https://t.co/QmRKt1v4Rc","UnlockTheBox"
"2015-06-09 ","16:29:12","RepAnnaEshoo","Bravo to Jennifer Wang on winning this year's Congressional Art Competition for California's 18th… https://t.co/WIirxHbqYZ",
"2014-10-22 ","14:38:10","RepAnnaEshoo","To ensure a free and open Internet, @FCC should reclassify broadband providers under #TitleII of the Comm Act. http://t.co/rYlTtC5GNx","TitleII"
"2014-05-21 ","19:42:42","RepAnnaEshoo","I have my alarm set to 5 pm EST to #SoundtheAlarm4Climate! It’s time for Congress to wake up and #ActOnClimate! http://t.co/d913DuHOo9","SoundtheAlarm4Climate ActOnClimate"
"2014-05-21 ","19:04:43","RepAnnaEshoo","Met today with the bright and ambitious eighth grade class from the Hillbrook School in Los Gatos. http://t.co/D0biA8yO6Q",
"2014-04-01 ","19:52:46","RepAnnaEshoo","Intro'd resolution w/ @RepTomMarino, @RepJoeKennedy &amp; @USRepKeating calling on Turkey to reinstate #Internet freedom. http://t.co/TDMouicQBw","Internet"
"2013-07-24 ","23:02:37","RepAnnaEshoo","I voted yes on amendment barring NSA from indiscriminate surveillance of Americans. http://t.co/P1tq1ewUbO",
"2013-06-05 ","20:30:51","RepAnnaEshoo","Bravo to CA's 18th Congressional District U.S. Physics Team Members! http://t.co/2X3ULPvnE8",
"2013-06-05 ","17:14:20","RepAnnaEshoo",".@SenWhitehouse and I are asking @FCC for progress report on #CALMAct implementation six months after it took effect. http://t.co/lAZ4cJZ83G","CALMAct"
"2012-07-18 ","21:18:21","RepAnnaEshoo","With 271 cosponsors and critical need for a plan to target pancreatic cancer, it's time @HouseCommerce approve H.R.733. http://t.co/Hmyovjem",
"2012-07-18 ","20:30:59","RepAnnaEshoo","Pleased to announce that two CA14 veteran housing assistance programs were awarded $1.2M in grants. http://t.co/N1L3DpaX",
"2012-07-18 ","15:05:55","RepAnnaEshoo","Very pleased to announce that two CA14 veteran housing assistance programs were awarded $1.2 in grants. http://t.co/N1L3DpaX",
"2016-09-21 ","19:43:33","RepSpeier","The select panel is an affront to the Constitution- @HouseGOP Stop the witch-hunt on life saving #stemcell research. https://t.co/VAPccUe6Hj","stemcell"
"2016-09-21 ","19:04:53","RepSpeier","Celebrating #Armenian Independence by continuing to build strong US/Armenia relations as a proud Co-Chair of the @ArmenianCaucus https://t.co/TozSfk2gSP","Armenian"
"2016-09-21 ","18:12:09","RepSpeier","Ian @SFSU should be rising through the ranks with his degree, not sinking from $30K in #studentdebt #DebtFreeWishList #FutureForum #InTheRed https://t.co/zUgoiigLVz","studentdebt DebtFreeWishList FutureForum InTheRed"
"2016-09-21 ","18:06:40","RepSpeier","Nicholas @SFSU would like to graduate and embark on his future without the threat of $28,000 in #studentdebt #InTheRed #DebtFreeWishList https://t.co/JtF0RWqzOR","studentdebt InTheRed DebtFreeWishList"
"2016-07-15 ","21:21:24","RepSpeier","The Administration has finally declassified the #28pages of the Joint 9/11 Report. You can read my statement here: https://t.co/360O0H4oGO","28pages"
"2016-07-15 ","17:42:24","RepSpeier","My amdt to stop #GGNRA from restricting off-leash dog walking passed the House. Let's save this 40 year tradition! https://t.co/T874Ua3VL9","GGNRA"
"2016-07-15 ","13:46:10","RepSpeier",".@HouseGOP breaks for the longest recess in 60 years &amp; fails to address #gunviolence #Zika &amp; more! #NoVoteNoVacay https://t.co/QaLyTHcWKa","gunviolence Zika NoVoteNoVacay"
"2016-07-05 ","18:12:34","RepSpeier","Glad to see more Americans using their collective voice to #endgunviolence and #DisarmHate https://t.co/nBh7kB2tQ1","endgunviolence DisarmHate"
"2016-07-05 ","17:44:39","RepSpeier","Deeply touched by the stories I heard at the gun violence prevention sit-in yesterday: https://t.co/nB680JwIwq #DisarmHate #Enough","DisarmHate Enough"
"2016-07-05 ","17:16:50","RepSpeier","The NRA doesn't have a seat in Congress, or do they have 247? #NotOneMore #DisarmHate #endgunviolence https://t.co/sXiwZNvwzY","NotOneMore DisarmHate endgunviolence"
"2016-07-05 ","15:11:49","RepSpeier","Thank you for coming to my event! It's for children like you that we must #endgunviolence #DisarmHate &amp; say #Enough https://t.co/1qqq3sJAn9","endgunviolence DisarmHate Enough"
"2016-07-05 ","00:48:06","RepSpeier","Our message at my gun sit-in today was clear: #EnoughIsEnough, #DisarmHate https://t.co/XfN8KSR1kv","EnoughIsEnough DisarmHate"
"2016-06-10 ","14:29:43","RepSpeier","If Congress won’t hold @PHMSA_DOT accountable, the American people can do so with my PHMSA Accountability Act https://t.co/gVNygRrjkl",
"2016-02-23 ","21:19:54","RepSpeier","Congress must act to shut #Gitmo down now https://t.co/rHaM7i9Nbj https://t.co/pv8bLxbXdE","Gitmo"
"2016-02-23 ","21:18:53","RepSpeier","Our continued refusal to close #Gitmo is an insult to American values and a waste of taxpayer dollars https://t.co/MyYbdA8XPn","Gitmo"
"2016-02-23 ","03:24:59","RepSpeier","Watch my Town Hall: Renting in San Mateo at https://t.co/UGqIeuNa91",
"2016-02-23 ","03:14:33","RepSpeier","Strong turn out of residents and elected officials at my Town Hall: Renting in San Mateo County. https://t.co/5jJw2bnQQK",
"2015-11-25 ","17:33:09","RepSpeier","Will miss local Dungeness crab this Thanksgiving, but fisherman are paying the real price&amp;deserve financial lifeline.https://t.co/lnThNDRubM",
"2015-10-29 ","16:04:51","RepSpeier","Halloween's coming and it's an appropriate time to consider slashing this 'zombie program' 4 good: https://t.co/bmzf7MujUU (@washingtonpost)",
"2015-09-29 ","18:30:01","RepSpeier","#PlannedParenthood saves lives! That's why I'm proud to #StandWithPP today. https://t.co/0y2dChYhkY #PinkOut @PPFA http://t.co/jV3DVI9kjO","PlannedParenthood StandWithPP PinkOut"
"2015-07-14 ","23:01:34","RepSpeier","My bill to tear down the last vestiges of #Prohibition and let people send booze via the mail https://t.co/FBOrv6GJTM http://t.co/K7ecE1y15s","Prohibition"
"2015-07-14 ","22:04:24","RepSpeier","MT @patcaldwell Senate is voting on this @alfranken bill to protect #LGBT students from harassment in schools http://t.co/P3Bxs6trD9","LGBT"
"2015-07-14 ","15:56:41","RepSpeier","What #SanFrancisco looked like 100 years ago: https://t.co/ZKP8uTCRo3","SanFrancisco"
"2015-06-15 ","20:48:39","RepSpeier","Great to see #LosAngeles follow #SanFrancisco &amp; raise minimum wage to $15! https://t.co/r2BvCPyqEH #raisethewage #LA http://t.co/bFhGkHCvRV","LosAngeles SanFrancisco raisethewage LA"
"2015-06-15 ","19:36:21","RepSpeier",".@mercnews pictures from my event honoring #Filipino #veterans who fought in WWII &amp; deserve the benefits FDR promised http://t.co/UGBwc1MTpP","Filipino veterans"
"2015-06-09 ","01:44:58","RepSpeier","Congrats to #TeamUSA Women on their 3-1 win over Australia in their first game of the #fifaworldcup. #USAWomens #OurGirls","TeamUSA fifaworldcup USAWomens OurGirls"
"2014-05-21 ","22:23:05","RepSpeier","More than 200 members of Congress favor taking prosecution of sexual assault cases out of the chain of command #NDAA http://t.co/8HqBZxMh4R","NDAA"
"2014-05-21 ","22:15:28","RepSpeier","Time 2 stand up and B counted Congress. My fight 4 #MST survivors continues until military sexual assault cases are handled by legal experts","MST"
"2014-05-21 ","15:52:57","RepSpeier","Vets dying while waiting months 4 healthcare while #VA facilities cook the books is criminal. Swift reckoning now! #OurVeteransDeserveBetter","VA OurVeteransDeserveBetter"
"2014-04-01 ","00:46:12","RepSpeier","Thank you @Campaign4Kids for spreading the word about my homeless challenge in North Carolina! http://t.co/pzrX3cVVjN",
