"Date","Time","screen_name","text","hashtags"
"2016-09-21 ","20:33:19","RepTrentKelly","Our farmer’s needs must remain a top priority in this great nation. Amy Moore and Julia Davidson assist through USDA in MS #MS01 https://t.co/vJmwtNKXKF","MS01"
"2016-09-21 ","16:48:47","RepTrentKelly","MS Trucking Assoc. members say there’s a driver
shortage in the industry. Recruitment strategies will be a chief priority #MS01 https://t.co/8YoiCAuwBO","MS01"
"2016-09-21 ","14:55:40","RepTrentKelly","It was good to see people from home representing the Mississippi Automobile Dealers Association and the @NADAUpdate #MS01 https://t.co/ffov4QMmlo","MS01"
"2016-07-15 ","20:07:58","RepTrentKelly","This week’s rundown: https://t.co/kDS6t6LpK2",
"2016-06-10 ","20:54:54","RepTrentKelly","This week’s newsletter: https://t.co/1DhxQvdrIy",
"2016-06-10 ","14:21:02","RepTrentKelly","Great news! #BMSI announced its creating 100 jobs + investing $6 million in manufacturing operations in Burnsville. #MSjobs","BMSI MSjobs"
"2016-02-23 ","22:37:32","RepTrentKelly","Obama's plan to close #Gitmo and bring detainees to the U.S. is misguided and must be stopped by Congress: https://t.co/VZmzVV9n3x","Gitmo"
"2016-02-18 ","22:27:09","RepTrentKelly","Sign-up for my weekly newsletter if you are interested in what is going on in Congress and #MS01: https://t.co/FmxK0OaSIn","MS01"
"2015-11-30 ","16:40:54","RepTrentKelly","What issues are important to you? Let me know by answering this quick survey: https://t.co/GBedEzzGXd",
"2016-07-15 ","15:57:48","CongPalazzo","Congratulations to @MilitaryTimes 2016 @NavyTimes Coast Guardsman of the Year, Lieutenant Commander Megan Drewniak, @uscoastguard",
"2016-07-15 ","15:56:35","CongPalazzo","Congratulations to @MilitaryTimes 2016 @AirForceTimes Airman of the Year, Staff Sergeant Clifford ""Dylan"" Crawford!",
"2016-07-15 ","15:55:05","CongPalazzo","Congratulations to @MilitaryTimes 2016 @NavyTimes Sailor of the Year, Hospital Corpsman 1st Class Samuel Johnson, @USNavy",
"2016-07-15 ","15:53:25","CongPalazzo","Congratulations to @MilitaryTimes 2016 Marine of the Year, Gunnery Sergeant Brian Downing @USMC #SemperFi","SemperFi"
"2016-07-15 ","15:51:36","CongPalazzo","Congratulations to the @MilitaryTimes 2016 Amy Soldier of the Year, Captain Zachariah Fike!",
"2016-07-15 ","15:39:31","CongPalazzo","Truly touched by these Mississippians stopping by yesterday &amp; praying over me, Congress &amp; our country, #Prayer https://t.co/ufBEFEdhIG","Prayer"
"2016-07-15 ","14:27:37","CongPalazzo","I enjoyed meeting Travis Cumbest from East Central High School yesterday in DC! #FutureLeader https://t.co/y9VSDRrKAu","FutureLeader"
"2016-07-05 ","21:06:24","CongPalazzo","Traveling in style today as I head back to DC! #SMTTT https://t.co/9RFaNoFyiN","SMTTT"
"2016-02-23 ","14:38:43","CongPalazzo","Good news for our veterans in the Pine Belt!  https://t.co/XF6MQfnn6x",
"2015-11-30 ","18:53:00","CongPalazzo","Big congrats to USM Golden Eagles on another victory and making it to the @Conference_USA championship game next weekend! #SMTTT","SMTTT"
"2015-10-29 ","17:00:03","CongPalazzo","Scripture from our prayer breakfast this morning. Matthew 11:28-30 https://t.co/O6ZYkjlYYy",
"2015-09-29 ","22:03:51","CongPalazzo","Getting started with our teletown hall this evening. Hope you'll join the discussion at 877-229-8493 pin#17629 http://t.co/s7JjNwJ2TO",
"2015-09-29 ","16:43:58","CongPalazzo","I'm hosting a teletown hall this evening starting at 4:55 pm CT. Join the discussion by calling in @ 877-229-8493 &amp; entering pin # 17629",
"2015-09-29 ","14:28:03","CongPalazzo","Presiding over the House floor this morning. Watch live here: http://t.co/ETL2taO3j9",
"2015-06-09 ","23:12:25","CongPalazzo","Welcoming our newest member of the Mississippi delegation Rep.Trent Kelly as he is sworn in on the House floor. http://t.co/LuOu1xPqOC",
"2015-06-09 ","18:47:32","CongPalazzo","Thanks @NatlGovsAssoc 4 your kind words. I look forward 2 working with you 2 sustain &amp; strengthen our National Guard http://t.co/In2axPyYB9",
"2014-10-22 ","19:23:41","CongPalazzo","Honored to host Gen. Frank Grass and his team on a tour around South Mississippi's military facilities today http://t.co/rSYS57oIod",
"2014-10-22 ","15:37:14","CongPalazzo","Showing NGB Chief Gen. Grass around Camp Shelby by Black Hawk #NationalGuard http://t.co/VdcNLpCPiS","NationalGuard"
"2014-05-21 ","20:23:10","CongPalazzo","They Deserve Better: Shinseki must clean house over #VAScandal or start cleaning out his desk http://t.co/XYqaliyUyp http://t.co/l9LqmE4VIf","VAScandal"
"2014-04-01 ","15:42:28","CongPalazzo","MT @amphibwarships @CongPalazzo applauds letter from retired @USMC Generals requesting addit'l amphibious LPD-17 http://t.co/B1YgwT8hFQ",
"2014-04-01 ","13:49:48","CongPalazzo","It took 4 years for #POTUS to come clean about ObamaCare. Now we know the truth and it's no #AprilFools: http://t.co/VM4vrH0ZBh","POTUS AprilFools"
"2014-02-18 ","21:39:49","CongPalazzo","Tomorrow I'll honor local Montford Point Marines - WWII vets and some of the first African American Marines: http://t.co/tKlwYnVMUH",
"2013-07-24 ","20:49:06","CongPalazzo","15 years ago Capitol Policemen John Gibson and J.J. Chestnut were killed in line of duty. This afternoon we honor their memory and sacrifice",
"2013-07-24 ","19:47:53","CongPalazzo","PALAZZO PROTECTS MILITARY TECHNICIANS FROM FURLOUGHS, KEEPS DOD POLICY CONSISTENT   http://t.co/f34tOqY9hc",
"2013-06-05 ","14:46:36","CongPalazzo","One of 18 new #Obamacare taxes: $695 #IRS penalty for not buying govt approved insurance. We need #Right2Refuse http://t.co/5J0okc0NPm","Obamacare IRS Right2Refuse"
"2013-03-11 ","20:22:03","CongPalazzo","MT @SmallBizGOP @NFIB: Overwhelmingly #SmallBiz indicate they prefer lower individual tax rates and simpler tax code http://t.co/S8mSINij8r","SmallBiz"
"2013-03-11 ","20:21:30","CongPalazzo","MT @SmallBixGOP @NFIB: Overwhelmingly #SmallBiz indicate they prefer lower individual tax rates and simpler tax code http://t.co/S8mSINij8r","SmallBiz"
"2013-03-11 ","19:47:35","CongPalazzo","Recent MS laws strengthened 2nd AMD Rights. I'll oppose any attempts in Washington to infringe on these rights: http://t.co/5VNuynYr3q",
"2012-12-12 ","22:43:21","CongPalazzo","Tonight I preside over the House floor during a special order on the fiscal cliff and addressing our spending problems. http://t.co/DRXE5Daw",
"2012-12-12 ","22:25:02","CongPalazzo","Congrats to the ForWarn Team and @NASAStennis - just another example of Stennis' successful NASA partnerships: http://t.co/tWQIpX6C",
"2012-09-25 ","20:58:16","CongPalazzo","#POTUS must back strong words @ UN w/ meaningful action. That's why now is the wrong time for damaging defense cuts. http://t.co/e1MFMbRa","POTUS"
"2012-09-25 ","12:33:16","CongPalazzo","@Lastlobo Thanks John for your kind feedback. That's what we're here for.",
"2012-09-25 ","12:32:16","CongPalazzo","@ASmile4u Thank you Dorri for your kind feedback.",
"2012-08-03 ","21:35:43","CongPalazzo","Join me in South Mississippi for a town hall meeting. http://t.co/qYOjvti4",
"2012-08-03 ","21:32:20","CongPalazzo","Here are the dates and times of my upcoming mobile office hours in South Mississippi.  http://t.co/Ng3J2hWn",
"2012-07-18 ","23:16:42","CongPalazzo","Today, the House voted 414-2 to require #POTUS to address defense sequestration cuts and impact on our economy: http://t.co/omH6sm7g","POTUS"
"2012-03-31 ","20:10:26","CongPalazzo","Proud to represent #TeamNickMyers at the @CUCB Ten Mile Run tomorrow on the National Mall.  http://t.co/12jwUoxp","TeamNickMyers"
"2016-09-21 ","18:20:45","GreggHarper","Happy to announce additional FAA funding to continue improvements to the Jackson airport. https://t.co/n9cgh8SWFI",
"2015-11-30 ","22:01:59","GreggHarper","I commend the hard work by @SenatorWicker in helping to pass #RuralWater bill through the House &amp; Senate. #S.611 https://t.co/THrVJPcjjl","RuralWater S"
"2015-09-29 ","22:36:41","GreggHarper","Great visit w/ Bill Lehman, Roger Bacon Jr., Michael Joe Cannon, &amp; Mike Whatley for @NADAUpdate #NADAWC15 http://t.co/dwh8OD02eM","NADAWC15"
"2015-07-14 ","21:38:23","GreggHarper","Disgusting. One of many reasons why I continue to fight to end federal funding for Planned Parenthood. http://t.co/8XSVEIaoJ2",
"2015-07-14 ","21:18:39","GreggHarper","Great having a few @MissCollege students come by today so we could discuss the powerhouse level of our Table Tennis Team. #DoItLikeAChoctaw","DoItLikeAChoctaw"
"2015-07-14 ","19:38:03","GreggHarper","Great meeting with Mississippi @CUFI delegation to discuss #IranDeal. I support all who value freedom and security. http://t.co/yeuw7DVkBp","IranDeal"
"2015-07-14 ","15:20:43","GreggHarper","Iran ""Deal"" helps stabilize and legitimize its regime as it spreads even more violence and instability in the region http://t.co/BzMYZNC6Rz",
"2014-05-21 ","17:35:46","GreggHarper","Still seeing momentum on my bill to end subminimum wages for disabled workers. Two new cosponsors -- @RepMcGovern &amp; @RepWOLFPress #FairWages","FairWages"
"2014-04-01 ","19:22:14","GreggHarper","In the hearing now. RT @HouseCommerce: WATCH LIVE: #SubOversight hearing on the @GM ignition switch recall http://t.co/HOha6OxLzX #GMrecall","SubOversight GMrecall"
"2014-04-01 ","18:28:55","GreggHarper","When it comes to energy, America needs an all-of-the-above strategy that harnesses new technologies and increases domestic production.",
"2014-04-01 ","17:15:58","GreggHarper","Congratulations to JA senior William Hontzas for his appointment to the Air Force Academy! Check out the story -- http://t.co/jtafu32wSv.",
"2014-02-18 ","20:14:03","GreggHarper","Technological advances have created new opportunities for advances in health care delivery. http://t.co/TKEuzbnlHl #TelemedicineWorks","TelemedicineWorks"
"2014-02-18 ","16:40:58","GreggHarper","A McComb hospital has cut five doctors, citing #ObamaCare as one of the reasons -- http://t.co/Wz7g7pnhkl // #BrokenPromises","ObamaCare BrokenPromises"
"2013-09-14 ","19:03:16","GreggHarper","Glad to! RT @PQHH: @GreggHarper Thanks for supporting access to #homehealth for Mississippi's Medicare beneficiaries! http://t.co/HlwNxabllB","homehealth"
"2013-07-24 ","15:18:57","GreggHarper","Great to have the @MSManufacturers in DC. #ManufacturingWorks http://t.co/SCuVdla4ij","ManufacturingWorks"
"2013-07-24 ","14:05:55","GreggHarper","Nice @FortuneMagazine feature on hiring intellectually disabled workers. Congress must redesign transition supports. http://t.co/ovpGn36v6s",
"2013-07-24 ","13:16:17","GreggHarper","RT @FortuneMagazine: New, better workers on the #autism spectrum http://t.co/eM9pahUfnK","autism"
"2013-06-05 ","15:11:16","GreggHarper","The EAC has outlived its usefulness and to continue to fund it is the definition of irresponsibility. http://t.co/1h4FP38Unh",
"2013-06-05 ","12:58:43","GreggHarper",".@USATODAY: House panel OKs ending Election Assistance Commission -- http://t.co/1h4FP38Unh @dberrygannett",
"2013-04-19 ","19:05:58","GreggHarper","Reminder: Tomorrow is Military Academy Day. The event is at Pearl High School - address: 500 Pirates Cove, Pearl, Mississippi 39208",
"2012-12-12 ","14:27:06","GreggHarper","RT @GOPWhip: Here’s how @BarackObama’s #SmallBiz tax hike hurts middle class employees WATCH: http://t.co/LxJiFRoV #FiscalCliff","SmallBiz FiscalCliff"
"2012-09-25 ","19:03:20","GreggHarper","Next on the agenda: @WhitWaide's American Government class. This ought to be entertaining!",
"2012-09-25 ","16:40:39","GreggHarper","Looking forward to speaking with a group of first generation college students who are TRiO recipients today at @MSState luncheon.",
"2012-09-25 ","13:44:51","GreggHarper","Miss. native and wounded warrior, CJ Stewart, teaches youth to overcome adversity through strength and determination. http://t.co/b3zZ1ws2",
"2012-09-25 ","12:48:53","GreggHarper","Great to see that another group of WWII vets is making the trip to DC with the Mississippi Gulf Coast Honor Flight. http://t.co/cx09HSlv",
"2012-07-18 ","21:49:27","GreggHarper","Tune in to @MarshallRamsey's show to catch our conversation about Mississippi's defense priorities. http://t.co/meDdMwgD @SuperTalk",
"2012-05-18 ","19:36:48","GreggHarper","My amendment to NDAA requires a study of the @USAirForce's decision to consolidate the ANG Augmentation Force. MS's bases are crucial.",
"2011-01-14 ","17:29:13","GreggHarper","I am pleased to have the opportunity to introduce my governor, @HaleyBarbour, during today's @GOPConference Member Retreat.",
"2011-01-14 ","13:01:31","GreggHarper","Looking forward to a great day of strategy meetings at the @GOPConference Retreat.",
"2011-01-12 ","01:31:38","GreggHarper","I hope @HaleyBarbour will run for president. Great speech at the State of the State.",
"2011-01-11 ","19:48:36","GreggHarper","@SpeakerBoehner has formally invited the President to the Capitol for the State of the Union to be held January 25.",
"2011-01-08 ","20:29:47","GreggHarper","The startling news from Arizona is a concern for all public servants. We are praying for Gabrielle's recovery.",
"2011-01-08 ","20:09:55","GreggHarper","The prayers of my family and my staff go out to Rep. Giffords', her family, and to others who were involved in today's senseless events.",
"2011-01-07 ","12:29:51","GreggHarper","I'll visit with @MattFriedeman about the 112th Congress and the GOP majority at 7:45 a.m. CST. Listen online: www.onenewsnow.com",
"2011-01-06 ","18:32:10","GreggHarper","Floor Speech: ""Our Path To A Balanced Budget Begins Today, And It Begins With This Vote"" - Watch the video online here: http://j.mp/hxPktS",
"2011-01-06 ","17:56:14","GreggHarper","I'm about to deliver a speech on the House floor encouraging Congress to cut our operating budget.",
"2009-11-03 ","23:17:37","GreggHarper","I just had a nice interview with Jim Thorn on American Family Radio about the Medicaid entitlement expansion in Pelosi's health care bill.",
"2009-11-03 ","20:01:36","GreggHarper","Pelosi's Health Care Bill Will Be Costly For Mississippi http://amplify.com/u/spo",
"2009-11-03 ","19:34:18","GreggHarper","RT @GOPLeader: Join the Discussion as House GOP Uses Amplify.com to Expose Truth About Pelosi’s #Healthcare Bill: http://bit.ly/JqsxZ","Healthcare"
"2009-11-03 ","12:16:43","GreggHarper","I'll join Paul Gallo at 7:30 a.m. Central on @SuperTalk to discuss Pelosi's 1,990 page government takeover of health care.",
"2009-04-01 ","21:26:08","GreggHarper","just finished an interview with Greg Corombos on Dateline Washington. Listen online: www.km772.th8.us",
"2009-04-01 ","12:01:17","GreggHarper","is off to two interviews and will then be on the House floor for a Bicameral GOP Conference meeting on how the GOP budget lowers taxes.",
"2009-04-01 ","02:16:57","GreggHarper","just had a great dinner with some of the staff. Now I'm headed to prepare for a big day tomorrow with the budget and House Admin. hearings.",
