"Date","Time","screen_name","text","hashtags"
"2016-09-21 ","20:39:48","KeithRothfus","Honored to receive the Guardian of Small Business award from @NFIB. https://t.co/0ljRKqGlVe",
"2016-07-05 ","19:22:28","KeithRothfus","The FBI’s decision not to prosecute Sec. Clinton sends message that the powerful &amp; well-connected are above the law. https://t.co/YxnYPaktkU",
"2016-06-10 ","19:18:22","KeithRothfus","A #carbontax would harm American businesses &amp; consumers – the House took action today to block this misguided policy https://t.co/jDxoXDN1vz","carbontax"
"2016-02-23 ","22:14:56","KeithRothfus","#OTD in 1945 US Maines captured Mount Suribachi while fighting on #IwoJima. Thank you @USMC https://t.co/zfGZokOqBs https://t.co/4upc8fiD2S","OTD IwoJima"
"2016-02-23 ","20:37:47","KeithRothfus","The law requires the President to provide a plan to defeat ISIS. Instead, he has provided a plan to close #Gitmo. Priorities?","Gitmo"
"2015-11-25 ","16:55:22","KeithRothfus","It is #NationalAdoptionMonth and Thanksgiving Eve. Let’s all be thankful for the gifts of family and #adoption. https://t.co/uBNFYGJnD2","NationalAdoptionMonth adoption"
"2015-10-29 ","20:15:49","KeithRothfus","Earlier today I spoke with @WTAJnews about @SpeakerRyan's election and a new vision for the House - airing @ 11pm https://t.co/ORCT3lMRQi",
"2015-10-29 ","20:13:46","KeithRothfus","Earlier today, I spoke with @WPXI about @SpeakerRyan's election and the expected change coming in the House https://t.co/hMV2wayanC",
"2015-10-29 ","15:07:47","KeithRothfus","Congratulations to newly elected @SpeakerRyan. I look forward to the beginning of a new era in the House.",
"2015-09-29 ","14:09:49","KeithRothfus","Excited to watch the @penguins at Cambria County War Memorial Arena, winner of #HockeyvilleUSA #LetsGoPens http://t.co/wbTwtaGNbE","HockeyvilleUSA LetsGoPens"
"2015-06-09 ","15:40:04","KeithRothfus","""Judge to #IRS: Details please"" http://t.co/WCm25V3UUN Watchdog group says: Obama IRS obstructed &amp; lied to a federal judge...","IRS"
"2015-06-09 ","15:32:20","KeithRothfus","Congrats Gary Makosy @tribunedemocrat 29 yr. veteran officer picked as new Chief ""He does it right. He’s a leader..."" http://t.co/dOUkQtbvoy",
"2014-10-22 ","23:35:10","KeithRothfus","PA is one of six states to expand health monitoring, to protect people from #Ebola. http://t.co/Ncqco0hyqk","Ebola"
"2014-10-22 ","22:15:26","KeithRothfus","What do you think? Should the U.S. should ban travel from West African nations affected by Ebola: https://t.co/90hptXEWZ4",
"2014-10-22 ","20:23:24","KeithRothfus","Thoughts and prayers are with our neighbors to the north after attacks in Canadian parliament today.",
"2014-10-22 ","16:05:43","KeithRothfus","Thank you @ChildrensPgh for a great tour of your Pine Center and Children’s North facilities. http://t.co/oHYISh6KWt",
"2014-10-22 ","13:36:25","KeithRothfus","Great turnout at Franklin Regional for Academy Day! http://t.co/Lv8uTNqv4t Interested in a service academy? Visit:http://t.co/rj8iw7MgiT",
"2014-05-21 ","20:42:42","KeithRothfus","We must #EndTrafficking. The House passed 5 bills to help do that; watch my floor speech: http://t.co/wbzvKyOYXH","EndTrafficking"
"2014-05-21 ","18:37:09","KeithRothfus","House is working on #NDAA today to support our men &amp; women in uniform. Read the highlights: http://t.co/wQ2xLpkGyD","NDAA"
"2014-05-21 ","14:02:35","KeithRothfus","Join me this Friday for #CoffeeWithKeith in Ohio Twp at Goodfellas Café &amp; Deli from 3-4 pm. Hope you can make it! http://t.co/2RhuG4RaZJ","CoffeeWithKeith"
"2014-04-01 ","23:15:36","KeithRothfus","Congrats to @AF_Academy on its 60th Anniversary today! Thank you to all the cadets &amp; airmen who serve our country!",
"2014-04-01 ","19:46:09","KeithRothfus","Each day in #April, we’ll highlight a service my office can provide to #PA12. Stay tuned on Facebook: https://t.co/cHS3zxBZDX #30Days30Ways","April PA12 30Days30Ways"
"2014-04-01 ","17:40:40","KeithRothfus","Glad to honor Beaver Falls community servants Sabrina Tench, Renee Suhr, Abby Young &amp; Nya Coleman at @GenevaCollege. http://t.co/F6ghFcmqoL",
"2014-04-01 ","16:20:43","KeithRothfus","#30hr work week in #ACA could affect jobs of 60% of workers ages 19-34. I support #SaveAmericanWorkers Act. The House votes on it this week.","30hr ACA SaveAmericanWorkers"
"2014-04-01 ","13:45:50","KeithRothfus","Here’s what we are voting on in the House this week: http://t.co/1FiFqIsOeB. Please feel free to tweet me your thoughts.",
"2014-02-18 ","23:15:04","KeithRothfus","Reminder: #CoffeeWithKeith tomorrow at Family Grill &amp; Deli in Plum, 4-5pm. Hope to see you there! http://t.co/v0kCf6Kms3","CoffeeWithKeith"
"2014-02-18 ","21:34:51","KeithRothfus","Congratulations to new @penn_state president, Eric J. Barron. It will be great to have you back in Pennsylvania.  http://t.co/mhQp000Rkr",
"2016-07-15 ","13:01:29","RepLouBarletta","ISIS now celebrating attack in Nice. ""Thoughts and prayers"" for victims are not enough. Time for leadership to combat radical Islam.",
"2016-07-05 ","17:36:00","RepLouBarletta","What is clear is that Hillary Clinton believes herself to be above the law. Today, at least, she was right. https://t.co/9BNm8pr90a",
"2016-07-05 ","17:35:15","RepLouBarletta","I respect Director Comey, but am perplexed by decision. Clear violation of law for which others would be punished. https://t.co/9BNm8pr90a",
"2016-02-23 ","22:13:39","RepLouBarletta","Obama plan to close #Gitmo is a bad one. Moving detainees to U.S. is security risk &amp; states don't want them. https://t.co/xcfAP2w8Sy","Gitmo"
"2015-11-25 ","23:14:00","RepLouBarletta","Here's ""The Story So Far"" in the @TLnews of the runaway blimp fiasco, as I still look for answers from the Army. https://t.co/r8Obz4Ut5K",
"2015-11-25 ","21:36:41","RepLouBarletta","My original letter to DoD regarding the blimp's escape on Oct. 28th. (2/2) https://t.co/lz4BkGbUgd",
"2015-11-25 ","21:35:03","RepLouBarletta","The Army replied to my questions about the runaway blimp, reporting that they're investigating. Stay tuned. (1/2) https://t.co/r5gIqiuQ2I",
"2015-10-29 ","15:07:13","RepLouBarletta","@RepPaulRyan will be articulate spokesman for GOP Conf. Enjoys broad support of Freedom Caucus, Tuesday Group, RSC. https://t.co/14BvpcRyu2",
"2015-10-29 ","15:05:06","RepLouBarletta","@RepPaulRyan told me he won't bring amnesty to floor w/Obama in WH &amp; need 'majority of majority' support for bills. https://t.co/14BvpcRyu2",
"2015-10-29 ","14:33:15","RepLouBarletta","If you suffered damage because of the #RunawayBlimp, call Army Claims Services at 301-677-9076.","RunawayBlimp"
"2015-07-14 ","19:47:11","RepLouBarletta","I'll be on a panel talking #SanctuaryCities with @wwwCISorg tomorrow at 9am at @PressClubDC. Highlighting my bill #hr3002.","SanctuaryCities hr3002"
"2015-07-14 ","19:16:31","RepLouBarletta","Concessions to #Iran create recipe for cheating. Too much notice for inspections, time to grow economy, fund terror. http://t.co/0ZO0kYwwBK","Iran"
"2015-06-09 ","19:23:16","RepLouBarletta","Yet another unintended consequence of Obamacare that could hit volunteer firefighters &amp; emergency personnel. http://t.co/sITW8voSOy",
"2012-12-12 ","21:09:29","RepLouBarletta","I was appointed to the U.S. House Homeland Security Committee. http://t.co/8AKwRJ8i #PA11 #NEPA","PA11 NEPA"
"2012-09-25 ","19:41:17","RepLouBarletta","Join @SBAgov for tips from #smallbiz owners who beat the odds &amp; recovered from #disaster @ free webinar on 9/26 http://t.co/Z7GwU7P9 #PA11","smallbiz disaster PA11"
"2012-09-25 ","16:41:56","RepLouBarletta","@SBAgov awarded a $2,357,107 STEP grant to PA. STEP will help #smallbiz with exporting initiatives http://t.co/7oWiPSFQ #PA11 #NEPA","smallbiz PA11 NEPA"
"2012-09-25 ","15:01:58","RepLouBarletta","Today is National Voter Registration Day! Have you registered to vote? If not, visit http://t.co/hMJ3yj0n #PA11 #NEPA #925NVRD","PA11 NEPA 925NVRD"
"2012-08-03 ","21:37:18","RepLouBarletta","I unveiled HR 6296 to the citizens of #PA11 at the Five Mountain Hardware store in Shickshinny. #NEPA http://t.co/v6oq1c8n","PA11 NEPA"
"2012-05-18 ","20:05:14","RepLouBarletta","Join our conversation on the @SocialSecurity Administration’s baby name list on Facebook http://t.co/kPQtRGeZ #PA11 #NEPA","PA11 NEPA"
"2012-05-18 ","14:47:01","RepLouBarletta","Rep. Barletta: The bill to name the Pittston PO after #PA Trooper Joshua D. Miller was passed by the Senate http://t.co/4UnmaTdI #PA11 #NEPA","PA PA11 NEPA"
"2012-03-31 ","00:09:07","RepLouBarletta","Submit your ideas on how to solve some of the biggest challenges facing veterans. Visit  http://t.co/f1ntQexF @DeptVetAffairs #PA11 #NEPA","PA11 NEPA"
"2016-09-21 ","18:41:41","RepCharlieDent","Today, I met with Doug Stamper--I mean @michaeljkellyjr--re: the Older Americans Act! It's a priority to protect &amp; provide for our seniors. https://t.co/48LCztzfC0",
"2016-09-21 ","14:55:06","RepCharlieDent","Thanks to @cspanwj &amp; @PLEchevarria for having me on the program this morning to speak about jobs, immigration, &amp; the budget. https://t.co/BY3yQjO7gS",
"2016-07-15 ","19:50:53","RepCharlieDent","Nos frères et soeurs en France -- nos coeurs sont avec vous. America will stand with you. #ViveLaFrance https://t.co/BTrKP83u4C","ViveLaFrance"
"2016-07-05 ","20:28:29","RepCharlieDent","Interviewed by a Pennsylvania #medialegend today when I spoke with @6abc anchor @Jim_Gardner! https://t.co/ggECy6JQyU","medialegend"
"2016-07-05 ","19:39:55","RepCharlieDent","Congrats 2 Charles Darkes-Burkey! He was awarded my US Congress Citizenship Award by his school! @NorthernLebanon HS https://t.co/4vB9wHqJBV",
"2016-07-05 ","19:32:59","RepCharlieDent","Great performance at the Natl Independence Day Parade in DC by @HASDhawks Marching Band! You made #PA15 proud. 

https://t.co/HHFKonVJpO","PA15"
"2016-06-10 ","21:24:49","RepCharlieDent","I voted to keep the freeze on congressional salaries. Members salaries have remained frozen since 2010. #PayFreeze https://t.co/WMYjofN31f","PayFreeze"
"2016-02-23 ","22:00:17","RepCharlieDent","Honored to be part of @LVC's #150thAnniversary celebration this morning. #GreatCollege https://t.co/xVlf55kzaG","150thAnniversary GreatCollege"
"2015-11-25 ","19:57:32","RepCharlieDent","Congrats @KutztownU's #MarchingBand! Watch @GMA tomorrow &amp; C them march in Philly #ThanksgivingParade! https://t.co/dDTbb5x9un @ReadingEagle","MarchingBand ThanksgivingParade"
"2015-11-25 ","15:04:10","RepCharlieDent","@mcwatchdog @mcall Great article! It's becoming as prevalent as the Pay the IRS over the phone scam. Great Thanksgiving 2 you &amp; your readers",
"2015-10-29 ","21:11:47","RepCharlieDent","Getting ready to go on @cspanwj this morning with @gretabrawner. #LetsTakeSomeCalls https://t.co/bRWo93Pyki","LetsTakeSomeCalls"
"2015-10-29 ","20:15:52","RepCharlieDent","Thinking of my friend and colleague @GregoryMeeks today. Get well soon, Greg.",
"2015-10-29 ","19:52:31","RepCharlieDent","@danholler You mean the BCA caps you opposed?   https://t.co/IOxlQw5Vop #nocredibility","nocredibility"
"2015-10-29 ","19:22:42","RepCharlieDent","Glad 2 vote for #SpeakerRyan. He can lead the House in a commonsense orderly manner. The Speaker understands the importance of governing.","SpeakerRyan"
"2015-06-15 ","17:35:38","RepCharlieDent","Press conf after meetings @ #PhillyVA. @RepBrendanBoyle @RepMeehan @RepAbraham @SanfordBishop @RepRyanCostello http://t.co/U8GBZCCNc9","PhillyVA"
"2015-06-15 ","16:49:16","RepCharlieDent","#PhillyVA @RepMeehan @RepCorrineBrown @RepRyanCostello @RepAbraham @SanfordBishop @RepBrendanBoyle @RepFitzpatrick http://t.co/woKxhDpTIK","PhillyVA"
"2015-06-15 ","16:45:28","RepCharlieDent","Great mtg today w/employees of Philadelphia #VeteransAffairs #RegionalOffice Discussed how to make necessary changes http://t.co/euYGk5t4w6","VeteransAffairs RegionalOffice"
"2015-06-15 ","16:19:53","RepCharlieDent","Very frank discussion w/employees @ the @PhiladelphiaVARO today I appreciated their ideas on better serving #vets @RepAbraham @SanfordBishop","vets"
"2015-06-09 ","19:27:11","RepCharlieDent","@DaviSusan Susan -- I work for Congressman Charlie Dent as his Comms Director. My name is Shawn. Could you send me your e-mail contact? Thx.",
"2014-10-22 ","22:03:12","RepCharlieDent","Our thoughts and prayers are with the people of #Canada today after the attack launched in Ottawa. @ottawacity #NeighborsAndAllies","Canada NeighborsAndAllies"
"2014-10-22 ","21:48:51","RepCharlieDent","#Ebola press conference covered by @6abc http://t.co/7O5Jp9bqV0 We need #RegionalCareCenters Read more: http://t.co/mDbPSF2r8o","Ebola RegionalCareCenters"
"2014-10-22 ","15:07:17","RepCharlieDent","Getting an #Ebola briefing @PennMedicine along w/ @RepFitzpatrick @RepMeehan @chakafattah http://t.co/34FiAVGXPp","Ebola"
"2014-04-01 ","22:05:08","RepCharlieDent","My thanks to @LehighU for hosting @PeaceCorps meeting yesterday  #PeaceCorpsDiplomacy #PeaceCorpsService http://t.co/AnYFsHnEWF","PeaceCorpsDiplomacy PeaceCorpsService"
"2014-04-01 ","22:01:20","RepCharlieDent","With @PeaceCorps Dir. Carrie Hessler-Radelet yesterday to talk with @LehighU students about volunteer opportunities http://t.co/bIQx7TIW0N",
"2013-07-24 ","16:57:23","RepCharlieDent","#JOBFAIR on Saturday, July 27th. 10 AM until 2 PM @LehighCarbonCC -- Berrier Hall. Over #50 employers will be there. Call 610 770 3490 w/?'s","JOBFAIR"
"2013-04-19 ","21:09:49","RepCharlieDent","Got a great photo with Mr. #AdamReitz and the @LibertyHigh seniors in his #Government Class @ the Capitol Steps http://t.co/22vKQRRJ3S","AdamReitz Government"
"2013-04-19 ","16:22:05","RepCharlieDent","#PA-15th #OpenHouse today in #Dauphin County. Sharing an office with #PAStateRep #JohnPayne http://t.co/aZlnanBXbw http://t.co/pfKyYAKEVF","PA OpenHouse Dauphin PAStateRep JohnPayne"
"2016-09-21 ","21:17:28","RepRyanCostello","Speaking at House @Transport hearing this morning on ensuring federal bureaucracy does not complicate local land-use decisions. https://t.co/eTJj2oJWfi",
"2016-07-05 ","19:28:04","RepRyanCostello","Joined several of my colleagues to call on Gov Accountability Office to ensure transparency in Iran nuclear deal https://t.co/O32HkAGLZL",
"2016-06-10 ","18:15:33","RepRyanCostello","Congrats to #PA06 students at @PASDSchools&amp; @PerkValleyHS for earning Schuylkill Scholastic Drinking Water Awards! https://t.co/lxavNdiVsz","PA06"
"2016-02-23 ","16:44:47","RepRyanCostello","Thanks to Cub Scout Pack 215 in West Bradford and Boy Scout Troop 23 in Downingtown for visiting my district office! https://t.co/6tBc7d5fZK",
"2015-11-30 ","15:52:17","RepRyanCostello","Thanks to the @wcdailylocal for covering my recent #LWCF round table discussion in #PA06 https://t.co/pkYuwagBek","LWCF PA06"
"2015-11-25 ","22:00:27","RepRyanCostello","Joined Lebanon Lions Club and @RepCharlieDent for legislative update townhall his afternoon. #PA06 https://t.co/Pn1xHE0GpC","PA06"
"2015-11-25 ","19:00:07","RepRyanCostello","Don't forget to watch the @WCUofPA Marching Band in tomorrow's #MacysParade. They'll arrive at 34th St at 11:44AM https://t.co/j7KH8BUiZa","MacysParade"
"2015-10-29 ","22:00:18","RepRyanCostello","A Halloween #tbt from 1979. I hope you and your family enjoy the fun and treats this weekend. https://t.co/2x6ouvPYsN","tbt"
"2015-10-29 ","20:58:17","RepRyanCostello","Ripon Advance: Costello: VA officials' failure to appear at hearing on IG report 'unacceptable' https://t.co/OqGpuP1R4K #PA06","PA06"
"2015-10-29 ","13:49:17","RepRyanCostello","Waiting to elect the next Speaker of the House. #PA06 https://t.co/CbiVXex1eA","PA06"
"2015-09-29 ","19:11:48","RepRyanCostello","Congratulations to 2 Chester County schools on their National Blue Ribbon School recognition. https://t.co/n0VrRZyBBV #PA06","PA06"
"2015-09-29 ","18:00:17","RepRyanCostello","The @MercuryX has the details on Thursday's Financial Aid Awareness Night: http://t.co/zNi20fbNZz #PA06","PA06"
"2015-09-29 ","00:42:05","RepRyanCostello","I spoke in support of the Ensuring Access to Clinical Trials Act to help patients with rare diseases.  https://t.co/Y7ABUOefyE #PA06","PA06"
"2015-07-14 ","22:23:55","RepRyanCostello","Pleased to meet with some of my constituents involved with PA Christians United for Israel today. @CUFI #PA06 http://t.co/kA8Xorceb2","PA06"
"2015-07-14 ","22:12:38","RepRyanCostello","Enjoyed visiting with @LizChangPoet the 2012 Montgomery County Poet Laureate. #PA06 http://t.co/GbH51m9zrK","PA06"
"2015-07-14 ","21:53:16","RepRyanCostello","The House passed legislation to give our veterans the tools to start their own business.  https://t.co/0nZHMEe0e2 http://t.co/QkMwFaPMAp",
"2015-07-14 ","18:47:44","RepRyanCostello","I took a moment today to emphasize the value of public libraries and their summer programs to communities in #PA06. https://t.co/UxEHKi3Hml","PA06"
"2015-06-15 ","20:56:10","RepRyanCostello","I joined colleagues at the Philly VARO. It's past time for a culture change at the facility. https://t.co/sewKtyKpA5 http://t.co/byi80TutHq",
"2016-09-21 ","22:25:11","RepTomMarino","My bill to protect Americans from excessive regulatory burdens passed the House. Enough is enough. @HouseJudiciary https://t.co/lQ1xIQN3Ob",
"2016-09-21 ","14:04:19","RepTomMarino","TODAY: A common sense solution to reckless regulation forced upon hard-working Americans #REVIEWact @HouseJudiciary https://t.co/9FQpPTM2L8","REVIEWact"
"2016-07-15 ","20:00:40","RepTomMarino","200+ Members sent letter to FBI Director Comey asking for clarity on his suggestion not to prosecute Hillary Clinton https://t.co/xJyDgvKkIx",
"2016-07-15 ","00:33:39","RepTomMarino","I am sickened by the news of yet another terrorist attack. My prayers are with France and all of the victims. This must stop. #PrayForNice","PrayForNice"
"2016-07-05 ","19:56:00","RepTomMarino","A big thank you to the good people at @ShopRiteStores in Mt. Pocono, PA for showing me around! https://t.co/SFXAz9Rwfz",
"2016-02-23 ","21:05:15","RepTomMarino","I see zero merit or compelling evidence to suggest closing #Gitmo is a top national security priority or advances our interests abroad.","Gitmo"
"2016-02-23 ","20:44:06","RepTomMarino","TMRW the House will debate the Eric Williams #CorrectionalOfficer Protection Act (S.238) 1 day ahead of the 3 yr anniv of his tragic passing","CorrectionalOfficer"
"2016-02-18 ","19:22:50","RepTomMarino","Enjoyed mtg @SHO_Homeland’s Gideon Raff, a combat vet, abt a bill to improve troop training-save $ &amp; protect animals https://t.co/hJn1Ym30hO",
"2015-09-29 ","21:39:40","RepTomMarino","Proud cosponsor of @RepMeehan's, Justice for Victims of Iranian Terrorism Act -Ensures #NotOneCent of $43.5B in sanctions relief for #Iran","NotOneCent Iran"
"2015-09-29 ","15:48:54","RepTomMarino","Today Waverly Elementary School is recognized as a #NationalBlueRibbonSchool Congrats and Go Comets! //www.ahsd.org/","NationalBlueRibbonSchool"
"2015-07-14 ","19:51:35","RepTomMarino","Congrats to flavafraz21 on your #HomerunDerby #victory last night. I remember watching your… https://t.co/MoFkyI0RhA","HomerunDerby victory"
"2015-07-14 ","19:46:12","RepTomMarino","DHS must take steps to end #sanctuary policies and protect our citizens http://t.co/ti3YAk7Xmz","sanctuary"
"2015-07-14 ","18:19:51","RepTomMarino","@MEPFuller but the #IranDeal is like giving up Charizard, Blastoise and Machamp for Chansey.","IranDeal"
"2015-07-14 ","14:40:37","RepTomMarino","Getting ready to question #DHS secretary #JehJohnson at the House #JudiciaryCommitte this morning. He… https://t.co/O0BcgmvxWz","DHS JehJohnson JudiciaryCommitte"
"2014-10-22 ","21:12:37","RepTomMarino","I am deeply saddened to hear of the events at Canadian Parliament today. My counterparts there are our friends &amp; allies. We #PrayForOttawa","PrayForOttawa"
"2014-10-22 ","18:52:54","RepTomMarino","@GretchenCarlson You'r right the NTAS system has not been used under Obama's watch. Unacceptable given current events http://t.co/neHjP5w7tF",
"2014-04-01 ","20:05:10","RepTomMarino","MT @RepAnnaEshoo: Intro'd resolution w/@RepJoeKennedy &amp; @USRepKeating calling on Turkey 2 reinstate #Internet freedom http://t.co/zKL5pUzDUJ","Internet"
"2013-07-24 ","19:36:20","RepTomMarino","Our #military should have access to the best platforms, weapons, and equipment to ensure optimum readiness. #DefenseApprops","military DefenseApprops"
"2013-07-24 ","14:58:57","RepTomMarino","#HR1493 gives America’s #smallbiz and job creators relief from the flood of new #regulations and #RedTape #4jobs","HR1493 smallbiz regulations RedTape 4jobs"
"2013-07-24 ","14:45:49","RepTomMarino",".@RepDougCollins bill takes on #RegReform by ending abusive “sue-and-settle” practice &amp; respecting the basic rights of Americans. #HR1493","RegReform HR1493"
"2013-07-24 ","14:07:25","RepTomMarino","@johnmac75  I am a cosponsor of H.Res. 36 and fully support it so please don't suggest that I am not.",
"2013-07-24 ","13:48:01","RepTomMarino","…and @MarkAmodeiNV2, @RepJoBonner, @HowardCoble, @RepTrentFranks, &amp; Rep. Jason Smith (MO). #RAPIDAct","RAPIDAct"
"2013-07-24 ","13:36:53","RepTomMarino","Today, @HouseJudiciary will mark up several #RegReform bills including the #RAPIDAct, which I introduced earlier this year. #HJC113","RegReform RAPIDAct HJC113"
"2013-06-05 ","21:21:19","RepTomMarino","#SusanRice will serve as POTUS's next nat'l security advisor. Here's why I disagree w/ this appointment --&gt; http://t.co/JmKkdb0leN #benghazi","SusanRice benghazi"
"2013-06-05 ","17:24:23","RepTomMarino","You can become a #CitizenCosponsor of house bills w/ @GOPLeader's new initiative: http://t.co/IbEFUCFR69 RT w/ the bills you support!","CitizenCosponsor"
"2013-06-05 ","13:55:55","RepTomMarino","At 10am, @HouseJudiciary subcommittee on reg reform will hear expert testimony on HR1493. For more info &amp; LIVE feed: http://t.co/VcsWLZPnSr",
"2012-07-18 ","12:54:06","RepTomMarino","ICYMI @SenRandPaul intro'ed One Subject at a Time Act in Senate. Tell Sens&amp;Reps to cosponsor #HR3806 and #S3359. #osta http://t.co/cXsZEuJQ","HR3806 S3359 osta"
"2012-05-18 ","19:27:25","RepTomMarino","Thank you! MT @jeffdstratton: In #DC for the day...just had meeting w/@RepTomMarino along w/a group of @pvbi students. Great guy!","DC"
"2012-05-18 ","14:10:56","RepTomMarino","#FF Fellow freshman Judiciary members calling 4 #Holder contempt vote: @RepDennisRoss @TGowdySC @RepSandyAdams @RepTimGriffin @bquayle","FF Holder"
"2012-05-18 ","13:56:32","RepTomMarino","MT @repdennisross: GOP frosh press 4 Holder contempt vote http://t.co/A1zABl9r @TGowdySC @RepSandyAdams @RepTimGriffin @bquayle",
"2016-07-15 ","15:26:46","RepFitzpatrick","This week Grace Piznar and Vikki Rueda-Juarez, from Yardley and New Hope, stopped by Washington DC office. Grace... https://t.co/cM8d269rJQ",
"2016-07-15 ","02:12:13","RepFitzpatrick","Heartbreaking news coming out of Nice, France. Our hearts and prayers are with the victims of this senseless... https://t.co/0lJNaazmiP",
"2016-07-05 ","16:11:17","RepFitzpatrick","ICYMI: Read my latest #CongressmansNotebook as seen in the Bucks County Courier Times and The Intelligencer:... https://t.co/a2XZ9xAySG","CongressmansNotebook"
"2016-06-10 ","17:23:46","RepFitzpatrick","Two Bills. Two Stories. One Purpose. https://t.co/hY0S8eXGj0",
"2016-02-23 ","13:47:33","RepFitzpatrick","How great is this? https://t.co/4R2hNPpIZk",
"2016-02-18 ","13:39:44","RepFitzpatrick","""U.S. Representative Mike Fitzpatrick, a Pennsylvania Republican who has introduced a bill to remove Essure from... https://t.co/Hx8XDz5nqR",
"2015-10-29 ","21:30:01","RepFitzpatrick","I've worked with Congressman Ryan and am proud that he has been chosen as our Speaker. He's tough but fair, a... https://t.co/zuh0Kfq2rI",
"2015-10-29 ","19:19:02","RepFitzpatrick","Congrats to @SpeakerRyan!

My statement--&gt; https://t.co/PcIEPUSQHx https://t.co/yfneZL1XjT",
"2015-10-29 ","15:28:31","RepFitzpatrick",".@SpeakerRyan is sworn in. https://t.co/Cvdgf7BzqA",
"2015-10-29 ","14:49:29","RepFitzpatrick","Congrats to @SpeakerRyan!

My statement--&gt; https://t.co/PcIEPUBfPZ https://t.co/8BFmlQhRQr",
"2015-10-29 ","12:00:02","RepFitzpatrick","As an Eagle Scout myself, it's always a pleasure celebrating the accomplishments of fellow scouts.... https://t.co/ZrhDwSMVU7",
"2015-09-29 ","11:26:30","RepFitzpatrick","Thanks to all the Bucks &amp; Montgomery county high school students who came out this past weekend for my Service... http://t.co/7jDLkQJRaI",
"2015-07-14 ","22:00:01","RepFitzpatrick","I have deep concerns about the direction the Obama Administration has taken in reaching this agreement with #Iran.... http://t.co/ykJ2zWECun","Iran"
"2015-07-14 ","18:55:39","RepFitzpatrick","Let's not forget: #Iran is the world's leading state sponsor of terror. http://t.co/c0lMOUL2Ri http://t.co/4c78mLbT3P","Iran"
"2015-07-14 ","15:18:13","RepFitzpatrick","My full statement on the #IranDeal http://t.co/CMkllGH2op","IranDeal"
"2015-07-14 ","13:29:19","RepFitzpatrick","This deal is under Congressional authority to review &amp; I will only support if it meets the benchmark of forever preventing a nuclear Iran",
"2015-07-14 ","13:27:49","RepFitzpatrick","Information I feel is vital to the Admin., Congress and American ppl when reviewing any agreement with Iran that includes sanctions relief.",
"2015-07-14 ","13:27:15","RepFitzpatrick","Nxt wk, the Task Force to Investigate Terrorism Financing will take a closer look at Iran’s role in financing terror groups around the world",
"2015-07-14 ","13:26:19","RepFitzpatrick","And have unapologetically continued their state sponsorship of terrorism.",
"2015-07-14 ","13:26:11","RepFitzpatrick","Even during negotiations, Iranian leaders have spewed hateful language towards the United States, Israel and the Jewish people",
"2015-07-14 ","13:26:00","RepFitzpatrick","Or that the Iranian regime is truly committed to joining the international community.",
