"Date","Time","screen_name","text","hashtags"
"2015-09-29 ","18:03:00","RepSteveIsrael","Glad to see US &amp; China working together to end #ivory trade. We must do more to save elephants from extinction @HumaneSociety @TheWCS","ivory"
"2015-09-29 ","17:32:15","RepSteveIsrael","Happy 50th @NEHgov! As a true history buff TY for continuously bringing it to life for future generations #NEHturns50 http://t.co/N26avbs2d0","NEHturns50"
"2015-09-29 ","16:13:42","RepSteveIsrael","I #StandWithPP because I stand with women’s constitutional right to make their own choices about their health care &amp; bodies #PinkOut","StandWithPP PinkOut"
"2015-09-29 ","15:36:50","RepSteveIsrael",".@HouseGOP aggression and disrespect directed at @CecileRichards in this hearing is disgusting #StandWithPP #PinkOut","StandWithPP PinkOut"
"2015-07-14 ","21:35:35","RepSteveIsrael","Hosting Bipartisan Taskforce for Combatting #Antisemitism mtg w/ experts to fight against online hate speech http://t.co/TVdP1KU2cD","Antisemitism"
"2015-07-14 ","21:05:36","RepSteveIsrael","I will be on @cnntoday at 5:15 to discuss the #IranDeal @cnni @holmescnn @AmaraCNN","IranDeal"
"2015-07-14 ","13:47:15","RepSteveIsrael","Read my statement on the #IranDeal http://t.co/9ppy78ri5q","IranDeal"
"2015-06-15 ","15:45:46","RepSteveIsrael","I honored local ""High School Heroes"" for their charitable work across #NewYork and around the world http://t.co/0i4yiv8UP3","NewYork"
"2015-06-15 ","15:30:32","RepSteveIsrael","#ICYMI: The @washingtonpost Ed Board endorses my bill to ban undetectable plastic firearms http://t.co/IoNuLNHisW #gunsafety","ICYMI gunsafety"
"2015-06-09 ","16:29:25","RepSteveIsrael","Speaking at #LGA abt recent #TSA failures &amp; my bill 2 ban undetectable plastic firearms 2 protect American travelers http://t.co/gds8PRU5FG","LGA TSA"
"2014-10-22 ","15:49:28","RepSteveIsrael","At Bethpage FD alerting families: make sure your college housing has fire sprinklers. http://t.co/XvG8sU0Aba",
"2014-10-22 ","14:40:17","RepSteveIsrael","Thanks to @Mets for attending Suffolk vets jobs expo today w @SteveBellone, @TimBishopNY and local employers. http://t.co/0cnCeLjcSm",
"2014-10-22 ","13:54:30","RepSteveIsrael","Headed to Vets Emplymnt Xpo @ Suff Ctty College Brentwood w @SteveBellone @TimBishopNY. If you're a vet in job market, join us.",
"2014-10-22 ","00:14:04","RepSteveIsrael","An amazing visit to the Helen Keller Natl Institute in Sands Point today. http://t.co/2uu2OV0xTk",
"2014-05-21 ","22:18:06","RepSteveIsrael","Had a great time at Mayors' Day today with Mayors from Sea Cliff, Old Brookville, Bayville, Plandome and Glen Cove! http://t.co/EkF49woUyg",
"2014-05-21 ","18:43:48","RepSteveIsrael","Great to meet with you! RT @shanemoneyman @NAIFA thanks @RepSteveIsrael for your time today http://t.co/sUeZQDnlFw",
"2014-05-21 ","18:35:48","RepSteveIsrael","Good mtg w Liz Birney of @ZOA_Campus on US-Israel relations. http://t.co/IpBba7yTVd",
"2014-05-21 ","17:28:03","RepSteveIsrael","Climate change threatens NY's economy and our children's future. Today we will #SoundTheAlarm4Climate action. @SEEC http://t.co/ImMrkdZMef","SoundTheAlarm4Climate"
"2014-04-01 ","19:18:12","RepSteveIsrael","GOP budget keeps oil company subsidies but slashes Alzheimer’s and related research by $100 billion.",
"2014-04-01 ","17:52:37","RepSteveIsrael","The House GOP budget slams the middle class &amp; protects the special interests.",
"2014-04-01 ","17:01:17","RepSteveIsrael","In Hunt. Station today, announced my bill to stop juveniles who committed violent crimes from buying firearms. http://t.co/bZtXqLctZ9",
"2014-04-01 ","15:25:18","RepSteveIsrael","Very sad. Thoughts are w/ the families MT @FiOS1News_LI Bus crash in #RoslynHeights, #Roslyn Rd Reports of fatalities http://t.co/8KpEDrSbNu","RoslynHeights Roslyn"
"2014-10-22 ","17:57:28","TimBishopNY","BISHOP HAILS SOCIAL SECURITY BENEFIT INCREASE http://t.co/84eaF6JwtL",
"2014-05-21 ","22:38:26","TimBishopNY","Last night I offered a burn pit amendment to the #NDAA, read more: http://t.co/aXGMwMOKAX","NDAA"
"2014-05-21 ","21:01:31","TimBishopNY",".@nasiripour I recently introduced a bill to protect students from these actions by private lenders http://t.co/IqND6Rqqd6",
"2014-05-21 ","14:14:02","TimBishopNY","Speaking with students from Center Moriches Middle School. Welcome to DC! http://t.co/JzDWAXrKPu",
"2014-05-21 ","14:11:04","TimBishopNY","Beautiful day outside the U.S. Capitol speaking with students from Center Moriches Middle School. http://t.co/pnWpYr2Fih",
"2014-04-01 ","14:54:16","TimBishopNY","Congrats Kwasi Enin of @WilliamFloydSD for being accepted to all 8 Ivy's! That is an incredible accomplishment and we are all very proud!",
"2013-07-24 ","23:46:34","TimBishopNY","Happy to hear @NYGovCuomo announce yesterday that qualified same-sex spouses in #NYS now eligible for tax refunds https://t.co/Pesfdxypfm","NYS"
"2013-07-24 ","21:59:26","TimBishopNY","http://t.co/JUly7ZQb4c",
"2013-07-24 ","21:27:39","TimBishopNY","Just met with Jamie Ging, an @stonybrooku student participating in the @usnistgov Summer Program. Good luck Jamie! http://t.co/oOzowj2Cp1",
"2013-07-24 ","20:17:03","TimBishopNY",".@USCG Thank you for the heroic rescue of an LI  lobster fisherman who went missing off the coast of Montauk overnight.",
"2013-07-24 ","18:21:02","TimBishopNY","Moments ago I spoke on my Federal Price Gouging Prevention  bill. Time to protect consumers from rising gas prices! http://t.co/7y7r0AhKfp",
"2013-06-05 ","19:17:36","TimBishopNY","How will #students in #NY be affected by a spike in student loan rates? check out this report:http://t.co/VrOeAfbyjE","students NY"
"2013-06-05 ","17:58:15","TimBishopNY","The percentage of 25 year olds with student debt as risen from 25% in 2003 to 43% in 2012. #DontDoubleMyRate http://t.co/LzekpTqUjF","DontDoubleMyRate"
"2013-06-05 ","15:49:08","TimBishopNY","Did you know student loan debt exceeds 1Trillion dollars?!? RT and spread the word. #DontDoubleMyRate http://t.co/ZtXOVcYoz6","DontDoubleMyRate"
"2013-06-05 ","14:58:23","TimBishopNY","Over the past 10 years the average student loan balance held by 25 year old's has grown 91% #DontDoubleMyRate http://t.co/qPbObAmH63","DontDoubleMyRate"
"2013-06-05 ","13:56:49","TimBishopNY","If Congress doesn't act, student loan rates will double on July 1st. Join me in spreading the word #DontDoubleMyRate","DontDoubleMyRate"
"2013-03-11 ","15:14:35","TimBishopNY","Had a very productive meeting this morning with @LICivicEngage to discuss the economic benefits of #immigrationReform http://t.co/qs8hvBrQ6o","immigrationReform"
"2012-05-18 ","15:07:45","TimBishopNY","Federal transportation dollars should not be used to outsource American jobs. It doesn't make sense. It isn't right. http://t.co/gYDnw5Fy",
