"Date","Time","screen_name","text","hashtags"
"2016-09-21 ","20:04:28","SenatorWicker","Proud to recognize @PinelakeChurch as 2016 Angel in Adoption for its leadership in adoption &amp; foster care within MS: https://t.co/4McVljxhpo https://t.co/Fs4TnnYgTu",
"2016-09-21 ","19:53:27","SenatorWicker","Great news for central MS! #Jackson airport gets $3.8M FAA grant for critical improvements to runway &amp; lighting: https://t.co/BV9ut4CMki","Jackson"
"2016-09-21 ","18:02:39","SenatorWicker","MS &amp; 20 other states sued fed govt to block @USDOL’s Overtime Rule: https://t.co/rPST3yXE8n - #WickerReport on Rule: https://t.co/3tRhoQW88E","WickerReport"
"2016-09-21 ","17:41:03","SenatorWicker","Today is #WorldAlzheimersDay. #EUREKA unleashes the power of prizes to stop this devastating disease. Together we can find a cure. #EndAlz https://t.co/GuiFI3mlCZ","WorldAlzheimersDay EUREKA EndAlz"
"2016-07-15 ","18:11:23","SenatorWicker","Appreciate @LindseyGrahamSC supporting my #EUREKA bill as my 60th cosponsor! Let's work together to find a cure for Alzheimer's. #EndAlz","EUREKA EndAlz"
"2016-07-15 ","17:22:50","SenatorWicker","Glad to be working w/ @SenJoniErnst on my #EUREKA legislation to find a cure for Alzheimer’s. With a prize, we pay only for success. #EndAlz","EUREKA EndAlz"
"2016-02-23 ","21:44:12","SenatorWicker","Joined @SenateMajLdr, @JimInhofe, &amp; 202 other Members in filing amicus brief to overturn EPA’s costly, unattainable #CleanPowerPlan.","CleanPowerPlan"
"2016-02-23 ","20:18:46","SenatorWicker","POTUS’s misguided #GTMO plan cld endanger Americans &amp; have serious implications on our natl security strategy: https://t.co/DOgU53TJJ1","GTMO"
"2016-02-23 ","16:43:13","SenatorWicker","My deepest sympathies are with Agent Lee Tartt's family today. https://t.co/zklAUiB2hB",
"2016-02-18 ","20:49:37","SenatorWicker","Enjoyed meeting @RCMHSEagles cheerldrs during today's rail event. Thanks for cheering us on! 🚂 #YallAboard #OneCoast https://t.co/jQMaXGkhQh","YallAboard OneCoast"
"2016-02-18 ","19:07:56","SenatorWicker","Heading into #Pascagoula! @Amtrak #OneCoast #YallAboard https://t.co/J4s7cCChVv","Pascagoula OneCoast YallAboard"
"2016-02-18 ","17:59:20","SenatorWicker","We have made it to #Biloxi! With @USDOTFRA Administrator @FeinbergSarah. @Amtrak #OneCoast #YallAboard #GulfCoast https://t.co/QSKSlByQRw","Biloxi OneCoast YallAboard GulfCoast"
"2016-02-18 ","17:29:21","SenatorWicker","This represents another step in our continued effort to recover from Katrina! #yallaboard #Gulfport #OneCoast https://t.co/FGPXtZWCqg","yallaboard Gulfport OneCoast"
"2016-02-18 ","17:27:25","SenatorWicker","Let's work to make passenger #rail a reality for the #GulfCoast! @Amtrak #yallaboard #BayStLouis https://t.co/mtgcfwVPmV","rail GulfCoast yallaboard BayStLouis"
"2016-02-18 ","15:24:48","SenatorWicker","And we're off! Riding the @Amtrak #GulfCoast inspection train. Next stop: Bay St. Louis #yallaboard https://t.co/I640F21oti","GulfCoast yallaboard"
"2015-11-30 ","22:18:22","SenatorWicker","Good news! The House just passed my #RuralWater bill. It's now headed to @POTUS’s desk to be signed. #S611","RuralWater S611"
"2015-11-30 ","20:07:29","SenatorWicker","View from the center of the dome in the Mississippi State Capitol building in #Jackson. #MississippiMonday https://t.co/S7rYiymye8","Jackson MississippiMonday"
"2015-11-30 ","19:50:26","SenatorWicker","In this week’s #WickerReport: @POTUS’s #climate promises would have minimal enviro impact, GDP could lose $154B: https://t.co/Zon4jbdCoi","WickerReport climate"
"2015-10-29 ","21:07:30","SenatorWicker","Thanks to @SenJeffMerkley, a quarter of the U.S. #Senate has now cosponsored my #EUREKA bill! #EndAlz","Senate EUREKA EndAlz"
"2015-10-29 ","16:11:36","SenatorWicker","My #RuralWater Bill was passed by #SubEnvEcon. Proposal would help small communities supply safe drinking water: https://t.co/z2SyzayHDz","RuralWater SubEnvEcon"
"2015-09-29 ","21:10:22","SenatorWicker","Honored to receive the @AmericanCancer Society’s Advocacy Award. Impt that screenings remain affordable for seniors: http://t.co/KINWu8nVZb",
"2015-09-29 ","20:58:24","SenatorWicker","The cost of power is going to explode under @POTUS’s #CleanPowerPlan regs. Questioned @EPA’s Janet McCabe this AM: http://t.co/KINWu8nVZb","CleanPowerPlan"
"2015-09-29 ","16:31:25","SenatorWicker","Congrats to #Jackson’s Casey Elementary School for being recognized as a 2015 @NatlBlueRibbon School! http://t.co/5pshqF5Xhh #education","Jackson education"
"2015-07-14 ","19:17:56","SenatorWicker","It’s time to consider new innovative ways to help find &amp; fund a cure for #Alzheimer’s: http://t.co/oO5tq0Nh9d #EUREKA #EndALZ","Alzheimer EUREKA EndALZ"
"2015-07-14 ","15:04:46","SenatorWicker","Skeptical that the Iranian regime will live up to its obligations in the #IranDeal. Ready to review the agreement: http://t.co/aaHNuZFJT6","IranDeal"
"2015-07-14 ","13:11:17","SenatorWicker","ICYMI: Spoke on the Senate floor last night w/ @SenatorShaheen ab the 20-yr anniversary of the #Srebrenica massacre: http://t.co/gTWdVtL7Wm","Srebrenica"
"2015-06-15 ","18:54:41","SenatorWicker","Congrats to my hometown, #Tupelo, for receiving its 5th @AllAmericaCity Award. A well-deserved honor! http://t.co/fSEqhuGhFZ #AAC15","Tupelo AAC15"
"2015-06-15 ","15:25:25","SenatorWicker","In this week’s #WickerReport: Our troops deserve a #defense bill that presents real solutions to current challenges: http://t.co/2DH3ypevxW","WickerReport defense"
"2015-06-09 ","22:50:44","SenatorWicker","Excited to welcome Rep. Trent Kelly to MS’s congressional delegation. Confident that he’ll be a great Rep for #MS01: http://t.co/5WwKiV8RR4","MS01"
"2015-06-09 ","20:34:46","SenatorWicker","I am speaking on the @SenateFloor now about #NDAA. Watch here: http://t.co/rWm2IZMPKA.","NDAA"
"2015-06-09 ","20:01:34","SenatorWicker","Despite #Obamacare’s goal of providing affordable health-care, insurance premiums are rising: http://t.co/HjqzZETJYJ","Obamacare"
"2015-06-09 ","19:03:04","SenatorWicker","#Obamacare has been problematic from the start, with higher costs, lower quality, and people losing their coverage.","Obamacare"
"2015-06-09 ","17:09:17","SenatorWicker","Would take more than a “one-sentence provision” to fix #Obamacare. Needs to be replaced. http://t.co/xrLdHM0Tte","Obamacare"
"2015-06-09 ","16:24:55","SenatorWicker","#Obamacare is broken. Americans deserve a market-driven health-care system that puts patients first.","Obamacare"
"2015-06-09 ","16:20:44","SenatorWicker","#Obamacare rates are set to skyrocket, with the average premiums in MS hiking 24.7% for 2016: http://t.co/Hl5X4vNIHH","Obamacare"
"2015-06-09 ","16:13:29","SenatorWicker","Americans are being forced to pay higher premiums as a result of #Obamacare: http://t.co/Lek2ni3K7I","Obamacare"
"2015-06-09 ","16:05:56","SenatorWicker","Hospitals are struggling to provide high-quality care due to Obamacare cuts, rising costs: http://t.co/HjqzZETJYJ",
"2015-06-09 ","15:59:08","SenatorWicker","Americans do not want a one-size-fits-all approach to #healthcare. 54% of Americans oppose #Obamacare: http://t.co/mUlgMg344Y","healthcare Obamacare"
"2014-05-21 ","22:05:10","SenatorWicker","This bill that would enhance Mississippi’s vast waterway infrastructure and improve storm protection projects: http://t.co/wMl8yK5z9f #WRDA","WRDA"
"2014-05-21 ","21:01:56","SenatorWicker","On the @SenateFloor right now talking about how the #WRDA bill would benefit #Mississippi. Watch here: http://t.co/ePcJjAtjA6","WRDA Mississippi"
"2014-05-21 ","17:55:21","SenatorWicker","ER visits rise under #Obamacare. Yet another failure of this disastrous law: http://t.co/gkiXUxSRfM See my record: http://t.co/ZDxnOq39wE","Obamacare"
"2014-04-01 ","16:51:03","SenatorWicker","Listen to my interview with @MPBOnline on #Obamacare: http://t.co/SfNMUEhlnW","Obamacare"
"2014-02-18 ","17:03:04","SenatorWicker","ICYMI: Here's my interview with @BillHemmer this morning on @FoxNews on how #Obamacare is killing American jobs: http://t.co/MrauSwzC4O","Obamacare"
"2014-02-18 ","16:55:06","SenatorWicker","ICYMI: I was on @Morning_Joe this morning talking about military pensions and some insights from working w/ @JoeNBC http://t.co/7KHmX7YDf2",
"2014-02-18 ","16:02:43","SenatorWicker","This week's #WickerReport: GOP's Strategies to Lower Costs, Increase Choice Would Replace President’s Disastrous Law http://t.co/7H9pbKeIGd","WickerReport"
"2014-02-18 ","13:34:00","SenatorWicker","Looking fwd to joining @BillHemmer on @AmericaNewsroom at approx 8:08am CT.",
"2014-02-18 ","12:24:28","SenatorWicker","Visiting with the @Morning_Joe crew this morning in the studio at approx. 6:40am CT. Tune in!",
"2016-09-21 ","18:23:10","SenThadCochran","The scheduled Agriculture, FDA Appropriations hearing will now begin after the Senate vote this afternoon. https://t.co/oLAWRLJKIJ",
"2016-09-21 ","17:09:42","SenThadCochran","2:30 pm Webcast: @JerryMoran chairs Ag Approps hearing on the @US_FDA Role in the Generic Drug Marketplace: https://t.co/Re17kGHnnj",
"2016-09-21 ","15:02:51","SenThadCochran","#Obamacare is resulting in fewer choices, higher costs &amp; bigger IRS tax penalties. Relief options are available. https://t.co/bTmqmBbpxt https://t.co/INuLP1mLpo","Obamacare"
"2016-09-21 ","13:27:34","SenThadCochran","10:30 am Webcast: @SenatorCollins chairs hrg on 'Housing Vulnerable Families &amp; Individuals: Is There a Better Way?' https://t.co/WIqjrrJZbd",
"2016-07-15 ","18:22:39","SenThadCochran","Kudos to @NGulfInst @msstate @SouthernMiss on new @NOAA pact for Gulf of Mexico research: https://t.co/V6RiVPxd9Z https://t.co/dWG0IW0uI6",
"2016-07-15 ","15:45:39","SenThadCochran","Senate already moving to fund programs to combat #opioidepidemic, which affects Miss., U.S. https://t.co/kXeHt1fsOh https://t.co/uf6ZFuDqfn","opioidepidemic"
"2016-06-10 ","12:49:50","SenThadCochran","Good morning.  Senate FY2017 Labor, HHS, Education Appropriations Bill (S.3040) and Report available here:  https://t.co/zy0i4MSrrm",
"2016-02-23 ","22:40:07","SenThadCochran","Congratulations, @ronagnew, on this well-deserved honor. https://t.co/Y6Ig9BIlxb",
"2016-02-23 ","20:27:36","SenThadCochran","Bipartisan prohibitions on transferring #GITMO terrorist detainees to the US won't be set aside any time soon. https://t.co/pdwuJ35tIX","GITMO"
"2016-02-18 ","20:53:03","SenThadCochran",".@NatlParkService awards $670,000 grant to help save historic Miss. battlefield. @VisitVicksburg @CivilWarTrust https://t.co/dZGAilnCGU",
"2015-11-25 ","19:06:19","SenThadCochran","Thanks @USDA for at last issuing final inspection rule to ensure safe &amp; nutritious #catfish for American families. https://t.co/ebgsxRcQha","catfish"
"2015-09-29 ","17:28:31","SenThadCochran","Congrats to Casey Elementary in Jackson, named a @NatlBlueRibbon School for 2015! http://t.co/c0xOCdJgXN",
"2015-09-29 ","14:58:33","SenThadCochran",".@SenJohnHoeven chairs 11:15 am Homeland Security Approps hearing on @TSA response to IG findings. Watch webcast: http://t.co/KkJS1oUwP1",
"2015-09-29 ","01:53:03","SenThadCochran","National Preparedness Month: Always a good idea to have a household emergency plan. Visit @FEMA http://t.co/xmL3evtR4C for ideas.",
"2015-07-14 ","22:04:37","SenThadCochran","I am skeptical whether the #IranDeal reached by the Obama administration is truly verifiable and enforceable: http://t.co/8EteDIPDn5","IranDeal"
"2015-07-14 ","18:23:20","SenThadCochran","2:30 pm today, @JerryMoran leads subcommittee markup of FY16 @USDA @usdaRD @USDA_NRCS @US_FDA Appropriations Bill: http://t.co/EYsSoul1ps",
"2015-06-09 ","23:27:48","SenThadCochran","Congratulations on your swearing-in, Congressman Kelly. I look forward to working with you for our state. http://t.co/vM9zrQ0RsT",
"2015-06-09 ","14:22:50","SenThadCochran","Staring soon! Senate Appropriations Subcommittee markup of FY16 @DeptofDefense Appropriations Bill. Audio webcast:  http://t.co/ivI1ileXFc",
"2014-10-22 ","22:32:38","SenThadCochran","With @SenatorWicker @RepAlanNunnelee, pleased @FEMA recovery aid support Winston Co. jobs, health care restoration: http://t.co/P6DDsdLTHE",
"2014-10-22 ","18:48:02","SenThadCochran","Reminder: #FarmBill &amp; Crop Insurance Listening Sessions are a week from today; 2 events in Mississippi, Wed, Oct 29. http://t.co/IAVb7mFitn","FarmBill"
"2014-04-01 ","23:02:43","SenThadCochran","Appreciate @FEMA working with us to help the @CityofGulfport repair hurricane damaged piers &amp; jetties: http://t.co/W5VHC83wvy @VisitMSCoast",
"2014-04-01 ","00:46:50","SenThadCochran","Pleased to have 10k followers. I enjoy hearing from &amp; sharing w/Mississippians. We have a lot to be thankful for &amp; to work toward together.",
"2014-02-18 ","20:26:49","SenThadCochran","Obama's stimulus didn't work. ICYMI: @WashTimes Five years on, and there’s no sign of the promised ‘Recovery Summer’ http://t.co/gpPtRhZshT",
"2013-07-24 ","22:33:36","SenThadCochran","The Obama administration should take a 'do no more harm' approach when it comes to #energy &amp; our #economy: http://t.co/zliSfxDO1y","energy economy"
"2013-07-24 ","21:23:10","SenThadCochran","While the President talks about the #economy, I met w/@MSManufacturers who create #jobs despite rules &amp; regulations. http://t.co/7ImoEPnAeV","economy jobs"
"2013-07-24 ","20:07:07","SenThadCochran","Just met w/#Gulfport Mayor Hewes &amp; #Biloxi Mayor Holloway on flood insurance rate hikes. They’re concerned &amp; I’ll work w/them to help. @FEMA","Gulfport Biloxi"
"2013-07-24 ","13:51:18","SenThadCochran","#Obama at #KnoxCollege 2005: 5% unemployment, 7.5M jobless. As President pivots back to the economy today: 7.6% unemployment, 11.8M jobless.","Obama KnoxCollege"
"2013-06-05 ","17:47:09","SenThadCochran",".@SenatorWicker &amp; I back a bill to stop @EPAgov use of ""guidance"" to expand Clean Water Act regulations: http://t.co/KvUSgPsE6Y #4Jobs","4Jobs"
"2013-04-19 ","19:55:50","SenThadCochran","Glad to see @PBSNeedToKnow spotlight on MS financial literacy #education program: @DeltaState @MPBOnline http://t.co/YAGyXL1zNV","education"
"2013-04-19 ","15:56:17","SenThadCochran","2014 Military Service Academies nomination information for #Mississippi students is now available on my website: http://t.co/udmwevkh1Z","Mississippi"
"2013-03-11 ","20:08:44","SenThadCochran","Enjoyed visiting the Jason &amp; Helen Hale family of Oxford MS and all those who attended my annual Spring Break Coffee. http://t.co/KzODd8cgRm",
"2012-09-25 ","18:06:10","SenThadCochran","Look forward to working with new leadership at @NASAStennis, and thank Patrick Scheuermann for service to Mississippi: http://t.co/6kcgMO3w",
"2012-08-03 ","20:22:59","SenThadCochran","Thankful for work of interns like @MSState's David Clarke, Laurie Morgan, Georgia Jordan, Spencer Leflore &amp; Hudson Frey http://t.co/jTiv1jeL",
"2012-07-18 ","20:26:14","SenThadCochran","Miss. counties get @USDA #drought disaster designation; effects on farmers, ecology &amp; economy deserve attention: http://t.co/OFGYGXRZ","drought"
