"Date","Time","screen_name","text","hashtags"
"2016-09-21 ","19:41:58","JimInhofe","What a privilege to met &amp; hear from the Gibsons of Guthrie about their adoption of 8 kids from foster care https://t.co/yY4VsmXbDQ",
"2016-09-21 ","16:43:10","JimInhofe","LIVE on #Periscope: Speaking at The Atlantic Council on the topic of nuclear energy &amp; encouraging innovation   https://t.co/yKxLqmrWO4","Periscope"
"2016-09-21 ","16:39:36","JimInhofe","About to start @AtlanticCouncil event where @SenWhitehouse &amp; I will talk about our nuclear energy bill. Live here: https://t.co/5UkZS6WKfr",
"2016-07-05 ","17:07:43","JimInhofe","To not hold Hillary accountable will further erode the public’s trust in our legal system...https://t.co/ujyfGITksR",
"2016-07-05 ","17:06:54","JimInhofe","While the FBI called Hillary's server as “gross negligence” in its report, I say that this is obvious intentional mishandling.",
"2016-07-05 ","17:05:50","JimInhofe","FBI confirmed Clinton intentionally set up an unauthorized server &amp; then proceeded to ignore warnings that her system was vulnerable.",
"2016-07-05 ","17:04:55","JimInhofe","Sec. Hillary Clinton compromised our national security and has refused to be honest about her actions. https://t.co/ujyfGITksR",
"2016-02-23 ","22:26:25","JimInhofe","Bringing these terrorists from Gitmo to the U.S. will endanger any community that will house them. https://t.co/jlyLcH28U6",
"2016-02-23 ","22:25:41","JimInhofe","The president’s promise of working with Congress to close Gitmo is pure rhetoric. https://t.co/jlyLcH28U6",
"2016-02-23 ","22:25:04","JimInhofe","The president’s Gitmo announcement today is more about his legacy than ensuring the security of this nation and its people.",
"2016-02-23 ","16:06:04","JimInhofe","34 Sens, 171 Reps filed an amicus brief today seeking to overturn EPA’s legal overstep known as the Clean Power Plan https://t.co/yW3XSj9DTV",
"2015-11-30 ","17:06:17","JimInhofe","Today via @CNNOpinion I discuss why we should beware of empty climate promises made at #COP21. Read my piece here: https://t.co/Yxza1rmMoj","COP21"
"2015-10-29 ","12:21:37","JimInhofe","Will be on shortly with KSPI in Stillwater if you can tune in. My prayers remain with OSU and those impacted by last week's tragedy.",
"2015-09-29 ","18:17:51","JimInhofe","Follow @EPWMaj for live updates during the ESA briefing highlighting other Members &amp; witness comments and watch live: http://t.co/4ttbEnuhxT",
"2015-09-29 ","14:20:13","JimInhofe","According to @EPA, these enviro advancements have taken place while our nation has increased its  energy consumption by 47% @EPWMaj",
"2015-09-29 ","14:17:33","JimInhofe","Since the original Clean Air Act became law, Americans are breathing the cleanest air in decades as a result of this policy @EPWMaj",
"2015-09-29 ","14:10:59","JimInhofe","I’m eager to hear why @EPA is steamrolling ahead and requesting billions of taxpayer dollars. @EPWMaj",
"2015-09-29 ","14:10:32","JimInhofe",".@EPA  is essentially cutting corners in a shameless attempt to promote President Obama’s environmental legacy @EPWMaj",
"2015-09-29 ","14:10:08","JimInhofe",".@EPA’s proposals are based on questionable health benefits, and come with unequivocal economic costs. @EPWMaj",
"2015-09-29 ","14:09:51","JimInhofe",".@EPA ’s ozone proposal would cost as much as $1.7 trillion over the life of the proposal and result in 1.4 million lost jobs @EPWMaj",
"2015-09-29 ","14:08:48","JimInhofe",".@EPA #CPP would also only reduce global temp by 1/100th of a degree Fahrenheit and sea level rise by the thickness of 2 human hairs @EPWMaj","CPP"
"2015-09-29 ","14:08:00","JimInhofe","The final @EPA #CPP would cost hundreds of billions each year while only reducing CO2 concentrations by 0.2 percent  @EPWMaj","CPP"
"2015-09-29 ","14:06:48","JimInhofe",".@EPA’s regulatory agenda will be most harmful to low-income and minority families @EPWMaj",
"2015-09-29 ","14:06:20","JimInhofe",".@EPA regs will increase the cost of doing business in this country and will ship jobs overseas to China @EPWMaj",
"2015-09-29 ","14:05:34","JimInhofe",".@EPA regs would cost hundreds of billions leaving stakeholders with an economic burden that will take generations to pay down @EPWMaj",
"2015-09-29 ","14:04:49","JimInhofe",".@EPA is attempting to restructure our entire energy system while simultaneously controlling economic expansion @EPWMaj",
"2015-09-29 ","14:03:49","JimInhofe","NAAQS for Ozone &amp; the finalized CO2 standards for power plants are two of the most  intrusive federal regulations in history @EPWMaj",
"2015-07-14 ","21:20:38","JimInhofe",".@CoryBooker: Nice working with you to help foster kids and homeless youth. http://t.co/TALRvvG3y1",
"2015-07-14 ","17:23:09","JimInhofe","(2/2) Countries will become dependent on Iran's cheap energy, &amp; not re-impose sanctions despite a violation. Look at response to Russia.",
"2015-07-14 ","17:22:47","JimInhofe","The lifting of sanctions in Iran deal will empower Iran w/ the ability to export more of its abundant energy resources (1/2)",
"2015-07-14 ","17:20:10","JimInhofe","Reagan’s method to diplomatic negotiations was trust but verify. OAdm deal w/ Iran has no guarantee of verification.",
"2015-07-14 ","17:19:11","JimInhofe","The US-Iran agreement entangles inspection process in red tape that will ultimately result in no verification of Iran’s nuclear facilities.",
"2015-06-09 ","20:20:32","JimInhofe","Funding our military thru OCO is not optimal, but it's the only viable option that isn’t tied to political gimmicks. http://t.co/fwlWghVMYu",
"2013-07-24 ","23:36:31","JimInhofe","Today I introduced legislation that would bring natural gas vehicles on the market more quickly as a cost-efficient mode of transportation.",
"2016-09-21 ","16:53:24","SenatorLankford","I stand w/ @SenTedCruz &amp; @RepSeanDuffy. We have to stop the Obama administration's #Internet giveaway. https://t.co/j9qsjY3QTP","Internet"
"2016-09-21 ","14:30:11","SenatorLankford","The #SenateOpportunityCoalition is working on ways to reach every person, in every neighborhood, in every community. https://t.co/DehBZJn4ir","SenateOpportunityCoalition"
"2016-07-15 ","16:18:40","SenatorLankford","What has changed over the last year in Iran being the largest state sponsor of terrorism? 

Director of National Intelligence: ""Nothing.""",
"2016-07-15 ","16:08:40","SenatorLankford","Happy #Iranniversary! Oh wait... one year later &amp; #Iran continues to advance towards nuclear technology. https://t.co/lVBU8hpE6Z","Iranniversary Iran"
"2016-07-15 ","13:05:08","SenatorLankford","TUNE IN to @700Club today to watch @JenniferWishon's report. I'm looking forward to it!  https://t.co/effYnZzQNU",
"2016-07-15 ","00:36:06","SenatorLankford","My heart breaks for yet another barbaric murder of so many people in France, 8 months after Paris. #PrayforNice Terror will never win.","PrayforNice"
"2016-07-05 ","17:18:57","SenatorLankford","This is a truly alarming precedent. No one should be above the law. https://t.co/5kZwvzV5jb",
"2016-07-05 ","17:17:35","SenatorLankford","Riddle me this → despite the fact that FBI found Clinton to be ""extremely careless"" w/ classified information, she faces no consequences.",
"2016-06-10 ","16:15:32","SenatorLankford","We can solve the big issues we face by coming together &amp; leaning in as families, churches, &amp; one nation under God. https://t.co/w80ujndgN3",
"2016-06-10 ","16:13:15","SenatorLankford","I was honored to speak at @FaithandFreedom's Policy Conference this morning. Check it out HERE: https://t.co/w80ujndgN3 #RTM2016","RTM2016"
"2016-06-10 ","15:48:24","SenatorLankford","The foundation of the nation has always been our families. Gov't rises and gets bigger when families collapse. #RTM2016","RTM2016"
"2016-02-18 ","16:05:52","SenatorLankford","Pres. should reevaluate diplomatic relations w/ #Cuba &amp; #India due to their #humanrights #religiousliberty records. https://t.co/MirccFWRXt","Cuba India humanrights religiousliberty"
"2015-11-30 ","19:25:33","SenatorLankford","You can now download your own copy of #FederalFumbles on my website. Check it out and let me know what you think! https://t.co/6wxEaBBM5u","FederalFumbles"
"2015-11-30 ","18:59:10","SenatorLankford","Great to talk w/ @JennaLeeUSA about #FederalFumbles on @HappeningNow. Check out some of the examples of waste HERE: https://t.co/qlWk5oSJTv","FederalFumbles"
"2015-11-30 ","18:38:15","SenatorLankford","""Sen. Lankford picks up Coburn baton on government waste"" @burgessev via @politico https://t.co/TSnoYmpQhu",
"2015-11-30 ","16:50:38","SenatorLankford","Press conference releasing #FederalFumbles starts in 10 min. Watch it LIVE here: https://t.co/hZBvk2Rczs","FederalFumbles"
"2015-11-30 ","15:23:01","SenatorLankford","Today's the day! Here's to hoping I don't fumble #FederalFumbles at the press conference today at noon. https://t.co/M5aGsm6Vkf","FederalFumbles"
"2015-11-30 ","14:20:54","SenatorLankford","TUNE IN: I'm on @cspan @cspanwj right now talking about gov't waste. #FederalFumbles https://t.co/odT7oEpFES","FederalFumbles"
"2015-10-29 ","22:55:51","SenatorLankford","My thoughts on the #BudgetDeal. All I see is more spending &amp; no change to the status quo. https://t.co/XqBtscvE9g","BudgetDeal"
"2015-10-29 ","22:31:07","SenatorLankford","This is not a #budgetdeal that the people of Oklahoma can say fixes our debt &amp; deficit issues and certainly not one that stabilizes SSDI.","budgetdeal"
"2015-10-29 ","22:29:42","SenatorLankford","This is the #budgetdeal that's done, apparently, but not a deal that's done well. We need to do better. https://t.co/lwDNpHHZ5I","budgetdeal"
"2015-10-29 ","14:51:00","SenatorLankford","Proud to call Paul Ryan a friend. Congratulations, Mr. Speaker! @SpeakerRyan",
"2015-10-29 ","13:01:12","SenatorLankford","Bremerton School District should be ashamed for placing #CoachKennedy on administrative leave for praying on the field. #SupportCoachKennedy","CoachKennedy SupportCoachKennedy"
"2015-09-29 ","21:23:45","SenatorLankford","Met with OK reps from @AmericanCancer &amp; Coach @LonKruger advocating for #cancer research. #BoomerSooner #BeatCancer http://t.co/hzRpJevvSH","cancer BoomerSooner BeatCancer"
"2015-09-29 ","17:58:02","SenatorLankford","Check out http://t.co/UVUK1yLC2c for information about the thousands of quality #healthcare options women have besides #PlannedParenthood.","healthcare PlannedParenthood"
"2015-09-29 ","15:32:09","SenatorLankford","Happy birthday, @KDTrey5! Great to hear you're healthy--good luck this season! #ThunderUP #OKC","ThunderUP OKC"
"2015-09-29 ","15:00:29","SenatorLankford","Great to meet @CourtneyDeion, Youth of the Year Finalist with @BGCA_Clubs. Oklahoma is proud of you! #YOY http://t.co/WclWVhtCRi","YOY"
"2015-07-14 ","17:15:55","SenatorLankford","This story is hard to read, but these babies deserve to have this horrific story told. My first reaction: prayer. http://t.co/ZpE92CxYAB",
"2015-07-14 ","14:48:07","SenatorLankford","My Op-Ed on @NRO today: Judicial Deference Enables Agencies to Usurp Congress’s Legislative Power http://t.co/vb4g2KXS8g",
"2015-07-14 ","12:16:42","SenatorLankford","I remain hopeful for a diplomatic solution, but #Iran is world’s largest state-sponsor of terrorism. This is impossible to ignore. #IranDeal","Iran IranDeal"
"2015-07-14 ","12:14:43","SenatorLankford","Initial reports of #IranDeal suggest UN would have limited access to challenge inspections &amp; arms embargo would end relatively quickly.","IranDeal"
"2015-07-14 ","11:32:37","SenatorLankford","We must analyze this #IranDeal very very carefully. The leadership of #Iran has made too many threats to its neighbors &amp; the World.","IranDeal Iran"
"2015-06-15 ","21:01:30","SenatorLankford","We must fight to ensure a more reliable retirement for federal workers who devote their lives to public service http://t.co/7wn8McIbfe",
"2015-06-09 ","14:37:20","SenatorLankford","About to get started in a Homeland Security committee hearing on #TSA oversight. Watch LIVE: http://t.co/uLVO2WVq7W","TSA"
"2014-10-22 ","18:49:00","SenatorLankford","Spoke at the Governor's Water Conference on initiatives to work w/ state &amp; local officials on water conservation. http://t.co/XGNV7G0Z6v",
"2014-10-22 ","14:16:12","SenatorLankford","Filming a video this morning under the new ramp for the Crosstown Expressway about OK roads &amp; bridges for the AOGC. http://t.co/gdA6ZSoMD6",
"2014-05-21 ","17:58:34","SenatorLankford","@bennyjohnson Is that my NEW doppelgänger? http://t.co/zZgGzkkAF8 @RepMullin",
"2014-05-21 ","15:41:29","SenatorLankford","Thanks for your work MT @AARPOklahoma: @RepLankford thanks for mtg w/ us today on issues affecting older Oklahomans http://t.co/6Ge9sqNm6l",
