"Date","Time","screen_name","text","hashtags"
"2016-09-21 ","15:51:23","SenWarren",".@SenateGOP has billions of reasons to defend this rotten system - but we're sick of it &amp; ready to fight. https://t.co/acTsbKkKU4",
"2016-09-21 ","15:49:43","SenWarren","If @SenateMajLdr thinks he can hold the whole government hostage to shield donors buying off politicians, think again.",
"2016-09-21 ","15:48:32","SenWarren","We know why - billions in secret dark money is flowing into our political system, to prop up @realDonaldTrump &amp; his GOP allies in Congress.",
"2016-09-21 ","15:47:31","SenWarren","But here we go again - Republicans are threatening to shut down the gov in days unless we ban disclosure of corporate political spending.",
"2016-09-21 ","15:46:46","SenWarren","Shutting down the government isn't very popular with the American people. You'd think the Republicans would've learned that by now.",
"2016-09-21 ","00:37:16","SenWarren","If you missed my questions for @WellsFargo CEO John Stumpf on his gutless leadership earlier today, take a look. https://t.co/5brb1ARRqC",
"2016-09-21 ","00:27:19","SenWarren","Tonight I'll be talking to Rachel @Maddow about today's @SenateBanking hearing with @WellsFargo CEO John Stumpf. Tune in at 9PM ET!",
"2016-07-05 ","21:11:18","SenWarren","Today @MarkWarner, @RepCummings &amp; I sent letters to derivative clearing orgs about resolution plans if they fail. https://t.co/ly5J2cZH5V",
"2015-11-25 ","21:31:10","SenWarren",".@MassAGO is doing a great job helping students getting crushed by debt. Hope other states &amp; @usedgov are watching: https://t.co/iLPv3gYfPG",
"2015-10-29 ","19:17:48","SenWarren","Bank lobbyists &amp; their Republican friends say Dodd-Frank crushes community banks. That’s just not true. https://t.co/Yvet1rVVtc",
"2015-09-29 ","21:50:43","SenWarren","Thank you, @deray. This is important.  https://t.co/oscXnqbDKy",
"2015-09-29 ","17:01:47","SenWarren","Our office joined the #PinkOut to #StandWithPP. We won't let the GOP shut down the gov to defund women's healthcare. http://t.co/lSbIZsOpAw","PinkOut StandWithPP"
"2015-07-14 ","22:36:05","SenWarren","Happy to join @RealBankReform to discuss next wk's Dodd-Frank anniversary &amp; the unfinished work of financial reform. http://t.co/bJQYA3Glmn",
"2015-07-14 ","19:59:57","SenWarren","The @US_FDA must move toward a blood donor policy based on risk, not sexual orientation. Read our letter: http://t.co/5F1rRN9Y45",
"2015-07-14 ","15:57:42","SenWarren","I look forward to reviewing the details of this Iran agreement to determine whether they are tough, verifiable, and effective.",
"2015-07-14 ","15:57:15","SenWarren",".@POTUS, @JohnKerry &amp; @ErnestMoniz deserve great credit for working with our allies to reach a negotiated solution without military action.",
"2015-07-14 ","15:56:52","SenWarren","Diplomacy is our best hope of ending the threat of a nuclear-armed Iran, far better than the alternative of escalating tensions &amp; war.",
"2014-05-21 ","21:13:01","SenWarren","I joined @SenatorBoxer, @SenWhitehouse &amp; colleagues today to #SoundTheAlarm4Climate #ActOnClimate http://t.co/3olW6LpM4l","SoundTheAlarm4Climate ActOnClimate"
"2014-05-21 ","16:11:01","SenWarren","RT if you agree. We must #ActOnClimate now to build a better future for ourselves &amp; our kids. #SoundTheAlarm4Climate http://t.co/wvSwfudICO","ActOnClimate SoundTheAlarm4Climate"
"2014-04-01 ","19:00:33","SenWarren","It’s obscene the govt charges more interest than needed to run the student loan program - students deserve a #refund https://t.co/879yawKlPI","refund"
"2013-06-05 ","19:51:42","SenWarren","Welcoming MA students to Capitol Hill on #StudentDebtDay #DontDoubleMyRate #ItsOurInterest #BankonStudents http://t.co/0GQ3SkhnJR","StudentDebtDay DontDoubleMyRate ItsOurInterest BankonStudents"
"2013-06-05 ","15:11:37","SenWarren","Low student loan rates are good for our economy and the middle class. It’s time to #BankonStudents #StudentDebtDay #DontDoubleMyRate","BankonStudents StudentDebtDay DontDoubleMyRate"
"2016-09-21 ","16:14:14","JohnKerry","This is a moment of truth in #Syria, for Russia &amp; the regime, for opposition, for international community. Cannot let spoilers prevail.","Syria"
"2016-07-15 ","21:34:57","JohnKerry","Yesterday &amp; today in Moscow, held discussions on #Syria, #Ukraine &amp; other key issues w/ President Putin &amp; FM Lavrov. https://t.co/pFcm28GQqt","Syria Ukraine"
"2016-07-15 ","21:29:46","JohnKerry","Signed condolence book at @FranceEnRussie w/ FM Lavrov. We stand w/ people of #France after horrific #NiceAttack. https://t.co/DQqq9VYO2L","France NiceAttack"
"2016-02-23 ","15:22:17","JohnKerry","Chance to highlight what our nation’s diplomats accomplish everyday with the 1% of the federal budget dedicated to foreign assistance.",
"2016-02-23 ","15:21:11","JohnKerry","Looking forward to #SFRC budget hearing today. Appreciate opportunity to speak about @StateDept budget and priorities.","SFRC"
"2016-02-23 ","04:07:44","JohnKerry",".@PresidentAoun Looking forward to heading back to Boston to address next generation of leaders @Northeastern. #GoNU https://t.co/1NJpR8S4Cs","GoNU"
"2016-02-18 ","21:53:01","JohnKerry","Met w/ #Cuba Foreign Trade &amp; Investment Minister Malmierca today, as US continues to normalize diplomatic relations. https://t.co/jQcdgKnYvT","Cuba"
"2016-02-18 ","21:50:22","JohnKerry","Good to see FM Mezouar today. US &amp; #Morocco committed partners on empowering entrepreneurs, defeating #Daesh &amp; more. https://t.co/NLzyzySAJe","Morocco Daesh"
"2015-11-30 ","17:51:13","JohnKerry","Pleased to join @fhollande and @narendramodi for Solar Mission launch at #COP21; #France, #India critical partners on #climate.","COP21 France India climate"
"2015-11-30 ","17:48:45","JohnKerry","As @BillGates made clear at #COP21, #climatechange not only a challenge, but also opportunity for innovators to build clean energy future.","COP21 climatechange"
"2015-11-30 ","17:47:48","JohnKerry","Applaud @BillGates' announcement of world's largest clean energy research and development partnership. https://t.co/hw1c3X3QuA",
"2015-11-30 ","14:05:15","JohnKerry","US &amp; 10 other nations just announced nearly $250M for Least Developed Countries Fund - help those in need with #climate adaptation. #COP21","climate COP21"
"2015-11-30 ","05:30:07","JohnKerry","Honored to join @POTUS at #COP21. No U.S. President has done more to #ActOnClimate. Read his climate action plan: https://t.co/GSTO6Bfwhj.","COP21 ActOnClimate"
"2015-11-25 ","01:16:55","JohnKerry","U.S. is committed to two states with two peoples living side by side in peace and security, and will continue to work to achieve that end.",
"2015-11-25 ","01:15:11","JohnKerry","Productive talk w/Pres.Abbas. Discussed efforts to end violence, restore confidence in viability of 2 state solution https://t.co/T2TGs6LeZS",
"2015-11-25 ","01:08:54","JohnKerry","Pleased to speak w/@presidentruvi today. Discussed strengthening robust security cooperation between U.S. &amp; #Israel. https://t.co/ZkVKyUx3nL","Israel"
"2015-11-25 ","01:02:52","JohnKerry","Conversation w/ @netanyahu also focused on priorities of defeating Daesh &amp; bringing political transition to #Syria. https://t.co/uEJj0Qv7gA","Syria"
"2015-11-25 ","00:57:23","JohnKerry","No people anywhere should live w/daily violence. Spoke to @netanyahu about recent acts of terror, expressed condolences to those affected.",
"2015-09-29 ","21:46:51","JohnKerry","Great talking w/so many counterparts about #climatechange at Major Economies Forum. Impt to keep working tough issues in @COP21 lead-up.","climatechange"
"2015-09-29 ","18:42:02","JohnKerry","Eliminating ISIL will take time, but, as @POTUS said, #CVE Summit today marked emergence of movement united in degrading, destroying ISIL.","CVE"
"2015-09-29 ","18:40:10","JohnKerry","Great to hear, @JohnKeyPM. Look forward to hearing more news from #NewZealand next week at #OurOcean2015. https://t.co/H6WVxZZQnd","NewZealand OurOcean2015"
"2015-09-29 ","02:34:37","JohnKerry","Good meeting with P5+1 colleagues and #Iran on implementation of @TheIranDeal. http://t.co/5x2vLZLak9","Iran"
"2015-07-14 ","11:10:29","JohnKerry","Agreement is a step away from specter of conflict, towards possibility of peace. This is the good deal we have sought http://t.co/JY9YSZrPQs",
"2015-07-14 ","11:03:19","JohnKerry","P5+1 &amp; #Iran reached agreement, bringing insight &amp; accountability to nuclear program - not for small # of yrs, but lifetime of program.","Iran"
"2015-06-09 ","21:51:38","JohnKerry","Feeling good a week after surgery. Good chats today w/@AmbassadorRice &amp; @StateDept senior team. The work continues! http://t.co/TzRpR0khQs",
"2014-10-22 ","16:23:38","JohnKerry","Good discussions w/ Chancellor #Merkel this morning in Berlin. #Germany such a vital partner. http://t.co/RqQ3GkXQUN","Merkel Germany"
"2014-10-22 ","15:40:23","JohnKerry","Joined FM #Steinmeier for moving visit to #BerlinWall Memorial/25th anniversary of Fall next month. http://t.co/QYTS4BSS4t","Steinmeier BerlinWall"
"2014-10-22 ","14:29:41","JohnKerry","Missing Ben Bradlee – America’s Editor In Chief/ @washingtonpost legend/remarkable person and we’re all thinking of @sallyquinndc",
"2014-05-21 ","22:10:12","JohnKerry","Sat down w/ Pres. @EPN earlier – we covered range of issues that we’ll keep working together on: trade, education http://t.co/SIzDyJOn34",
"2014-05-21 ","15:16:55","JohnKerry","Wheels down in Mexico City - look fwd to talking US-Mexico partnership w/ my friend @JoseAMeadeK.",
"2014-04-01 ","21:30:29","JohnKerry","After @NATO mtgs wrapped up today, talked again w/ Acting FM @AndriiDesh. No decisions about #Ukraine without Ukraine http://t.co/y7M1hCWHF4","Ukraine"
"2014-04-01 ","16:52:39","JohnKerry","Good to join @AndersFoghR in #Brussels today to mark milestones for @NATO alliance. http://t.co/8nvvB2kPde","Brussels"
"2014-02-18 ","17:38:59","JohnKerry","Mtgs in #Tunisia w @Moncef_Marzouki &amp;PM Joma’a.Prgrss made/wrk ahead for #peace #stability-US stands by ppl of #Tunisia makng democracy work","Tunisia peace stability Tunisia"
"2014-02-18 ","14:09:22","JohnKerry",".@HonJohnBaird you're on-happy to bck it up w @SamuelAdamsBeer-way #TeamUSA's playing could be deja vu all over again http://t.co/UyEhhhEdfZ","TeamUSA"
"2012-12-12 ","16:55:45","JohnKerry","@WalterGa Big reform/big changes/delay gives time to transition right",
